id,text,ok,comments
letter_image10_fear1_answer1,"I understand the feelings of exhaustion and unfairness that you are experiencing with regards to ensuring the safety of your loved ones. It can be quite overwhelming to think about all the necessary precautions and it can make one feel as though they are carrying the weight of the world on their shoulders. However, it is important to remember that you are not alone in this task and that there are many resources available to assist you in ensuring the safety of those you love."
letter_image10_fear1_answer1,"I understand the sense of responsibility and care that you feel towards the safety and well-being of yourself and those around you. As an artist, I too have experienced the weight of expectation and the desire to create something that is both meaningful and beautiful. However, it is important to remember that perfection is an unattainable goal, and the pursuit of it can be a source of great exhaustion and frustration.",[],"I do not think artits in general want to create something ""beautiful"" maybe ""meaningful"" is sufficent...?"
letter_image10_fear1_answer2,"I was intrigued by your response to my proposal that ""Art presents riddles that could not be solved by everyone"". It is refreshing to see that you are confident in your ability to handle any potential dangers and that you value safety precautions. Your statement about violence being a distant memory and your willingness to dedicate time to ensure your well-being is commendable.",[],Does this letter match the given answers?
letter_image10_fear1_answer2,"It is good to hear that you are living in a peaceful environment, and I am pleased to hear that you are confident in your ability to protect yourself. However, as Ehrenstrahl, I must remind you that safety precautions should always be taken, and dedicating time to ensure your well-being is a wise decision.",[],"The phrase ""as Ehrenstrahl"" is a bit strange...."
letter_image10_fear1_answer3,"I believe that art has the power to heal and provide a platform for people to express their experiences and emotions. Through my paintings and sculptures, I aim to bring attention to important social issues and raise awareness about them. I hope that you will also find ways to express your experiences and emotions, whether it be through art, writing, or any other creative outlet."
letter_image10_fear1_answer3,"I encourage you, dear [Your Name], to continue to explore your artistic talents and to use them as a means of expression, healing, and connection with others. Your experiences, though painful, can serve as a vital source of inspiration and insight in your creative pursuits.",[],"We do not include individual names of our user, right?"
letter_image10_fear2_answer1,"I understand your hesitation in embracing your inner fashionista, as it is often viewed as shallow or superficial. However, I believe that fashion can be a means of self-expression and empowerment. It is important to find a balance between staying true to oneself and embracing new experiences, such as exploring different fashion styles."
letter_image10_fear2_answer1,"I understand your hesitation in embracing your inner fashionista. It is natural to be cautious when it comes to the perceptions of others. However, I urge you to consider that art presents riddles that cannot be solved by everyone. In other words, finding one's personal style, or inner fashionista, is not only about pleasing others but also about self-expression and personal growth."
letter_image10_fear2_answer2,"I am truly impressed with your understanding of the challenges that women have faced throughout history, and your desire to empower them. As an artist, I have always believed that art has the power to inspire change and bring people together. Your rephrased statement is a beautiful example of how art can be used to create a more supportive and nurturing environment for all women."
letter_image10_fear2_answer2,"Your statement that you are not afraid to die, alone, and old is a testament to your resilience and your ability to face the unknown. It is important to embrace life, but it is equally important to prepare for the end. Death is a natural part of life, and it is only through acceptance and understanding that we can find peace in the face of the unknown."
letter_image10_fear2_answer3,"However, I must caution you that the question of gender equality is a complex and multifaceted issue that requires careful consideration and thought. It is not enough to simply have a desire to make a difference; one must also have a deep understanding of the underlying causes and mechanisms that perpetuate gender inequality."
letter_image10_fear2_answer3,"I understand that the question you presented may have been complex and difficult for you to grasp. However, as an artist and a nobleman, I have spent my life studying and mastering the art of portrait painting and allegorical motifs. I believe that with dedication and perseverance, one can overcome any obstacle and understand the complexity of a question.",[],The user does not present questions....
letter_image10_fear5_answer1,"As artists, we must be willing to take risks and push ourselves beyond our comfort zones. We must be willing to challenge ourselves, to test our skills and abilities, and to push ourselves to be better than we were yesterday. But we must also be mindful that fear can hold us back, and that it is only by confronting that fear that we can truly unlock our full potential."
letter_image10_fear5_answer1,I am truly impressed by your dedication and passion for adventure and overcoming fear. It is indeed a remarkable trait to embrace fear as it is what makes life truly exciting and adventurous. I wholeheartedly agree that life is a series of challenges and it is the fear of not attempting that makes the journey truly worthwhile.
letter_image10_fear5_answer2,"Art, like life, is full of challenges and fears. It is through these challenges that we grow and learn, and it is through our ability to overcome these fears that we truly excel. I commend you on your bravery and determination, and I am confident that you will continue to thrive as you face new challenges and conquer old fears."
letter_image10_fear5_answer2,"Your words have given me much to think about, and I am grateful for your insight and inspiration. I hope that you will continue to embrace challenges with courage and determination, and that you will always remember that the rewards of overcoming fear are worth the risk."
letter_image10_fear5_answer3,"However, as you have eloquently put it, ""I am always curious to explore new situations and experiences."" This curiosity has driven me to continually challenge myself and expand my artistic horizons. It is through exploring new environments and experiencing different situations that I have been able to grow as an artist and push the boundaries of what is considered possible in the world of art."
letter_image10_fear5_answer3,"I received your letter and was intrigued by your thoughts on the allure of the familiar and comfortable. As an artist, I understand the desire to seek refuge in the embrace of the known, for it is often the foundation upon which our creativity and growth are built. However, I also believe that it is through venturing beyond the familiar, embracing the uncertain, and confronting the uncomfortable that we truly come into our own as individuals and artists.",[],"Wrong perspective, the user receives the letter not the artist."
letter_image11_shame3_answer1,"As someone who has also experienced moments of uncertainty and self-doubt, I understand the importance of finding ways to overcome these feelings and embrace one's authentic self. I encourage you to take the time to reflect on what brings you joy and fulfillment in life, and to seek support from friends, family, or professionals if needed."
letter_image11_shame3_answer1,"Your words have touched me deeply, and I am inspired by your courage in embracing your authentic self. It is often said that we are our own worst critic, but it is also true that we can be our own greatest supporter. I encourage you to continue embracing who you are, flaws and all, and to let go of any feelings of inadequacy or self-doubt. Remember that shame is a heavy burden to carry, but it is also a choice. Choose to let it go, and embrace the freedom that comes with being true to yourself."
letter_image11_shame3_answer2,"I find your dedication to being present in the moment and genuinely presenting yourself, even in vulnerable moments, to be a noble and admirable trait. As an artist, I understand the importance of truly capturing a subject, whether it be a person, a scene, or an emotion. It is through vulnerability and genuine connection that we are able to truly see and understand one another."
letter_image11_shame3_answer2,"It is with great interest that I have read your words, expressing your desire to present yourself honestly and genuinely even when experiencing feelings of embarrassment or discomfort. I must say, it is a trait that I admire in an individual, for it is only by being true to oneself that one can truly grow and learn from experiences."
letter_image11_shame3_answer3,"I was deeply moved by your letter and the raw honesty with which you expressed your struggles with shame. It is a familiar feeling, one that I too have grappled with throughout my life. But I have come to realize that our struggles with shame and self-doubt are precisely what make us who we are, and that it is only by embracing these parts of ourselves that we can truly find freedom and authenticity.",[],"Wrong perspective, the user receives the letter not the artist. "
letter_image11_shame3_answer3,"I was deeply moved by your words, and I must say that your spirit and determination are truly admirable. Shame should never define us, and it is commendable that you are taking steps to overcome it. Life is full of challenges, and it takes a great deal of courage to face them head-on."
letter_image11_shame4_answer1
letter_image11_shame4_answer1,"You have shown great courage in admitting your past mistakes and taking responsibility for them. It is important to recognize that we all make mistakes, and what truly matters is how we learn from them and strive to do better in the future."
letter_image11_shame4_answer2,"I understand the feelings of disgrace, haunting, and humiliation that you must be experiencing. It is important to remember that we all make choices in our lives, and not every choice leads to success or happiness. It is also important to understand that the ability to manage one's career and finances is a skill that can be learned and improved upon with time and effort."
letter_image11_shame4_answer2,"You have mentioned your interest in art and culture, and I would encourage you to pursue these passions with vigor and conviction. Seek out the guidance and support of experienced professionals in your field, and be open to constructive criticism and advice."
letter_image11_shame4_answer3,"I am in receipt of your letter, and I must say that I am impressed by your level of self-assurance in your decisions. It is not often that I come across individuals who are not afraid to face the consequences of their actions. As for the judgments of others, I believe that each person must be true to themselves and make decisions based on their own beliefs and values.",[],"Wrong perspective, the artist writes the letter to the user."
letter_image11_shame4_answer3,"Your words have touched me deeply. They are a reflection of your strength of character and your commitment to living a life that is true to your beliefs and values. I, too, have always believed in facing the consequences of my actions and decisions, and have tried to do so with courage and integrity."
letter_image11_shame5_answer1,"I have received your letter and find the statements you've made quite interesting. It seems you believe guilt is inherent and that shame is innate. While I can appreciate your thoughts, I must clarify that I cannot fully agree with your beliefs. It is important to note that individuals, and not some inherent trait, shape our feelings and actions.",[],"Wrong perspective, the artist writes the letter to the user."
letter_image11_shame5_answer1,"Throughout my life, I have traveled extensively to places such as London, Paris, the Balkans, Spain, Italy, and the United States. These experiences allowed me to develop my skills as a portrait painter, enabling me to capture the individual character of my subjects. I was honored to have painted three American Presidents: Grover Cleveland, William H. Taft, and Theodore Roosevelt, among others.",[],Useless answer. 
letter_image11_shame5_answer2,"I must say that I find your views on the socially constructed nature of shame to be both intriguing and thought-provoking. It is indeed true that shame has been used throughout history to control and manipulate individuals, often for the benefit of those with financial and political power. However, I also believe that shame can be used as a tool for personal growth and self-improvement. In my own life, I have found that experiencing and acknowledging my own shame has been a powerful motivator for positive change."
letter_image11_shame5_answer2,"Secondly, I believe that shame is indeed a socially constructed emotion, designed to manipulate and control the masses. It is often used to reinforce societal norms and values, and to maintain the status quo. However, as you have pointed out, this can perpetuate a cycle of oppression and marginalization, which is detrimental to society as a whole.",[],Secondly means that there is something other first...
letter_image11_shame5_answer3,"As a painter, I have often been drawn to the human figure and the intricate emotions that drive us. The act of painting a portrait is, in many ways, an act of empathy and understanding, as the artist seeks to capture not only the external appearance of the subject, but also the inner spirit and emotions that shape their character."
letter_image11_shame5_answer3,"I find your words profound and wise, for it is only by accepting and releasing the burdens that weigh us down that we can truly live. I must confess that I, too, have struggled with the weight of shame, both inherent and self-inflicted, throughout my life. However, I have come to realize that the only way to overcome this burden is to confront it head-on and let it go."
letter_image12_shame1_answer1,"I have received your correspondence and have given it great consideration. Your words demonstrate a strong sense of determination and an unwavering dedication to self-improvement, which are qualities that I have always admired in my fellow artists. As one who has also strived throughout his life to push the boundaries of his craft, I can appreciate the effort you have put into cultivating your passion and talent."
letter_image12_shame1_answer1,"I received your letter with great interest. It is not often that I am presented with such a thought-provoking perspective on the role of shame in personal growth and improvement. I must admit that I was initially skeptical of your claims, but after giving them some careful consideration, I am now inclined to believe that a healthy sense of shame can indeed serve as a powerful motivator for self-improvement.",[],"Wrong perspective, the artist writes the letter to the user."
letter_image12_shame1_answer2,"However, I also understand that we have the power to overcome our past and use it to our advantage. Your words have reminded me of the importance of growth and resilience in the face of adversity. As artists, we have the responsibility to take our experiences and use them to create something beautiful and meaningful. It is through our work that we can share our stories and connect with others in a profound way."
letter_image12_shame1_answer2,"It is important to acknowledge the growth and experiences that you have gained from your past, as these can be valuable in understanding who you are today and who you wish to be tomorrow. The guilt can be a reminder of the mistakes made, but it is up to you to determine if it is productive or not."
letter_image12_shame1_answer3,I have received your letter and I am glad to hear that you are able to maintain a calm and level-headed demeanor in the face of adversity. It is important to remember that setbacks and failures are a part of life and that it is how we respond to them that truly defines us.,[],"Wrong perspective, the artist writes the letter to the user."
letter_image12_shame1_answer3,I received your letter and appreciate your honesty in sharing your thoughts and feelings with me. It is admirable that you have developed a strong sense of self-worth and are able to remain calm and level-headed in the face of criticism or judgment. These qualities are essential for success and can help you navigate difficult situations with grace and composure.,[],"Wrong perspective, the artist writes the letter to the user."
letter_image12_shame2_answer1,"I am humbled to hear of your journey towards self-improvement, and the imperfections of your body do not hinder you from reaching your goals. It is important to remember that everyone has their own struggles, and it is how we overcome them that truly defines us. Keep pushing forward and do not let the imperfections of your body bring you down. Remember, art is not just about perfection, but about the message and emotion it conveys. Keep striving to be the best version of yourself, and let your art speak for itself."
letter_image12_shame2_answer1,"I want to assure you that your worth and value as a person is not determined by your physical appearance. Your unique qualities and attributes are what make you special, and it is important to focus on these positive qualities. By embracing and accepting these qualities, you can overcome feelings of insecurity and cultivate a healthier, more confident self-image."
letter_image12_shame2_answer2,"I was deeply moved by your letter expressing your struggles with your financial situation and living conditions. As a fellow artist and a member of this community, I understand the challenges that come with pursuing a life in the arts. The unpredictable nature of commissions and the often-meager returns on one's labor can make it difficult to maintain stability and security, let alone improve one's living conditions.",[],"Wrong perspective, the artist writes the letter to the user. Where does the term ""fellow artist"" com from?"
letter_image12_shame2_answer2,"It is important to be honest with oneself about one's financial situation, as it is a key factor in being able to address it effectively. I encourage you to make a budget and to seek professional help if necessary. It is also important to be proactive in finding ways to increase your income."
letter_image12_shame2_answer3,"I was deeply troubled to hear of your distress regarding your inability to effectively manage your time and prioritize your responsibilities. As an artist, I understand the importance of dedication and focus in order to create masterpieces. However, I also understand that life outside of art can be just as important, if not more so at times."
letter_image12_shame2_answer3,I would encourage you to take a step back and assess your priorities. Identify what is truly important to you and focus your energy accordingly. It can also be helpful to establish routines and create a structured environment that supports your goals.
letter_image12_shame3_answer1,"I received your letter and was deeply moved by your words. As an artist, I know that the process of self-discovery and the pursuit of authenticity is a lifelong journey. I understand the struggles you face with feelings of inadequacy and self-doubt, and the burden of shame. I want to tell you that you are not alone in this journey, and that you are capable of overcoming these obstacles.",[],"Wrong perspective, the artist writes the letter to the user."
letter_image12_shame3_answer1,"It is important to challenge these negative thoughts and to focus on your strengths. It is also important to seek help from those around you, such as friends, family, or even professionals, who can offer guidance and support. Remember that everyone goes through difficult times, and the key is to not let these moments define you, but to use them as opportunities for growth and improvement."
letter_image12_shame3_answer2,"I am Cornelis Cornelisz. van Harlem, the Dutch Golden Age painter and draughtsman, known for my portraits and mythological and Biblical subjects. I understand your desire to be present in the moment with complete vulnerability and to present yourself genuinely and honestly, even in difficult emotional situations. This is something I strive for in my own art as well.",[],Wrong namespelling and weird introduction of the artist.
letter_image12_shame3_answer2,"I received your letter and I appreciate your honesty in sharing your thoughts and feelings. As an artist, I understand the value of genuine expression and the importance of being true to oneself. It is commendable that you strive to present yourself honestly and genuinely, even in difficult situations.",[],"Wrong perspective, the artist writes the letter to the user."
letter_image12_shame3_answer3,"I have received your letter and I am touched by your words. It is evident that you are a strong individual, and I admire your determination to break free from the shackles of shame. As a painter, I understand the power of art in conveying messages and creating a sense of identity. It is commendable that you are using your artistic abilities to express yourself and overcome the challenges you face.",[],"Wrong perspective, the artist writes the letter to the user."
letter_image12_shame3_answer3,"I was deeply touched by your letter, and I wanted to take this opportunity to respond to your thoughts and feelings. I understand that you have struggled with feelings of inadequacy and have been unable to fully embrace your true self due to a deep-seated sense of shame. I want you to know that you are not alone in this struggle, and that many people have experienced similar feelings throughout history.",[],"Wrong perspective, the artist writes the letter to the user."
letter_image13_shame1_answer1,"I am touched by your words and your belief in the power of shame for personal growth and improvement. As someone who has experienced great success and failure in life, I can attest to the power of embracing one's feelings of embarrassment and regret to spur change and self-improvement. I have found that these uncomfortable emotions can serve as a catalyst for growth, pushing me to overcome my shortcomings and strive towards becoming a better version of myself."
letter_image13_shame1_answer1,"Instead, I would suggest focusing on your strengths and celebrating your achievements, no matter how small. This can help to build self-confidence and a sense of accomplishment, which in turn can fuel your passion for self-improvement. Additionally, it is important to remember that self-improvement is a lifelong journey and that setbacks are a normal part of the process."
letter_image13_shame1_answer2,"As someone who has faced numerous challenges and obstacles throughout my life, I understand the importance of perseverance, resilience, and the power of embracing new opportunities. I am confident that your positive attitude and determination will continue to serve you well in all aspects of your life."
letter_image13_shame1_answer2,"I have received your letter and I must say that it touched me deeply. It is clear that you are struggling with your past and the guilt that comes with it. I understand that it can be difficult to overcome these feelings, but I want to assure you that it is possible to move forward and find peace.",[],"Wrong perspective, the artist writes the letter to the user. Wrong feeling as well. "
letter_image13_shame1_answer3,"I have received your letter and I must say that I was intrigued by your statements regarding your ability to maintain a calm and level-headed demeanor in the face of embarrassment or humiliation. As a fellow human being, I can appreciate the challenges that one may face in such situations. However, it is important to remember that it is not the embarrassment or humiliation that define us, but rather how we choose to react to them.",[],"Wrong perspective, the artist writes the letter to the user. Fellow human being???"
letter_image13_shame1_answer3,"Your letter has reached me, and I must say that I am intrigued by your statements. It is not often that I come across individuals who are impervious to shame and able to maintain a calm and level-headed demeanor in the face of criticism or judgment. I must admit that your unwavering sense of self-worth is something to be admired, and it is a trait that I believe can be useful in certain situations.",[],"Wrong perspective, the artist writes the letter to the user."
letter_image13_shame4_answer1,"I received your letter, and I must say that I was deeply moved by the sincerity and reflection in your words. It is not often that one receives such a heartfelt apology, and I appreciate the time and effort you have put into acknowledging the harm caused by your actions.",[],"Wrong perspective, the artist writes the letter to the user."
letter_image13_shame4_answer1,"It is good to receive your letter and to hear your regrets about the past decisions you made that may have caused harm to others. Life is full of choices, and not all of them are easy. It is important to recognize when we have made a wrong decision, and to take steps to make things right.",[],"Wrong perspective, the artist writes the letter to the user."
