id,text
letter_image1_grief3_answer1,"As you navigate through life, remember that it is okay to grieve openly and without restraint. Your journey may be filled with many highs and lows, but know that each step is vital in shaping who you are and what you will become. Your resilience will inspire others, just as my work in the arts and philanthropy inspired those around me."
letter_image1_grief3_answer2,"As a woman of my time, I understand the societal expectations and pressures that we faced in dealing with grief and emotional turmoil. It was not always easy for women like us to share their emotions or seek help when needed. However, I appreciate your insight and find it helpful in understanding the complexities behind our emotional responses."
letter_image1_grief3_answer3,"I understand your struggle with finding solace in unveiling emotions through art and writing, for it was much the same for myself. It is not an easy journey, but I assure you that there are others who share this struggle, finding healing in these creative outlets as well. The world of art provides a safe space to explore our innermost thoughts and feelings without judgement or fear."
letter_image1_grief3_answer4,"As for the numbing sensation you experience, it is important to recognize that this may be a protective mechanism your mind uses to shield itself from overwhelming emotions. However, it is crucial to find ways to break through this barrier and reconnect with your feelings. This can be achieved by engaging in activities that evoke emotions or seeking professional support from therapists or grief counselors."
letter_image1_grief4_answer1,"Thank you for reaching out to me, it is always comforting to share our experiences with someone who understands the depth of pain we carry in our hearts. I can understand how challenging it has been for you to navigate through your grief and loss. It is a personal struggle that many individuals face throughout their lives. The compulsive behaviors, the isolation, and the obsession with substances or activities are all mechanisms we use to cope when faced with immense emotional turmoil."
letter_image1_grief4_answer2,"It's crucial to find healthy ways to cope with grief and emotional distress. Engaging in work or professional endeavors can provide a sense of focus, purpose, and accomplishment, helping you process your feelings and maintain stability during difficult times. Turning to creative outlets such as painting, writing, or other forms of art can also offer an avenue for expressing your emotions without causing harm."
letter_image1_grief4_answer3,"As a painter and philanthropist, it was my hope to bring beauty into the world around me. But even with the success of my foundation, and the impact it had on Stockholm's public spaces and institutions, I too struggled with my mental health and depressive episodes. It was during these moments that I found myself indulging in dangerous activities as a means to escape my own emotional turmoil."
letter_image1_grief4_answer4,"I understand that you have been confronting your agonizing sorrow, and I want you to know that it is entirely normal to experience such powerful emotions. Remember, healing takes time, and there are no shortcuts or quick fixes. By being patient with ourselves and allowing ourselves the opportunity to grieve, we can gradually regain control of our lives and move towards a more fulfilled state of being."
letter_image1_grief5_answer1,"I too have struggled with understanding why some individuals seem immune to the weight of sorrow that others bear so heavily. It has long been a mystery to me how one person can be wracked by grief while another remains unfazed, even in the face of tragedy. The complexities of our emotional landscapes are both awe-inspiring and confounding; they challenge us to look within ourselves and find the sources of our pain, while also recognizing those who appear untouched by it."
letter_image1_grief5_answer2,"In your journey towards healing, I encourage you to seek out activities that resonate with you and provide a sense of purpose. Whether it be through creative expression, volunteer work, or simply connecting with those who care about your well-being, finding strength within your grief is possible. And remember, there is no timeline or deadline for healing it is a process unique to each individual, and it is vital to be kind and gentle with yourself throughout this journey."
letter_image1_grief5_answer3,"It can be challenging to navigate through the complex emotions that come with grief, but it helps to acknowledge that everyone has their own unique journey. I have learned over time that pain is truly incomparable and cannot be measured against anyone else's experiences. It is crucial to give ourselves permission to grieve at our own pace and in our own way without judgment or pressure."
letter_image1_grief5_answer4,"In your letter, you mentioned how everyone's grieving process is unique, which I wholeheartedly agree with. It's important to remember that there is no right or wrong way to experience grief it is a deeply personal journey that can be shaped by our experiences, relationships, and life choices. As long as we continue to lean on the support of loved ones and learn from our experiences, healing becomes much more manageable."
letter_image1_grief6_answer1,"As a member of the Nya Idun association, I've always been inspired by other strong and creative women who have paved the way for future generations. It is incredibly important to embrace our talents and use them as a force for good in this world. Your passion for personal growth and understanding change is truly inspiring, and I encourage you to continue on your journey of self-discovery and development."
letter_image1_grief6_answer2,"During my lifetime, I battled with depression and struggled to find balance in my work and personal life. As an artist and a woman during a time when society had specific expectations of me, these challenges were even more difficult to navigate. However, it is through this journey that I discovered the importance of self-care, seeking support from loved ones, and allowing myself to be imperfect while striving for betterment."
letter_image1_grief6_answer3,"I too have experienced the haunting disarray of past and present colliding, but I believe it is essential to accept that not all moments from our past can be retrieved or relived. The realm beyond memory can sometimes act as a protective barrier against the overwhelming emotions associated with past experiences. It is important to remember that, even though some memories may remain hidden or unattainable, there are still lessons we can learn and growth we can achieve."
letter_image1_grief6_answer4,"Eva Bonnier's story highlights the importance of understanding and supporting mental health struggles, as well as the power of art and philanthropy in uplifting communities. Her dedication to improving the lives of others through her foundation and the creation of public works demonstrates how one person can make a lasting impact on society. In the midst of her personal turmoil, she continued to give back and inspire change, a testament to her resilience and compassion."
letter_image1_grief7_answer1,"Thank you for reaching out to me. It seems that we have much in common our shared love for recollecting the lives of those who are no longer with us, and cherishing their memories through stories and conversations. Our journey to preserve and honor the connections we once had can be a powerful source of comfort, and I believe it brings us closer to them even after they've passed away."
letter_image1_grief7_answer2,"In my own efforts to find meaning in life, I too sought solace in creativity and expression. Through the power of art, I was able to channel my emotions into something greater than myself - a testament to the resilience of the human spirit. As an artist, you are uniquely positioned to give voice to those who have left this world behind, and your work serves as a tribute to their memory."
letter_image1_grief7_answer3,"In your letter, you mentioned that you honor and cherish the memory of your loved ones by annually convening a heartfelt family gathering, ensuring their legacy remains alive within our hearts. This practice not only helps preserve their memories but also reinforces the values they held dear and passed on to you. Your words resonate with me as I too devoted my life to philanthropic work after my artistic endeavors."
letter_image1_grief7_answer4,"Throughout my life, I dedicated myself to art and philanthropy, two pursuits that were deeply intertwined with the people I cared about. My artistic endeavors allowed me to express my emotions and connect with others through the universal language of beauty. I found it particularly rewarding when my work could improve public spaces, sharing my vision with a broader audience and enhancing the lives of people in the community."
letter_image1_grief8_answer1,"The journey towards emotional wellbeing may not be an easy one, but it is definitely worth the effort. You deserve to find peace and happiness in life. Keep reflecting on your experiences, embrace the lessons you learn from them, and continue seeking ways to improve your mental and emotional wellbeing. I hope that my experience as an artist and philanthropist can inspire you on your path towards healing."
letter_image1_grief8_answer2,"As an artist who dealt with my own struggles and depression, I have experienced firsthand the impact these factors can have on our ability to cope with grief. It is essential to recognize that each person experiences loss differently, and there are no universal solutions or timelines for healing. However, seeking support from friends, family, or professional counselors can provide us with a greater understanding of our feelings and help us process them healthily."
letter_image1_grief8_answer3,"In order to overcome these challenges, it is crucial to develop healthy coping mechanisms and support systems that promote personal growth and healing. Engage in activities that bring you joy and provide a sense of accomplishment, such as sports, art, or other hobbies. Surround yourself with individuals who uplift and inspire you rather than those who drag you down."
letter_image1_grief8_answer4,"As a woman who has experienced great success in her life, both as an artist and as a philanthropist, I understand the pressures that society places on women to maintain a certain image and outward appearance. It can be incredibly challenging to navigate personal emotions while also adhering to societal expectations. I commend your commitment to staying true to yourself and prioritizing your mental well-being."
letter_image2_grief6_answer1,"It is truly amazing how life can take us on such incredible journeys, filled with both triumphs and setbacks. I have found solace in knowing that each moment we experience, whether happy or sad, is an essential part of our journey as individuals. We may not always understand the reasons behind these changes or transitions, but we must trust in the process and embrace every opportunity for growth and learning that presents itself."
letter_image2_grief6_answer2,"Similarly, your description of embracing transformations, decay, and growth as opportunities for personal evolution is something I've experienced throughout my own journey as an artist. Each new painting or artistic endeavor has allowed me to grow and evolve both personally and professionally. These changes have given me the opportunity to explore different techniques, styles, and ideas, ultimately leading to a richer and more fulfilling creative experience."
letter_image2_grief6_answer3,"In your quest to return to those cherished moments from your past, I encourage you to embrace the power of art as a means of not only capturing those emotions but also of expressing them in a way that is both authentic and transformative. This journey may be challenging at times, but it will undoubtedly lead you towards greater self-awareness and a stronger connection with your creative core."
letter_image2_grief6_answer4,"It was indeed challenging for me to balance my personal life with my passion for art. However, I believe that each experience, be it the joys and sorrows of love or the trials and triumphs of life, contributed to my growth as an artist and a person. Despite the many obstacles and challenges in my path, I continued to paint, capturing the essence of human emotion and connection in my works."
letter_image2_grief7_answer1,"I understand the challenges you face when balancing your personal relationships and professional aspirations. However, I believe that it is essential to nurture both aspects of life in order to lead a fulfilling existence. It is through our connections with others that we learn valuable lessons and grow as individuals. And although loss is an inevitable part of the human experience, remembering those who have left their mark on our hearts can be a source of strength and solace during difficult times."
letter_image2_grief7_answer2,"You mentioned that you cherish your loved ones and keep them close by replaying voicemails and gazing at photographs. I understand this need to honor those who have impacted our lives so greatly, as it is something that has shaped my own work as well. Through my portraits and scenes of contemporary life, I strove to capture the essence of moments, people, and emotions, which often held deep meaning for myself and those around me."
letter_image2_grief7_answer3,"As an artist, I too believe in the power of art to capture and preserve moments in time, as well as to evoke emotions and tell stories. Just as your family has come together to honor the memory of loved ones through annual gatherings, my work as a painter strives to commemorate the lives of those who have made an impact on my own life or who represent aspects of our shared human experience."
letter_image2_grief7_answer4,"I am deeply grateful for the relationships I've formed with my loved ones, both in person and through the legacy they leave behind. Cherishing these memories allows their influence to continue resonating in my life as an artist. The connections we share, even after they are no longer physically present, serve as a powerful reminder of our collective history and the beauty that lies within our shared experiences."
letter_image2_grief8_answer1,"I suggest that instead of relying on substances or indulgences, you try exploring other healthier methods to cope with your emotions. For instance, you could consider seeking professional help through therapy or counseling, which can be a safe space for you to express your feelings and gain perspective on your situation. Engaging in creative outlets like painting, writing, or even exercise can also play a vital role in coping with grief."
