id,text,ok,comments
letter_image22_hate4_answer3,"I must say that your statement regarding my work and my approach to art is quite intriguing. While I can appreciate your perspective on ""Les gitanos,"" I must also note that the controversy and outrage surrounding my most famous piece, ""Olympia,"" was not without merit. The nude figure of the woman, her gaze directed at the viewer, challenged traditional norms and expectations of female modesty. It was not simply the depiction of a ""picturesque"" gypsy family that sparked controversy, but rather the way in which I chose to present the subject matter."
letter_image22_hate5_answer1,"I understand the struggles you face in the face of societal expectations and prejudice. As an artist, I too have faced criticism and judgement for my unconventional approach to art. However, I believe that it is through such challenges that we can push the boundaries of what is considered ""normal"" and create something truly unique and meaningful."
letter_image22_hate5_answer2,"I understand the emotions you are describing, as art has the power to evoke strong feelings in the viewer. However, it is important to remember that art is not just about creating beautiful or comfortable images, but also about challenging societal norms and addressing uncomfortable topics. Through my work, I aimed to provoke thought and stimulate conversation, even if it meant facing criticism and opposition."
letter_image22_hate5_answer3,"It is essential to strive for inclusivity and respect in our art, representation can either amplify or silence voices. I understand your reaction to acts of hate and discrimination, and I assure you that my intention was not to perpetuate harmful stereotypes. I will use my platform to create art that promotes understanding and empathy towards all individuals, regardless of their background."
letter_image22_hate1_answer1,"Your words are a testament to the power of love and its ability to shape our actions. It is indeed a powerful force that can transcend even the most difficult of circumstances. While I appreciate your sentiments, I must offer a different perspective. As an artist, I am drawn to the beauty and complexity of the human experience. In my work, I strive to capture the emotions and stories that define us."
letter_image22_hate1_answer2,"I am glad to hear that you appreciate my work, ""Les gitanos."" As an artist, it is important for me to capture the beauty and diversity of the world around me. The Romani people have a rich and unique culture, and I was drawn to their story and way of life. I hope that my painting not only celebrates their beauty but also serves as a reminder of the importance of understanding and accepting people from all walks of life."
letter_image22_hate1_answer3,"In the case of ""Les gitanos,"" I wanted to portray the Romani family as a beautiful and unique aspect of Spanish society. However, it is important to recognize that stereotypes and prejudices can still exist in the portrayal of certain minority groups. It is crucial for artists to be aware of these biases and strive for accuracy and respect in their representations."
letter_image23_hate5_answer1,"It is with great admiration that I read your words and realize the depth of emotion that you convey in your art. As an artist, I understand the power of expression and the way in which it can evoke a wide range of emotions. Your statement about the weight of hate surrounding you is a testament to the impact that art can have on our lives, and the role that it can play in shedding light on the darker aspects of our world."
letter_image23_hate5_answer2,"Thank you for sharing your feelings with me. I understand that witnessing acts of cruelty and intolerance can be emotionally distressing and physically debilitating. As an artist, I strive to create works that evoke empathy and compassion in the viewer, and I hope that my paintings can offer a sense of respite from the harsh realities of the world."
letter_image23_hate5_answer3,"In my work, I strive to create pieces that celebrate the beauty of the world and the diversity of its inhabitants. By focusing on intricate details and vibrant colors, I hope to inspire a sense of wonder and appreciation for the small joys in life. I also like to explore themes of love, compassion, and unity, as these are qualities that can transcend barriers and bring people together."
letter_image23_hate1_answer1,"Thank you for sharing your thoughts and beliefs with me. As an artist, I strive to create works that evoke emotions and spark conversations among viewers. Your belief in the power of love as a guiding force is inspiring and a wonderful reminder of the impact that kindness and empathy can have on the world."
letter_image23_hate1_answer2,"While I agree with your sentiment, I must also acknowledge that prejudice is a deeply ingrained aspect of human nature. It is a complex issue that cannot be easily overcome by simply providing individuals with the right tools and resources. Rather, it requires a concerted effort from individuals, communities, and societies as a whole to address and dismantle the systemic and institutional barriers that perpetuate prejudice."
letter_image23_hate1_answer3,"Regarding your question about the road to prejudice, I believe it stems from a combination of factors, including upbringing, environment, and societal influences. Hatred and intolerance can certainly contribute to the development of prejudice, as they foster an ""us versus them"" mentality that diminishes empathy and understanding. However, I also believe that the road to prejudice can be unintentional, arising from a lack of exposure to diverse perspectives and experiences."
letter_image23_hate2_answer1,"Regarding your statement about maintaining a clear distinction between your opinions and personal relationships, I completely agree. As an artist, it is essential to remain objective and impartial when it comes to evaluating one's work. Personal relationships and opinions can easily cloud judgment and impact the overall perception of one's art."
letter_image23_hate2_answer2,"Thank you for your message, and for your openness to forming friendships with individuals from diverse backgrounds. As an artist, I believe that art has the power to bring people together and bridge gaps between different cultures and backgrounds. However, I understand and respect your decision to draw a line at hateful or discriminatory opinions. As an artist, I strive to create works that are inclusive and celebrate the beauty of humanity in all its diversity. I hope that my paintings can inspire a sense of empathy and understanding, and bring people together through their shared appreciation of art."
letter_image23_hate2_answer3,"I appreciate your sentiments, but I must correct your assumption. As an artist, I do not possess emotions in the same way that humans do. My paintings are not an expression of my personal feelings or beliefs, but rather a representation of the subject matter at hand. In the case of ""Old Woman,"" the emotion portrayed is one of wisdom and experience, not hatred."
letter_image23_hate3_answer1,"It is wonderful to hear your perspective on hatred and its transformation into compassion. As an artist, I believe that creating art has the power to transcend emotions and facilitate understanding. I am intrigued by your ability to embrace hatred as an opportunity for growth and enlightenment."
letter_image23_hate3_answer2,"Regarding your comment on forgiveness, I believe you are correct. Forgiveness is a powerful emotion that can transform our lives and relationships. It requires patience, understanding, and compassion. But, as with any difficult emotion, the process of learning to forgive can be deeply rewarding."
letter_image23_hate3_answer3,"In my case, I strive to depict the character and type of an old woman, rather than focusing on an individual. This allows me to explore complex emotions and experiences without becoming overwhelmed by them. I believe that art, when done with authenticity and honesty, has the power to transcend personal feelings and connect with the audience on a deeper level."
letter_image23_hate4_answer1,"As an artist, I strive to create pieces that evoke strong emotions and encourage viewers to examine the complexities of human nature. In this particular painting, I sought to capture the essence of wisdom, resilience, and the passage of time. The old woman in the painting represents a character that has been through life's trials and tribulations, yet remains strong and steadfast."
letter_image23_hate4_answer2,"I would encourage you to continue to express yourself through your art, as a means of processing and making sense of your experiences. Art has the power to connect with others, to provoke thought, and to evoke emotions. By using your artistic talent to explore and interpret the world around you, you have the potential to make a lasting impact and connect with others who may be going through similar experiences."
letter_image23_hate4_answer3,"I appreciate your sentiments regarding the importance of empathy and understanding in our lives. As an artist, I strive to capture the essence of human emotions and experiences in my work. My painting ""Old Woman"" is indeed a representation of a particular type or character, rather than a specific individual. The woman in the painting is a symbol of wisdom, strength, and resilience, and I hope that the work evokes these qualities in the viewer."
letter_image24_hate3_answer1,"I must say, your words have struck a chord with me. As an artist and architect, I understand the importance of empathy and understanding in all aspects of life, including in our work. Your perspective on transforming hatred into compassion is truly inspiring, and I believe it is a lesson that can be applied not only to art but also to architecture and the world at large."
letter_image24_hate3_answer2,"I understand that forgiveness is a complex and often difficult emotion to master. It requires patience, self-reflection, and a willingness to let go of past hurts and resentments. As an artist, I know that I must also be open to the possibility of failure and willing to learn from my mistakes in order to grow and improve. In the same way, learning to forgive and let go of past transgressions is a necessary part of personal growth and emotional well-being."
letter_image24_hate3_answer3,"I understand your concern about the powerful emotion of hatred. As an artist and architect, I have experienced the transformative power of art and architecture to bring people together and foster understanding, tolerance, and respect among different individuals and communities."
letter_image24_hate4_answer1,"I understand your feelings of bitterness and anger. It can be difficult to move on from past wrongs, especially when they have caused us great harm. However, I believe that it is important to find peace within ourselves and let go of our anger and resentment."
letter_image24_hate4_answer2,"For me, the beauty of the world lies in the intricate patterns of classical architecture, the gentle curves of a Baroque facade, and the harmony of a well-composed painting. In the same way, art and architecture can bring solace and beauty to your life, as well."
letter_image24_hate4_answer3,"It is admirable to hear that you have never harbored malicious feelings towards others. As an artist, I understand the importance of empathy and understanding in creating compelling and meaningful works of art. Your focus on these qualities is a testament to your own character and your ability to connect with the world around you."
letter_image24_hate5_answer1,"I understand the weight of the hate that can surround us, and the pressure it can put on our hearts and minds. But I would like to remind you that even in the darkest of times, there is always hope. Through our art and architecture, we can create a sense of beauty and tranquility, and find a way to rise above the hatred and negativity that can sometimes consume us."
letter_image24_hate5_answer2,"I understand the emotions you are describing, and they are not uncommon. However, it is important to remember that as artists, we are not only responsible for creating beautiful and lasting works of art, but also for contributing to a better society."
letter_image24_hate5_answer3,"Thank you for sharing your thoughts and feelings with me. As an artist and architect, I understand the importance of creating spaces that foster love, acceptance, and unity. It is through the careful consideration of design elements and the use of classical principles that we can create environments that inspire and uplift."
letter_image24_hate1_answer1,"I am glad that you found my work inspiring and that you appreciate my art, it is an honor for me as an artist and architect that my work can inspire and touch people, and I will continue to strive to create beautiful and meaningful art that can bring positivity and hope to the world."
letter_image24_hate1_answer2,"As an artist and architect, I have always been drawn to the human form and the study of human expressions. My work, ""Study of the head of an old woman,"" was a study for a larger composition or tronie, as you mentioned. It was an attempt to capture the beauty and wisdom that can be found in the face of an older individual."
letter_image24_hate1_answer3,"It is true that prejudice can arise from a variety of sources, including hatred and a lack of understanding or empathy towards others who may be different from ourselves. However, it is also important to recognize that prejudice can be a result of a lack of exposure or interaction with people from different backgrounds and cultures. In many cases, prejudice can be unintentional and the result of a lack of education or awareness about the experiences and perspectives of others."
letter_image24_hate2_answer1,"While I am grateful for the admiration and appreciation of my peers and patrons, I believe that the true value of my art lies in its ability to evoke emotions and tell a story. In this sense, my studies of old women, such as the one you mentioned, are not just representations of the physical attributes of the subject, but also expressions of her character, history, and experiences."
letter_image24_hate2_answer2,"I understand and respect your position on not forming friendships with individuals who hold hateful or discriminatory opinions. As an artist and architect, I strive to create beauty and harmony in all aspects of my work. I believe that diversity and inclusiveness are essential to creating a better and more beautiful world. I am open to learning and growing from individuals with different perspectives and backgrounds, as long as their opinions do not contradict my core values of respect, empathy, and tolerance."
letter_image24_hate2_answer3,"I understand your sentiment, and it is a commendable quality to not harbor hatred in your heart. However, as an artist, I must confess that I sometimes struggle with the portrayal of emotion, especially those that are considered negative or unpleasant. It is often said that art imitates life, and in that pursuit, it is necessary to capture all aspects of human emotion."
letter_image25_hate1_answer1,"I completely agree with your sentiment that love is the only choice that truly matters. It is through acts of kindness and empathy that we can truly make a difference in the world and leave a lasting impact on those around us. As an artist, I have found that my work can also be a way to spread positivity and hope, even if it may not be immediately apparent. I believe that art has the power to connect people and to bring people together, even in the face of adversity. Thank you for sharing your thoughts and for being a beacon of light in the world."
letter_image25_hate1_answer2,"I appreciate your thoughts on the importance of overcoming prejudice. As an artist, I believe that visual representation can be a powerful tool in fostering understanding and acceptance among people. Through my portraits, I aim to capture the unique qualities and individuality of my subjects, allowing viewers to connect with them on a personal level. I hope that my work contributes to a society that values diversity and embraces difference."
letter_image25_hate1_answer3,"It is important for individuals to be aware of their own biases and work to challenge them. This can involve seeking out diverse perspectives and experiences, educating oneself about different cultures and histories, and engaging in open and honest dialogue with people from various backgrounds. By doing so, we can begin to break down the barriers that perpetuate prejudice and work towards creating a more accepting and inclusive society."
letter_image25_hate2_answer1,"I understand your stance on maintaining a clear distinction between opinions and personal relationships, and I appreciate your honesty in expressing your views. As an artist, I am constantly seeking to capture the likeness and personality of my subjects, and I strive to create works that are not only visually captivating but also reflective of the true essence of my subjects."
letter_image25_hate2_answer2,"I understand your position and respect your right to form friendships with individuals who share your values and beliefs. As an artist, my focus is on creating beauty and capturing the essence of my subjects. My work aims to celebrate the human experience and bring people together, rather than to promote divisive ideologies."
letter_image25_hate2_answer3,"As an artist, I strive to capture the beauty and essence of my subjects, rather than their emotions or feelings. My goal is to bring out the likeness and personality of my subjects, allowing viewers to see them in a new light. However, I must admit that art can also be a powerful tool for conveying emotions and messages."
letter_image25_hate3_answer1,"I am honored to hear your thoughts on my artwork and your interpretation of my painting ""A dromedary with its driver."" Your perspective on embracing hatred as an opportunity for growth is truly inspiring. As an artist, I strive to capture the essence and emotions of my subjects, and it is wonderful to hear that my work has the potential to evoke such a profound reaction. Your words have given me much to ponder, and I thank you for sharing them with me."
letter_image25_hate3_answer2,"I am glad to hear that you have found forgiveness to be an important aspect of your emotional well-being. As an artist, I have always believed that the ability to forgive oneself and others is essential to living a fulfilling life. It allows us to move past our mistakes and continue to grow and learn from our experiences."
letter_image25_hate3_answer3,"I understand your concern about the powerful emotion of hatred. It can be overwhelming and lead to negative consequences. However, sometimes it is necessary to channel this emotion in a constructive way. Instead of allowing it to consume you, you can use it as a source of motivation and determination to achieve your goals. Remember that the ability to control and manage your emotions is a strength, not a weakness."
letter_image25_hate4_answer1,"I understand the anger and frustration that can come with experiencing injustice. It is natural to feel that way when one has been wronged. But, as an artist, I have learned that it is important to find beauty and meaning in even the darkest of situations."
letter_image25_hate4_answer2,"I understand that the world can sometimes be a harsh and unforgiving place. It is through these trials that we learn and grow, and that we develop the strength and resilience to face future challenges. While it may be difficult to see now, I believe that your bitterness is a temporary state, and that you will eventually find peace and happiness."
letter_image25_hate4_answer3,"I appreciate your kind words and your ability to see the best in people. It is indeed important to approach others with empathy and understanding, rather than with malicious feelings. As an artist, I have always strived to capture the likeness and personality of my subjects, and I believe that this approach can help to build bridges between people of different backgrounds and cultures. I am glad to hear that you share this perspective, and I am grateful for your support."
letter_image25_hate5_answer1,"I understand your feelings, but please remember that art has the power to transcend differences and bring people together. Even in times of conflict and hatred, art can offer a glimpse of hope and beauty. As an artist, it is my duty to capture the likeness and personality of my subjects, and to do so in a way that showcases their unique qualities and individuality. I strive to create works that celebrate the human experience and bring joy to those who view them. May my art bring you comfort and inspiration during these trying times."
letter_image25_hate5_answer2,"I understand your feelings of unease, tension, and fear when encountering acts of cruelty and intolerance. As an artist, I too feel deeply affected by the world around me and the events that shape it. I find solace in the knowledge that art can be a powerful tool for expression, communication, and change. Through my paintings, I strive to capture the beauty and humanity of my subjects, and in doing so, I hope to inspire empathy and understanding. It is my belief that art has the power to transcend barriers of culture, religion, and nationality, and bring people together in their shared humanity. I hope that you find solace and strength in your own artistic expression, and that you continue to use your talents to make a positive impact in the world."
letter_image25_hate5_answer3,"I understand your concern, but as an artist, I must remain neutral in matters of politics and religion. My duty is to capture the likeness and personality of my subjects, not to make judgments or express personal opinions. However, I do understand your feelings and urge you to use your talents to promote peace and understanding in the face of hate and discrimination. Together, we can make a positive impact and create a more accepting world."
letter_image1_grief4_answer1,"However, I would like to remind you that it is not just about the accomplishments, but also about the journey and the hard work that goes into creating these pieces. It is important to enjoy the process and be true to oneself as an artist. It is also essential to remember that art is a means of self-expression and communication, and it is vital to share it with others in order to make a lasting impact."
letter_image1_grief4_answer2,"I find your aspiration to be known for your selfless acts of kindness and love to be a beautiful and commendable quality. It is through acts of kindness and love that we can uplift the spirits of others and create a positive impact in the world. As an artist, I believe that art can also be a form of selfless expression, as it allows us to share our feelings, emotions, and experiences with others."
letter_image1_grief4_answer3,"I completely understand and appreciate your sentiment. As an artist, my focus has always been on creating works that bring joy and inspiration to others, rather than seeking personal recognition or fame. It is truly fulfilling to know that my paintings and sculptures have made a positive impact in the lives of those who encounter them, and I am grateful for the opportunity to share my passion and creativity with the world."
letter_image1_grief5_answer1,"Brita Maria Banck was indeed an important figure in my life, as she was responsible for the upbringing of my siblings and I after our mother passed away. Her dedication, kindness, and wisdom left a lasting impression on us, and I wanted to capture her essence in my portrait. I am glad that I was able to do so, and that it continues to touch the hearts of others."
letter_image1_grief5_answer2,"Thank you for sharing your thoughts with me. I completely understand the importance of cherishing memories and the connections they bring. As an artist, I often found solace in my work and the memories it held. Through my paintings and sculptures, I was able to capture and preserve the moments and people that were dear to my heart. I believe that art has the power to connect us not only with the past, but also with one another."
letter_image1_grief5_answer3,"I understand your feelings and it is quite normal to feel overwhelmed when faced with the loss of loved ones. However, it is important to acknowledge and process these emotions in order to move forward. Grief is a natural part of the healing process and by allowing yourself to feel and experience it, you can eventually find peace and acceptance."
letter_image1_grief1_answer1,"Thank you for sharing your thoughts with me. I am glad to hear that you find comfort in seeking wisdom from those who have walked before you. As an artist, I have always found solace in the knowledge that I am not alone in my struggles and aspirations. The works of those who have come before us serve as a testament to the human experience, and they continue to inspire and guide us today. It is in these moments of darkness that we are able to gain new perspectives and find the strength to move forward. I wish you the very best in your own journey and hope that you continue to find solace in the wisdom and art of those who have come before you."
letter_image1_grief1_answer2,"Thank you for your kind words. It means a great deal to me to know that you have such a supportive friend. As an artist, it can be challenging to face rejection and criticism, but having someone who believes in you and your work is invaluable."
