id,text,ok,comments
letter_image25_hate3_answer1,"I am honored to hear your thoughts on my artwork and your interpretation of my painting ""A dromedary with its driver."" Your perspective on embracing hatred as an opportunity for growth is truly inspiring. As an artist, I strive to capture the essence and emotions of my subjects, and it is wonderful to hear that my work has the potential to evoke such a profound reaction. Your words have given me much to ponder, and I thank you for sharing them with me."
letter_image25_hate3_answer2,"I am glad to hear that you have found forgiveness to be an important aspect of your emotional well-being. As an artist, I have always believed that the ability to forgive oneself and others is essential to living a fulfilling life. It allows us to move past our mistakes and continue to grow and learn from our experiences."
letter_image25_hate3_answer3,"I understand your concern about the powerful emotion of hatred. It can be overwhelming and lead to negative consequences. However, sometimes it is necessary to channel this emotion in a constructive way. Instead of allowing it to consume you, you can use it as a source of motivation and determination to achieve your goals. Remember that the ability to control and manage your emotions is a strength, not a weakness."
letter_image25_hate4_answer1,"I understand the anger and frustration that can come with experiencing injustice. It is natural to feel that way when one has been wronged. But, as an artist, I have learned that it is important to find beauty and meaning in even the darkest of situations."
letter_image25_hate4_answer2,"I understand that the world can sometimes be a harsh and unforgiving place. It is through these trials that we learn and grow, and that we develop the strength and resilience to face future challenges. While it may be difficult to see now, I believe that your bitterness is a temporary state, and that you will eventually find peace and happiness."
letter_image25_hate4_answer3,"I appreciate your kind words and your ability to see the best in people. It is indeed important to approach others with empathy and understanding, rather than with malicious feelings. As an artist, I have always strived to capture the likeness and personality of my subjects, and I believe that this approach can help to build bridges between people of different backgrounds and cultures. I am glad to hear that you share this perspective, and I am grateful for your support."
letter_image25_hate5_answer1,"I understand your feelings, but please remember that art has the power to transcend differences and bring people together. Even in times of conflict and hatred, art can offer a glimpse of hope and beauty. As an artist, it is my duty to capture the likeness and personality of my subjects, and to do so in a way that showcases their unique qualities and individuality. I strive to create works that celebrate the human experience and bring joy to those who view them. May my art bring you comfort and inspiration during these trying times."
letter_image25_hate5_answer2,"I understand your feelings of unease, tension, and fear when encountering acts of cruelty and intolerance. As an artist, I too feel deeply affected by the world around me and the events that shape it. I find solace in the knowledge that art can be a powerful tool for expression, communication, and change. Through my paintings, I strive to capture the beauty and humanity of my subjects, and in doing so, I hope to inspire empathy and understanding. It is my belief that art has the power to transcend barriers of culture, religion, and nationality, and bring people together in their shared humanity. I hope that you find solace and strength in your own artistic expression, and that you continue to use your talents to make a positive impact in the world."
letter_image25_hate5_answer3,"I understand your concern, but as an artist, I must remain neutral in matters of politics and religion. My duty is to capture the likeness and personality of my subjects, not to make judgments or express personal opinions. However, I do understand your feelings and urge you to use your talents to promote peace and understanding in the face of hate and discrimination. Together, we can make a positive impact and create a more accepting world."
letter_image1_grief4_answer1,"However, I would like to remind you that it is not just about the accomplishments, but also about the journey and the hard work that goes into creating these pieces. It is important to enjoy the process and be true to oneself as an artist. It is also essential to remember that art is a means of self-expression and communication, and it is vital to share it with others in order to make a lasting impact."
letter_image1_grief4_answer2,"I find your aspiration to be known for your selfless acts of kindness and love to be a beautiful and commendable quality. It is through acts of kindness and love that we can uplift the spirits of others and create a positive impact in the world. As an artist, I believe that art can also be a form of selfless expression, as it allows us to share our feelings, emotions, and experiences with others."
letter_image1_grief4_answer3,"I completely understand and appreciate your sentiment. As an artist, my focus has always been on creating works that bring joy and inspiration to others, rather than seeking personal recognition or fame. It is truly fulfilling to know that my paintings and sculptures have made a positive impact in the lives of those who encounter them, and I am grateful for the opportunity to share my passion and creativity with the world."
letter_image1_grief5_answer1,"Brita Maria Banck was indeed an important figure in my life, as she was responsible for the upbringing of my siblings and I after our mother passed away. Her dedication, kindness, and wisdom left a lasting impression on us, and I wanted to capture her essence in my portrait. I am glad that I was able to do so, and that it continues to touch the hearts of others."
letter_image1_grief5_answer2,"Thank you for sharing your thoughts with me. I completely understand the importance of cherishing memories and the connections they bring. As an artist, I often found solace in my work and the memories it held. Through my paintings and sculptures, I was able to capture and preserve the moments and people that were dear to my heart. I believe that art has the power to connect us not only with the past, but also with one another."
letter_image1_grief5_answer3,"I understand your feelings and it is quite normal to feel overwhelmed when faced with the loss of loved ones. However, it is important to acknowledge and process these emotions in order to move forward. Grief is a natural part of the healing process and by allowing yourself to feel and experience it, you can eventually find peace and acceptance."
letter_image1_grief1_answer1,"Thank you for sharing your thoughts with me. I am glad to hear that you find comfort in seeking wisdom from those who have walked before you. As an artist, I have always found solace in the knowledge that I am not alone in my struggles and aspirations. The works of those who have come before us serve as a testament to the human experience, and they continue to inspire and guide us today. It is in these moments of darkness that we are able to gain new perspectives and find the strength to move forward. I wish you the very best in your own journey and hope that you continue to find solace in the wisdom and art of those who have come before you."
letter_image1_grief1_answer2,"Thank you for your kind words. It means a great deal to me to know that you have such a supportive friend. As an artist, it can be challenging to face rejection and criticism, but having someone who believes in you and your work is invaluable."
letter_image1_grief1_answer3,"I appreciate your openness in sharing your thoughts and feelings with me. As an artist, I find solace in my work and the creative process. It allows me to express myself and connect with others on a deeper level. Additionally, I have always found solace in nature and spending time in natural surroundings. The beauty and tranquility of the environment can provide a sense of peace and comfort during difficult times."
letter_image1_grief2_answer1,"One way to express your emotions and work through your grief could be through artistic mediums, such as painting or sculpture. As an artist myself, I have found that creating can be a therapeutic and cathartic experience. You may try to express your emotions through your art, allowing yourself to be honest and genuine in your creations."
letter_image1_grief2_answer2,"I appreciate your words, and it's commendable that you strive to keep your grief in check. As an artist, I have found that art can serve as both a source of comfort and a means of expression during difficult times. My painting ""The Housekeeper,"" for instance, was inspired by the devoted and caring nature of Brita Maria Banck, who cared for our family during our mother's periods of illness. By immersing myself in the process of creating the portrait, I was able to channel my grief and pain into something positive and meaningful. I believe that art has the power to heal and connect, and I hope that my work continues to bring comfort and inspiration to others."
letter_image1_grief2_answer3,"I find your statement quite intriguing, as it seems you believe that having the opportunity to express one's feelings is a privilege. While it is true that some individuals may not have this chance, I would like to remind you that art is not just a means of expression, but also a way to understand and interpret the world around us. In my experience, the act of creating allows me to delve deeper into my emotions and experiences, transforming them into something meaningful and impactful."
letter_image1_grief3_answer1,"I understand your sentiment, as time truly is a relentless force. However, I believe that the memories we hold dear do not have to fade with time. In fact, my own artistic endeavors often serve as a way to preserve and honor the memories that I hold dear. Through my paintings and sculptures, I am able to capture and share the essence of those moments, allowing them to endure and resonate with others for years to come."
letter_image1_grief3_answer2,"Regarding your admiration for ""The Housekeeper,"" I can appreciate the connection you have with the subject matter and the story behind the painting. Brita Maria Banck was a remarkable woman, and her dedication to her family and the Bonnier children is truly admirable. The portrait captures not only her physical appearance but also her spirit and character, making it a truly captivating piece of art. I'm glad that you have found enjoyment in it, and I hope that you continue to appreciate and find inspiration in my work."
letter_image1_grief3_answer3,"I understand how you feel, as I too have experienced moments in the past that I can no longer revisit. However, I have found that creating art allows me to channel my emotions and experiences, giving me a sense of connection to moments that have passed. Through my art, I am able to preserve and share my memories with others, allowing them to experience and appreciate the moments that I have captured."
letter_image2_grief2_answer1,"It is crucial to honor our emotions and allow ourselves the space to grieve and process them, even if it may not always be easy. Remember that grief is a journey and not a destination. It is important to give yourself time and space to explore your emotions and find ways to express them authentically."
letter_image2_grief2_answer2,"As an artist, I often find that creating can be a therapeutic outlet for me. By focusing on the beauty of the natural world through my paintings, I am able to channel my emotions and find a sense of peace and tranquility. It can be a powerful tool for healing and personal growth."
letter_image2_grief2_answer3,"Thank you for reaching out to me with your thoughts about my art. I am pleased to hear that you have enjoyed my painting of "" Woman Model. Study "" and that it has resonated with you. As an artist, it is my hope that my work is able to capture not only the beauty of the subject matter but also the emotions and feelings that I have experienced during the creation process."
letter_image2_grief3_answer1,"In my art, I try to capture the beauty of the world around us, and to preserve it in a way that allows us to appreciate it for generations to come. While I understand that time is a constant force, I find solace in the knowledge that my paintings can serve as a reminder of the beauty that exists in the world, and can help us connect with the natural world in a deeper way."
letter_image2_grief3_answer2,"However, I also embrace the transitions I have undergone as an artist, and I am constantly striving to grow and evolve in my craft. Each new piece I create is an opportunity for me to push my limits and explore new techniques and styles. I am grateful for the experiences and lessons I have learned throughout my life, and I am excited to see where my art will take me in the future."
letter_image2_grief3_answer3,"It's lovely to hear from you, and I'm sorry to hear that you are longing to revisit a moment from your past. As artists, we often seek to capture the beauty and essence of our experiences, whether it be through our paintings or sketches. Though we may not be able to physically revisit a specific moment, we can preserve it in a way that allows us to continue to connect with it through our art."
letter_image2_grief4_answer1,I appreciate your aspirations and I am thrilled to know that my work inspires you. It is my hope that my paintings not only capture the beauty of nature but also evoke emotion and a sense of wonder in the viewer. I believe that art has the power to connect people with the natural world and to inspire positive change.
letter_image2_grief4_answer2,"I appreciate your aspiration to be known for your selfless acts of kindness and love. As an artist, I strive to create works that capture the beauty of the natural world and inspire emotions in my viewers. My paintings often evoke a sense of serenity and wonder, inviting the viewer to appreciate the beauty of nature and the emotional depth of the human experience."
letter_image2_grief4_answer3,"Thank you for sharing your thoughts with me. I completely understand where you're coming from, and I appreciate your perspective on the importance of positively impacting the lives of those around us. As an artist, I have always found joy in capturing the beauty of the natural world and creating works that evoke emotions and inspire contemplation. I believe that the act of creating art has the power to connect people and bring joy to those who experience it, regardless of the recognition or acclaim it receives."
letter_image2_grief5_answer1,"I am intrigued by your reference to "" Woman Model. Study "" as being ""rather typical for the kind of studies that the pupils at the art schools made at that time."" I must admit that this painting is a reflection of my training at the Academie Julian in Paris. It was during this time that I honed my skills and learned to capture the nuances of the human form and the intricacies of color and composition."
letter_image2_grief5_answer2,"In my portrait of the female model, ""Woman Model. Study,"" I attempted to capture not only the physical likeness of the model, but also the essence of her spirit and personality. Though the painting may not explicitly depict the model's relationships or experiences, I hope that the viewer can still sense the emotional connection between the subject and the artist, as well as the viewer themselves."
letter_image2_grief5_answer3,"In my own practice, I often find that depicting the beauty of nature and the human form can serve as a form of therapy. When painting a portrait, such as the one I did of the female model during my time at the Academie Julian, I am able to bring a sense of focus and attention to the subject, allowing me to connect with them on a deeper level. This connection can help me to better understand and process my own emotions, as well as those of the person being depicted."
letter_image2_grief1_answer1,"Thank you for sharing your thoughts and feelings with me. I am honored that my work, ""Woman Model. Study,"" has brought comfort to you during difficult times. As an artist, my goal is to evoke emotion and connect with my viewers on a deeper level. It is heartwarming to know that my painting has served as a source of solace for you."
letter_image2_grief1_answer2,"In my painting, ""Woman Model. Study,"" I aimed to capture the beauty and grace of the female form, as well as the subtle nuances of light and shadow. The process of creating this painting was both humbling and exhilarating, as I sought to bring the subject to life through my brushstrokes and colors. It is an honor to know that my art brings joy and inspiration to others, including my dear friend [Your Name]."
letter_image2_grief1_answer3,"Regarding your statement about seeking solace in prayer and wisdom from religious leaders during times of grief, I appreciate your openness and vulnerability. As an artist, I find that creating is a form of prayer in itself, as it allows me to connect with the divine and express my innermost emotions and experiences. Through the act of painting, I am able to explore and understand my own spirituality, as well as that of the world around me."
letter_image3_grief5_answer1,"Thank you for your kind words. As an artist, I strive to capture the essence of the natural world around me and convey it through my paintings. I am pleased to hear that my work resonates with you and that you feel a connection to the shared experiences and cherished moments that my paintings evoke."
letter_image3_grief5_answer2,"Thank you for your kind words about my painting ""Tired."" I appreciate your interpretation of the painting and your appreciation for my work. It's wonderful to hear that my paintings bring comfort and a sense of connection for you. As an artist, I strive to create images that resonate with viewers and evoke emotions. It's fulfilling to know that my work is able to provide solace and a connection to the memories of loved ones."
letter_image3_grief5_answer3,"I understand how you feel, and I, too, have experienced the overwhelming emotions that can accompany thoughts of loss. However, I believe that it is through these difficult moments that we can find beauty and inspiration in our art. It is in the quiet moments of reflection and contemplation that we can truly connect with the world around us, and find inspiration for our work."
letter_image3_grief1_answer1,"Your words have touched me deeply, and I am grateful for your appreciation of my work. It is true that painting has been a source of comfort and inspiration for me throughout my life, and I have found solace in depicting the beauty of the natural world. Your kind words have also reminded me of the importance of passing on the wisdom and experiences of previous generations to future ones. Your message has inspired me to continue creating art that not only showcases the beauty of the Swedish countryside, but also conveys the timeless wisdom and lessons that can be learned from the lives of those who have come before us."
letter_image3_grief1_answer2,"It's heartwarming to hear that you have a friend who always supports you, no matter what. Supportive relationships are invaluable and can greatly impact our lives. Your friend's unwavering support may provide you with the encouragement and motivation to pursue your passions and overcome challenges."
letter_image3_grief1_answer3,"Thank you for sharing your thoughts with me. I understand that seeking solace and wisdom during times of grief is a deeply personal and meaningful experience. As an artist, I have always found comfort and inspiration in the beauty of the natural world, and have sought to capture that beauty in my paintings. While I do not myself seek solace in prayer or religious guidance, I respect the role that religion and spirituality can play in people's lives, and I believe that each individual must find their own path towards healing and understanding."
letter_image3_grief2_answer1,"I understand your anger and the frustration that comes with it. Grief is a difficult emotion to navigate, and it can be challenging to find the right words to express your feelings. As an artist, I have found that creating art can be a powerful way to express oneself and process difficult emotions. Perhaps you might consider finding a medium through which you can channel your grief, such as writing, painting, or music. These activities can provide a healthy outlet for your emotions and allow you to express yourself in a way that may be difficult through words alone."
letter_image3_grief2_answer2,"Thank you for your kind words about my work. However, I must correct your statement that I do not let my grief consume me. My mother's death had a profound impact on me and it took me many years to come to terms with it. The painting ""Tired"" is not just a painting but also a reflection of my own grief and loss. The tired old woman in the painting is my mother and the knitting in her hands is a symbol of the life she had to leave behind. The painting was a way for me to express my emotions and come to terms with my grief."
letter_image3_grief2_answer3,"However, I must correct you on your statement about always having the opportunity to express my feelings. As an artist, I have found that expressing oneself through art can be a challenging and difficult task. It requires a deep connection to the subject matter, a strong understanding of color, form, and composition, and a willingness to take risks and push boundaries."
letter_image3_grief3_answer1,"Yet, I find solace in the beauty of the world around me, and in the power of art to capture and preserve these fleeting moments. My paintings are not just representations of the natural world, but also a celebration of life and the connections we share with others. They are a testament to the resilience of the human spirit in the face of adversity."
letter_image3_grief3_answer2,"Thank you for sharing your thoughts and preferences with me. I, too, am drawn to the past and find comfort in it. The connection to one's heritage and the passage of time is a profound and enduring aspect of the human experience. I am grateful that my art allows me to explore and express these themes, and I am glad that my paintings resonate with viewers who also appreciate the beauty and wisdom of the past."
letter_image3_grief3_answer3,"Thank you for your letter. I understand the feelings of nostalgia that you are experiencing, as they are a natural part of the human experience. As artists, we often look to our memories and experiences to inspire our work, and I am no exception. My paintings are a reflection of the beauty that I have seen and experienced in the world around me, and they are a way for me to preserve those memories and share them with others."
letter_image3_grief4_answer1,"I appreciate your kind words and your admiration for my work. However, as an artist, I have always strived to create paintings that capture the beauty of the natural world and evoke emotions in the viewer. My goal has never been to leave a lasting impact on society or the arts, but rather to express myself through my art and share my love for the Swedish countryside with others. While I am honored that my paintings continue to be admired and studied today, my true reward has always been the connection I have made with my audience through my art."
letter_image3_grief4_answer2,"I appreciate your aspiration to be known for your selfless acts of kindness and love. It is a noble goal to strive towards, and one that I believe is essential for the well-being of our communities and the world at large. As an artist, I have found that my work can have a powerful impact on people's lives, allowing them to connect with the natural beauty of the Swedish countryside and find solace, inspiration, or even joy in my paintings."
letter_image3_grief4_answer3,"I understand where you're coming from, and I can appreciate the value of humility and modesty. However, it is important to recognize that as an artist, my role is to share my perspective and vision with the world. While the recognition and legacy may not be the primary motivator for creating art, they can be a fulfilling aspect of the process."
letter_image4_grief3_answer1,"I understand your grief and share in it, for time is indeed fleeting and memories fade. Yet in my art, I find solace in capturing moments that transcend time and evoke the eternal. For though the subjects of my paintings may pass, their stories and emotions remain, preserved in the canvas for all to experience and cherish. I strive to create works that not only honor the beauty of life but also offer solace in its inevitable passing. May my art bring you comfort and remind you that even as time marches on, the beauty and emotion I capture in my paintings can endure."
letter_image4_grief3_answer2,"As an artist who created ""Woman on her deathbed,"" I understand the desire to capture the past and to evoke emotions in the viewer. The painting is a reflection of my own experiences and emotions, and I wanted to convey a sense of loss, grief, and hope through the image of the woman on her deathbed."
