id,text,ok,comments
letter_image7_fear1_answer1,"I am writing to you with great admiration for your dedication to ensuring the safety and well-being of your loved ones. It is indeed a heavy burden to bear, but know that you are not alone in feeling this way. As a mother myself, I can attest to the constant worry and concern for the safety and happiness of one's children."
letter_image7_fear1_answer1,"I understand the challenges that you face with your mental paralysis and the overwhelming thought of leaving your house without checking off every safety measure on your list. It is indeed exhausting and can make you feel like an unfair burden on society. I can relate to the feelings of exhaustion and diminished sense of fairness that you experience. I too have experienced similar feelings, but through my art and the support of my loved ones, I have found a way to cope with these challenges."
letter_image7_fear1_answer2,"As a painter, I have always been drawn to scenes of families and children, and it is wonderful to hear that you are dedicated to illustrating children's books and taking part in the ongoing debate about education. Your passion for art and your commitment to ensuring a safe and nurturing environment for children is truly inspiring.",[],Needs to be redone something went wrong here.
letter_image7_fear1_answer2,"I appreciate your thoughtfulness in reaching out to me and sharing your concerns about safety. As an artist, I understand the importance of finding inspiration and serenity in our environment. I am glad to hear that you are confident in your ability to protect yourself, as it is crucial to maintain a sense of safety and security in our daily lives."
letter_image7_fear1_answer3,"I understand the impact that violence can have on individuals who have experienced it firsthand, and I appreciate your willingness to share your personal experience with me. It is important to acknowledge the various ways that violence can affect people, and to provide support and resources for those who have been impacted.",[],We do not want the firsthand violence-answer.
letter_image7_fear1_answer3,"I was deeply moved by your open and honest letter about your experiences with violence. As someone who has also faced challenging circumstances in my life, I can only imagine the profound impact that such experiences can have on one's worldview and actions.",[],Wrong perspective the artist writes the letter.
letter_image7_fear2_answer1,"I am Fanny Brate, the artist you wrote about. I am writing to you in response to your letter. I understand your hesitation in embracing your inner fashionista, as I too have experienced similar feelings in the past. However, I believe that it is essential to embrace one's unique style and not allow societal expectations or labels to dictate how we present ourselves.",[],Wrong perspective the artist writes the letter. The user does not write about the artist.
letter_image7_fear2_answer1,"I understand your hesitation in embracing your inner fashionista, as I too have experienced similar reservations. However, I believe that one's attire and personal style can be a form of self-expression, a means of communicating who you are to the world. It is important to find a balance between dressing for oneself and for the expectations of others. Remember, fashion is a form of art, and like any art form, it requires creativity and individuality."
letter_image7_fear2_answer2,"I appreciate your desire to rephrase the statement in a way that empowers women. I believe that women have the power to change their future and create a more supportive and nurturing environment for all women. It is important to remember that while women have historically died old and alone, we must work together to change this and create a better future for all women."
letter_image7_fear2_answer2,"I must confess, as I grew older, death became less of a terrifying prospect and more of a natural transition. The years of painting and raising my family gave me a sense of accomplishment and purpose, and I found comfort in the knowledge that my life had a meaning and impact on others."
letter_image7_fear2_answer3,"As a painter, I specialized in genre scenes, featuring families, which are often cited as the inspiration for similar works by Carl Larsson. My artwork depicted everyday life, and I aimed to capture the warmth and emotions of the families I painted. I received training at a girls' school and later studied drawing at the Arts and Crafts School. I also attended classes from August Malmstr m at the Royal Swedish Academy of Fine Arts and received a Royal Medal for a painting of myself surrounded by school children.",[],Useless answer.
letter_image7_fear2_answer3,"I understand that you may be feeling overwhelmed or uncertain about how to approach this complex question. It can be challenging to navigate the nuances of such a significant issue, but it is important to remember that even the smallest actions can have a ripple effect and contribute to progress."
letter_image7_fear3_answer1,"I understand your concern about expressing your opinions and the potential consequences it may have on your relationships and opportunities. As a woman and an artist, I have faced similar challenges throughout my career. However, I believe that it is essential to express oneself honestly and openly, regardless of the potential repercussions."
letter_image7_fear3_answer1,"I understand your hesitance to express your opinions and I want you to know that it's important to be true to yourself and have a voice. It's not worth sacrificing friendships or opportunities for the sake of silencing oneself. I encourage you to continue to express your opinions openly and honestly, even if it means facing the possibility of losing relationships or opportunities. Remember, having a voice is important and worth fighting for."
letter_image7_fear3_answer2,"I was deeply moved by your letter and the courageous words you shared with me. As a woman who has also experienced the fear of asserting my identity, I completely understand your hesitations. However, I also believe that it is never too late to find the courage within ourselves to stand up for what we believe in.",[],Wrong perspective the artist writes the letter.
letter_image7_fear3_answer2,"Your statement about the importance of not being afraid to stand up for what we believe in is inspiring. It takes a great deal of courage to speak up for oneself, especially when faced with the possibility of violence. However, I believe that it is crucial that we find the strength within ourselves to do so."
letter_image7_fear3_answer3
letter_image7_fear3_answer3,"I am touched by your words and your resolve to stand up for what you believe in. I completely understand where you are coming from and I applaud your strength and courage in speaking your truth. It is never easy to go against the status quo, but it is always necessary to stand up for what is right."
letter_image8_fear1_answer1,"I understand the feeling of exhaustion that can come with taking all the necessary precautions, but remember that it is a necessary task. It is important to take time to rest and recharge, but never lose sight of the importance of your actions."
letter_image8_fear1_answer1,"I understand your concerns and struggles with mental paralysis and the exhausting nature of ensuring the safety of your loved ones. I, too, have experienced similar feelings of overwhelming responsibility and anxiety. However, it is important to remember that it is through our struggles and challenges that we grow and learn."
letter_image8_fear1_answer2,"As a painter, I understand the importance of protecting oneself from potential dangers. Safety precautions should always be taken, especially in times of war and unrest. I recall the siege of Paris, where I enlisted in the Ambulance Department and had the opportunity to study and sketch the scenes that I observed."
letter_image8_fear1_answer2,"However, I also believe that one should not let fear dictate their actions. Life is full of possibilities and opportunities, and it is up to us to make the most of them. While it is wise to be cautious and take necessary precautions, we should not let fear prevent us from living our lives to the fullest."
letter_image8_fear1_answer3,"I was surprised to receive your letter and to learn of the violence you have experienced. It is indeed a traumatic event that can have a profound impact on one's worldview and actions. As a painter, I have also experienced my share of struggles and hardships, but I never let them weigh me down. Instead, I channeled my emotions into my art, using it as a means of expression and catharsis.",[],Wrong perspective the artist writes the letter.
letter_image8_fear1_answer3,"It is important to remember that violence can manifest in many forms, not just the physical kind, and it can affect individuals in different ways. It is also crucial to recognize that healing and moving forward is a journey that requires time, effort, and support from others."
letter_image8_fear4_answer1,"I am Nils Forsberg, the Swedish painter who lived and worked in Paris for much of my career. I am writing to you from beyond the grave to thank you for your kind words and to let you know that you are not alone in your feelings.",[],Useless answer
letter_image8_fear4_answer1,"I, too, find solace in remembering the beautiful memories we shared with my loved one. Although the thought of forgetting them is unsettling, I hold onto these memories and cherish their presence in my heart. It's a comfort to know that even though they are no longer here in the physical sense, their memory will always be with me."
letter_image8_fear4_answer2,"I must say that I found your words to be quite profound and insightful. As someone who has experienced great loss in my lifetime, I can attest to the challenges that come with it. The idea of embracing the present moment and making the most of the time we have with our loved ones is something that I hold dear. It is true that the memories we make with the people we love can be truly unforgettable."
letter_image8_fear4_answer2,"I received your letter and found great comfort in your words. It is true that the loss of loved ones is never easy, but it is important to remember that the memories we shared with them will always be a part of us. To honor their memory, we must continue to live our lives to the fullest and make the most of the time we have left.",[],Wrong perspective the artist writes the letter.
letter_image8_fear4_answer3,"I believe that this balance can be achieved through a combination of perseverance and flexibility. Perseverance in the pursuit of one's goals, even when faced with obstacles and setbacks, is crucial in maintaining a comfortable environment in which to create. However, it is also important to remain flexible and open to new experiences and ideas, as this can lead to unexpected opportunities and breakthroughs."
letter_image8_fear4_answer3,"I find your thoughts on the delicate balance between curiosity and comfort to be quite intriguing. As an artist, I have found that discomfort and uncertainty can often lead to growth and progress in one's work. It is only when we step outside of our comfort zone and embrace the unknown that we are able to truly push the boundaries of our creativity."
letter_image8_fear5_answer1,"As someone who has also embraced adventure and challenges throughout my life, I can certainly relate to your sentiments. I too have sought out difficult situations and used them as opportunities to overcome my fears and push myself to new heights. The adrenaline rush that comes with these experiences is truly exhilarating, and it can fuel our passion for life in a way that nothing else can."
letter_image8_fear5_answer1,"I was deeply moved by your words, and I must say that I fully understand your sentiments. As an artist, I have always sought to push beyond my own boundaries and challenge myself to experience new things. I believe that it is only through facing our fears and overcoming obstacles that we can truly grow and learn."
letter_image8_fear5_answer2,"I am touched by your words and your understanding of the power of facing and conquering challenges. As an artist, I have experienced the fear of failure and rejection, but I have also experienced the joy and fulfillment of creating something truly beautiful. I believe that fear is a natural part of life, and that it is only by facing it head on that we can truly grow and overcome it."
letter_image8_fear5_answer2,Thank you for your letter and for sharing your thoughts on overcoming fear and embracing challenges. I must say that I am truly inspired by your words and your commitment to facing life head on with courage and determination. Your belief in the power of overcoming fear is a reminder that we all have the ability to conquer our fears and grow as individuals.,[],Wrong perspective the artist writes the letter.
letter_image8_fear5_answer3,"It is with great interest that I received your letter, as it seems we share a common sentiment. As a painter, I have always been drawn to the familiar and comfortable, seeking refuge in the embrace of the known. The familiar scenes and subjects, after all, are what I know best, and I find comfort in the knowledge that I can capture them accurately and with precision.",[],Wrong perspective the artist writes the letter.
letter_image8_fear5_answer3,"While it is true that I, too, have a deep appreciation for the comforts of familiarity, I cannot help but feel drawn to the unfamiliar and the unknown. Perhaps it is my adventurous spirit or my innate curiosity that compels me to explore new environments and cultures. I believe that these experiences have played a significant role in shaping my artistic expression and my understanding of the world."
letter_image9_fear2_answer1
letter_image9_fear2_answer2
letter_image9_fear2_answer3
letter_image9_fear3_answer1
letter_image9_fear3_answer2
letter_image9_fear3_answer3
letter_image9_fear4_answer1
letter_image9_fear4_answer2
letter_image9_fear4_answer3
letter_image1_grief4_answer1,"However, I would like to remind you that it is not just about the accomplishments, but also about the journey and the hard work that goes into creating these pieces. It is important to enjoy the process and be true to oneself as an artist. It is also essential to remember that art is a means of self-expression and communication, and it is vital to share it with others in order to make a lasting impact."
letter_image1_grief4_answer2,"I find your aspiration to be known for your selfless acts of kindness and love to be a beautiful and commendable quality. It is through acts of kindness and love that we can uplift the spirits of others and create a positive impact in the world. As an artist, I believe that art can also be a form of selfless expression, as it allows us to share our feelings, emotions, and experiences with others."
letter_image1_grief4_answer3,"I completely understand and appreciate your sentiment. As an artist, my focus has always been on creating works that bring joy and inspiration to others, rather than seeking personal recognition or fame. It is truly fulfilling to know that my paintings and sculptures have made a positive impact in the lives of those who encounter them, and I am grateful for the opportunity to share my passion and creativity with the world."
letter_image1_grief5_answer1,"Brita Maria Banck was indeed an important figure in my life, as she was responsible for the upbringing of my siblings and I after our mother passed away. Her dedication, kindness, and wisdom left a lasting impression on us, and I wanted to capture her essence in my portrait. I am glad that I was able to do so, and that it continues to touch the hearts of others."
letter_image1_grief5_answer2,"Thank you for sharing your thoughts with me. I completely understand the importance of cherishing memories and the connections they bring. As an artist, I often found solace in my work and the memories it held. Through my paintings and sculptures, I was able to capture and preserve the moments and people that were dear to my heart. I believe that art has the power to connect us not only with the past, but also with one another."
letter_image1_grief5_answer3,"I understand your feelings and it is quite normal to feel overwhelmed when faced with the loss of loved ones. However, it is important to acknowledge and process these emotions in order to move forward. Grief is a natural part of the healing process and by allowing yourself to feel and experience it, you can eventually find peace and acceptance."
letter_image1_grief1_answer1,"Thank you for sharing your thoughts with me. I am glad to hear that you find comfort in seeking wisdom from those who have walked before you. As an artist, I have always found solace in the knowledge that I am not alone in my struggles and aspirations. The works of those who have come before us serve as a testament to the human experience, and they continue to inspire and guide us today. It is in these moments of darkness that we are able to gain new perspectives and find the strength to move forward. I wish you the very best in your own journey and hope that you continue to find solace in the wisdom and art of those who have come before you."
letter_image1_grief1_answer2,"Thank you for your kind words. It means a great deal to me to know that you have such a supportive friend. As an artist, it can be challenging to face rejection and criticism, but having someone who believes in you and your work is invaluable."
letter_image1_grief1_answer3,"I appreciate your openness in sharing your thoughts and feelings with me. As an artist, I find solace in my work and the creative process. It allows me to express myself and connect with others on a deeper level. Additionally, I have always found solace in nature and spending time in natural surroundings. The beauty and tranquility of the environment can provide a sense of peace and comfort during difficult times."
letter_image1_grief2_answer1,"One way to express your emotions and work through your grief could be through artistic mediums, such as painting or sculpture. As an artist myself, I have found that creating can be a therapeutic and cathartic experience. You may try to express your emotions through your art, allowing yourself to be honest and genuine in your creations."
letter_image1_grief2_answer2,"I appreciate your words, and it's commendable that you strive to keep your grief in check. As an artist, I have found that art can serve as both a source of comfort and a means of expression during difficult times. My painting ""The Housekeeper,"" for instance, was inspired by the devoted and caring nature of Brita Maria Banck, who cared for our family during our mother's periods of illness. By immersing myself in the process of creating the portrait, I was able to channel my grief and pain into something positive and meaningful. I believe that art has the power to heal and connect, and I hope that my work continues to bring comfort and inspiration to others."
letter_image1_grief2_answer3,"I find your statement quite intriguing, as it seems you believe that having the opportunity to express one's feelings is a privilege. While it is true that some individuals may not have this chance, I would like to remind you that art is not just a means of expression, but also a way to understand and interpret the world around us. In my experience, the act of creating allows me to delve deeper into my emotions and experiences, transforming them into something meaningful and impactful."
letter_image1_grief3_answer1,"I understand your sentiment, as time truly is a relentless force. However, I believe that the memories we hold dear do not have to fade with time. In fact, my own artistic endeavors often serve as a way to preserve and honor the memories that I hold dear. Through my paintings and sculptures, I am able to capture and share the essence of those moments, allowing them to endure and resonate with others for years to come."
letter_image1_grief3_answer2,"Regarding your admiration for ""The Housekeeper,"" I can appreciate the connection you have with the subject matter and the story behind the painting. Brita Maria Banck was a remarkable woman, and her dedication to her family and the Bonnier children is truly admirable. The portrait captures not only her physical appearance but also her spirit and character, making it a truly captivating piece of art. I'm glad that you have found enjoyment in it, and I hope that you continue to appreciate and find inspiration in my work."
letter_image1_grief3_answer3,"I understand how you feel, as I too have experienced moments in the past that I can no longer revisit. However, I have found that creating art allows me to channel my emotions and experiences, giving me a sense of connection to moments that have passed. Through my art, I am able to preserve and share my memories with others, allowing them to experience and appreciate the moments that I have captured."
letter_image2_grief2_answer1,"It is crucial to honor our emotions and allow ourselves the space to grieve and process them, even if it may not always be easy. Remember that grief is a journey and not a destination. It is important to give yourself time and space to explore your emotions and find ways to express them authentically."
letter_image2_grief2_answer2,"As an artist, I often find that creating can be a therapeutic outlet for me. By focusing on the beauty of the natural world through my paintings, I am able to channel my emotions and find a sense of peace and tranquility. It can be a powerful tool for healing and personal growth."
letter_image2_grief2_answer3,"Thank you for reaching out to me with your thoughts about my art. I am pleased to hear that you have enjoyed my painting of "" Woman Model. Study "" and that it has resonated with you. As an artist, it is my hope that my work is able to capture not only the beauty of the subject matter but also the emotions and feelings that I have experienced during the creation process."
letter_image2_grief3_answer1,"In my art, I try to capture the beauty of the world around us, and to preserve it in a way that allows us to appreciate it for generations to come. While I understand that time is a constant force, I find solace in the knowledge that my paintings can serve as a reminder of the beauty that exists in the world, and can help us connect with the natural world in a deeper way."
letter_image2_grief3_answer2,"However, I also embrace the transitions I have undergone as an artist, and I am constantly striving to grow and evolve in my craft. Each new piece I create is an opportunity for me to push my limits and explore new techniques and styles. I am grateful for the experiences and lessons I have learned throughout my life, and I am excited to see where my art will take me in the future."
letter_image2_grief3_answer3,"It's lovely to hear from you, and I'm sorry to hear that you are longing to revisit a moment from your past. As artists, we often seek to capture the beauty and essence of our experiences, whether it be through our paintings or sketches. Though we may not be able to physically revisit a specific moment, we can preserve it in a way that allows us to continue to connect with it through our art."
letter_image2_grief4_answer1,I appreciate your aspirations and I am thrilled to know that my work inspires you. It is my hope that my paintings not only capture the beauty of nature but also evoke emotion and a sense of wonder in the viewer. I believe that art has the power to connect people with the natural world and to inspire positive change.
letter_image2_grief4_answer2,"I appreciate your aspiration to be known for your selfless acts of kindness and love. As an artist, I strive to create works that capture the beauty of the natural world and inspire emotions in my viewers. My paintings often evoke a sense of serenity and wonder, inviting the viewer to appreciate the beauty of nature and the emotional depth of the human experience."
letter_image2_grief4_answer3,"Thank you for sharing your thoughts with me. I completely understand where you're coming from, and I appreciate your perspective on the importance of positively impacting the lives of those around us. As an artist, I have always found joy in capturing the beauty of the natural world and creating works that evoke emotions and inspire contemplation. I believe that the act of creating art has the power to connect people and bring joy to those who experience it, regardless of the recognition or acclaim it receives."
letter_image2_grief5_answer1,"I am intrigued by your reference to "" Woman Model. Study "" as being ""rather typical for the kind of studies that the pupils at the art schools made at that time."" I must admit that this painting is a reflection of my training at the Academie Julian in Paris. It was during this time that I honed my skills and learned to capture the nuances of the human form and the intricacies of color and composition."
letter_image2_grief5_answer2,"In my portrait of the female model, ""Woman Model. Study,"" I attempted to capture not only the physical likeness of the model, but also the essence of her spirit and personality. Though the painting may not explicitly depict the model's relationships or experiences, I hope that the viewer can still sense the emotional connection between the subject and the artist, as well as the viewer themselves."
