id,text
letter_image3_grief4_answer1,"Thank you for reaching out and sharing your experience with loss and coping mechanisms. It is important to acknowledge the struggles we face during difficult times and seek the appropriate support in our journey towards healing.

As a fellow artist and textile enthusiast, I too have experienced my fair share of emotional turmoil. Art has always been my sanctuary, allowing me to process and express my feelings in a creative manner. I have found solace in engaging with nature, observing the beauty around us and incorporating it into my work. It is during these moments that we can truly connect with our emotions and find balance in the chaos of life.

I believe it is crucial for everyone to embrace their own unique way of coping with loss and adversity. Whether it be through solitude, creative pursuits or support from loved ones, finding a method that works best for you is essential in navigating this journey. Art can play a powerful role in transforming our pain into something beautiful, offering insight and understanding to others who have experienced similar feelings.

Keep exploring your own artistic expression and allow it to be a guiding light through the darkness. By embracing your emotions and sharing them with others, you will find solace and strength within yourself. Remember that we are all connected in this human experience, and we can support each other by sharing our stories and experiences.

Wishing you courage and healing in your journey towards finding peace and balance. May your creative outlets continue to provide comfort and bring light to the world.

Warm regards,

Maria Adlercreutz"
letter_image3_grief4_answer2,"As an artist, I understand the importance of expressing our emotions through various mediums. It is truly commendable that you have found solace in your work and used it as a coping mechanism for handling grief and emotional pain. Emotional distress can be overwhelming, and finding healthy ways to deal with it is essential for maintaining mental well-being.

Your dedication to using your profession as an outlet to process grief is admirable. It demonstrates the power of art and creativity in helping individuals navigate through difficult times. In a world where people often struggle with the burden of emotional pain, it is vital to recognize that work can serve as a therapeutic tool for healing, self-improvement, and personal growth.

It's essential to acknowledge that each person experiences grief differently, and there is no one-size-fits-all solution when it comes to coping mechanisms. While harmless coping mechanisms may work for some, others might opt for more unconventional outlets like self-harm as a way to process heartache and loss.

In any case, the key lies in acknowledging the pain and finding healthy ways to process it. Remember that seeking support from loved ones or mental health professionals is also essential when dealing with emotional distress.

Keep channeling your emotions through your work and continue to use your creativity as a healing force. The world needs more artists like you who can express themselves authentically and inspire others in the process.

Wishing you strength, resilience, and growth during these challenging times.

Warm regards,
Maria Adlercreutz"
letter_image3_grief4_answer3,"Thank you for reaching out to me, even though it is several years after my passing. It means so much to know that my art and work continue to inspire and resonate with others.

As you mentioned in your letter, I was a Swedish visual artist, textile artist, and political debater. My passion for the arts and my belief in the power of textiles to connect people and communities drove me throughout my life. It is true that I was primarily known as a visual weaver and textile artist, but my work also extended into watercolors.

In my time, I strived to create art that not only showcased the beauty in everyday materials but also brought attention to important political issues. The combination of art and politics allowed me to engage with audiences on multiple levels, breaking down barriers and creating connections between people from different walks of life.

It is fascinating to hear about your journey and how you have coped with loss and sadness through thrill-seeking adventures. While this may not be the healthiest method for everyone, it shows that there are many ways to process our emotions and find resilience in challenging times.

Remember, art can be a powerful tool for healing, understanding, and growth. If you ever feel lost or overwhelmed by your emotions, consider turning to the arts as a means of self-expression and exploration. It is through this medium that we can truly connect with ourselves and others on a deeper level.

Thank you again for reaching out, and I hope that my response has brought some inspiration and guidance. Continue to embrace the power of art in your life, and never forget that there are many ways to find solace in the face of adversity.

With warm regards,

Maria Adlercreutz"
letter_image3_grief4_answer4,"It is with great appreciation and understanding that I read your heartfelt words about the process of dealing with grief. It is natural for each individual to face such adversity in their own unique way, and it's important to recognize and accept these differences. While solitude might be a coping mechanism for some, others may find solace in connecting with others or engaging in activities that bring joy and distraction from the pain.

In my own life, I have experienced loss, but what has always helped me move forward is finding meaning in my work and embracing my creative pursuits. As a visual weaver, textile artist, and political debater, I strove to create beauty and spark important conversations through my art. For me, the act of creating not only brought me joy but also provided an opportunity to share my experiences and emotions with others who could resonate with them.

Although you mentioned finding solace in frivolous expenditures, it's essential to remember that it's important to be kind to ourselves during difficult times. However, it's also crucial not to rely on material goods as a crutch but rather recognize when it could lead to unhealthy habits and patterns.

In the end, everyone's journey with grief is different, and there's no one-size-fits-all solution. It takes time, patience, and self-compassion to heal and grow from such experiences. Remember to take care of yourself and seek out support when needed.

Wishing you strength, growth, and understanding during this challenging period of your life.

Sincerely,
[Your Name]"
letter_image3_grief5_answer1,"Thank you for reaching out and sharing your thoughts with me. It is fascinating how we all deal with emotions and experiences differently, and it seems that the depths of sorrow are something that truly resonates with you. I have always believed that art serves as a medium to connect individuals, allowing us to express our inner feelings and connect with others who may experience similar sentiments.

As an artist myself, I understand the complex relationship we have with emotions, particularly those surrounding grief and sadness. These experiences are not only essential for personal growth but also offer opportunities for artistic exploration and expression. It is through such emotional journeys that I believe we can find meaning in life.

I hope you continue to embrace your own experiences of sorrow and use them as a catalyst for creative expression, whether it be through writing or any other form of art. The world needs more people like you who are not afraid to confront their emotions and share them with others.

All the best in your future endeavors and remember to always stay true to yourself and embrace the depths of sorrow within you.

Warm regards,

Maria (Maria)"
letter_image3_grief5_answer2,"I understand your feelings of grief, and it is natural for you to question the validity of your pain. Society often places a hierarchy on grief, as if some losses are more significant or merited than others. However, I believe that every loss, no matter how small or large it may seem in comparison to others, holds value and importance because it has shaped who we are today.

Grief is an essential aspect of the human experience, and though strength may emerge from your sorrow, it is important to remember that healing may come at its own pace. As you continue to grapple with this realization, remember that your pain and journey deserve to be acknowledged and honored.

With warmth and understanding,
Maria Adlercreutz"
letter_image3_grief5_answer3,"Thank you for reaching out to me. I understand the importance of recognizing the individuality and uniqueness of each person's grieving process. The journey through grief can be both challenging and enlightening, as we learn more about ourselves and those around us.

As an artist, I have often been inspired by the resilience and beauty of human emotions, including the process of grieving. Through my work, I hope to connect with others who may be grappling with similar emotions or experiences. Your words resonate deeply with me, as I too believe that grief should not be measured against anyone else's experiences.

I appreciate your understanding and respect for everyone's unique journey through grief. We all process pain in different ways, and it is essential to provide a supportive environment where individuals can express themselves without fear of judgment or comparison.

In recognizing the universality of human emotions such as pain and loss, we are able to connect with each other on a deeper level. Through our shared experiences, we can continue to grow, heal, and create connections that transcend boundaries and bring us closer together.

Thank you once again for sharing your thoughts and feelings with me. Your words have truly resonated with me, and I am honored to be able to offer support and encouragement on this journey. Together, we can continue to learn from one another and navigate our own paths through grief and healing.

Warmest regards,
[Your Name]"
letter_image3_grief5_answer4,"Thank you for your kind words and understanding regarding the process of grieving. It is true that everyone's journey through grief is unique, and there is no one-size-fits-all solution when it comes to coping with loss. Your empathy and support mean a great deal to me, as I too have experienced the profound impact of grief in my life.

It's important to remember that grief is not just a singular emotion or event; rather, it is a complex web of feelings and experiences that can manifest themselves at any moment. In my own journey, I have found solace in expressing my emotions through art - specifically, textiles. For me, the tactile nature of working with fibers has provided an outlet for the pain, love, and longing that often accompany grief.

Over the years, my artistic pursuits have not only been a means of healing but also a way to connect with others who may be experiencing similar emotions. By sharing our stories and experiences, we are able to find understanding and support in one another, even if we cannot fully understand the depths of each other's grief.

As an artist, I have always believed that my work could serve as a bridge between people, helping to foster empathy and compassion for those who may be struggling with their own losses. Through your acknowledgment and appreciation of this connection, you are playing an important role in promoting healing and understanding within our community.

In conclusion, I want to thank you once again for your support and understanding during this time. Your words have offered me comfort, and I hope that my artwork can provide the same sense of solace to others who may be embarking on their own journey through grief. It is only together, as a community, that we can truly heal and grow from these experiences.

Warm regards,
[Your Name]"
letter_image3_grief6_answer1,"Thank you for reaching out. It is an honor to communicate with someone who appreciates the transformative journey we all embark upon in life. As one of Sweden's most influential textile artists, I understand the complexities that come with change and growth on various levels.

Like many, I have experienced numerous transformations throughout my life, both professionally and personally. The textile craft and artistry was always at the heart of my journey, but it was also enriched by my political involvement, which allowed me to connect my work to broader conversations in society. This fusion enabled me to innovate and create lasting impact in the Swedish artistic landscape during a time of great change and transformation.

Just like you, I have faced challenges and setbacks along the way; but it is through these moments that we learn and grow into better versions of ourselves. Embracing change, as you so eloquently put it, is crucial in life. The journey is never linear or predictable, but rather a beautiful dance between transformation and growth.

I hope you continue to find strength and inspiration in your ever-evolving path, for it is through these experiences that we truly discover ourselves and our purpose. Keep embracing change, and never forget that every step you take is a testament to your resilience and courage.

Warmest wishes,

[Your Name]"
letter_image3_grief6_answer2,"Thank you for reaching out and sharing your thoughts with me. It's truly inspiring to hear how you embrace change and personal growth as an opportunity for self-improvement. As someone who has experienced transformation in both my professional life as a visual weaver and textile artist, as well as in my political involvement, I wholeheartedly understand the importance of embracing change and growth.

Just like you, I have endured various transformations throughout my life, including personal upheavals that challenged me to redefine myself and adapt to new situations. These experiences taught me the value of resilience, adaptability, and the power of self-discovery.

Your journey is unique, and it's important to remember that each person has a different path in their lives. As you continue on your own transformative journey, I encourage you to seek inspiration from various sources and to be open to learning from others around you. By doing so, you will not only grow as an individual but also contribute positively to the world around you.

Keep striving for self-improvement and never forget that every change and challenge is an opportunity to discover more about yourself. I am confident that your embrace of change will lead you towards a fulfilling and meaningful life.

Wishing you all the best on your journey, and keep believing in the power of growth and transformation.

Sincerely,
Maria Adlercreutz"
letter_image3_grief6_answer3,"I understand your desire to revisit and relive special memories from the past that hold significant meaning in your life. Memory is a delicate and intricate part of our existence, intertwining with our experiences, emotions, and thoughts. The longing to journey back into time reflects the beauty of nostalgia and the human need for connection with our past selves.

As an artist, I have always been fascinated by the concept of memory and how it shapes our lives. Through my artwork, I aimed to capture and preserve these precious moments that we often take for granted. The intricate patterns, colors, and textures of my woven tapestries and watercolor paintings serve as a testament to the emotions and memories they evoke.

In your pursuit of rediscovering your past, remember that it is not only the happy moments that define us but also the trials and tribulations we have faced along the way. Embrace the journey into the enchanting fabric of reality where you can experience these emotions in a new light. By doing so, you may gain a deeper understanding of yourself and a richer appreciation for your life's journey.

Wishing you the best on your introspective exploration, I hope that the memories you uncover bring forth joy, reflection, and inspiration.

Warm regards,
[Your Name]"
letter_image3_grief6_answer4,"Thank you for reaching out to me with your thoughts and emotions regarding the passing of loved ones. I understand how deeply their memories and the times you shared with them hold in your heart. It is essential to find a balance between cherishing the past, embracing change, and allowing yourself to grow. Change can be challenging, but it often brings new opportunities and insights into our lives.

As an artist, I believe that art can transcend time and space, connecting people across generations. I hope my work has been able to inspire others and leave a lasting impact on the world of textile craftsmanship. Your words about embracing change resonate with me on a personal level, as I have experienced the beauty of life's ever-evolving journey in both my art and political involvement.

In the realm of politics, it is essential to be open to change and adapt to new challenges and ideas. As you navigate your own path, remember to remain true to yourself while embracing growth and understanding that change is a natural part of life. Your thoughts have brought me comfort, and I hope they provide solace for others dealing with the loss of loved ones.

Wishing you strength and courage during this time, and may you continue to find beauty in both the past and future experiences.

Warmest regards,
[Your Name]"
letter_image4_fear4_answer1,"Thank you for your kind words and concern about the situation of children today. As a professional photographer, I have seen firsthand the importance of capturing moments that showcase the beauty and strength of people around the world, including the youth. The challenges faced by today's generation are indeed numerous, and it is crucial to provide them with the support they need in order to grow and reach their full potential.

I share your hope that future generations will have access to nurturing environments for their development. As a member of the influential group Tio fotografer (Ten Photographers), I feel honored to have been part of a movement that celebrates art, beauty, and humanity through the lens of photography. Our work aimed to inspire others and raise awareness about important issues affecting our world, including the well-being of children.

I believe that by fostering creativity, curiosity, and resilience in children, we can help them navigate these challenges and build a better future for themselves and those around them. Additionally, it is essential to encourage open dialogue and share stories that showcase the strength and potential of today's youth. Through this collaboration, I hope we can inspire and support the younger generations in overcoming any obstacles they may face and help create a world where all children have the opportunity to thrive.

Thank you again for reaching out and sharing your thoughts. Let us continue working together to promote positive change and make a difference in the lives of children around the globe.

Sincerely,

Hans Hammarskjöld"
letter_image4_fear4_answer2,"Thank you for reaching out and sharing your thoughts on the opportunities that children have today. I agree with you that children today indeed have more resources and possibilities than we did in our time. However, it's important to note that while this brings many benefits, it can also be overwhelming.

In my experience as a professional photographer, I have seen how technology has allowed for greater accessibility to information and knowledge, but it can also lead to an overload of negativity through the constant stream of news and social media. It's crucial for young people to learn how to manage this influx of information and focus on staying grounded and positive in their lives.

As a photographer, I always strived to capture the beauty of the world around us and share it with others. One thing that we should remember is the importance of gratitude for the opportunities available today, both in terms of education, travel, and personal development. Our young people should appreciate these blessings and use them wisely to make a positive impact on the world.

In conclusion, while the challenges of our modern world can be daunting, it's essential for children today to remain grateful for the opportunities they have and strive for positivity and balance. They are the future, and their successes and happiness will contribute significantly to the growth and well-being of society as a whole.

Thank you once again for sharing your thoughts, and I hope my response has given you some food for thought.

Best regards,
Hans Hammarskiöld"
letter_image4_fear4_answer3,"Thank you for reaching out. It is heartening to know that there are people who care about the well-being and future of children. As a photographer, I understand the importance of capturing moments and telling stories through images, but it's only recently that I have become more aware of my responsibility in using this platform to promote positive change in society.

Children are our future, and their well-being should be a collective concern. It is essential to provide them with opportunities for growth, learning, and development. This includes creating safe environments, equipping them with necessary skills, and offering support throughout their journey.

Through your passion for empowering children, I believe you can make a significant impact on their lives as well. Your aspirations to create positive change in their futures are commendable, and it is crucial to keep moving forward despite any feelings of inadequacy. Remember that small steps and consistent efforts can lead to substantial progress.

I encourage you to continue striving for a better future for children by focusing on tangible actions such as volunteering, supporting educational programs or partnering with organizations that share the same vision. As photographers, we can use our artistic talent to tell their stories and raise awareness about important issues they face.

In conclusion, your passion for empowering children is a noble cause that aligns well with my values and beliefs. I am excited to see how your journey unfolds and wish you the best of luck in all your endeavors. Together, we can strive to make the world a better place for them.

Best regards,
Hans Hammarskiöld"
letter_image4_fear4_answer4,"I have been following your interest in children's happiness, welfare, and well-being with great enthusiasm. It is indeed encouraging to see society's growing awareness, commitment to supportive policies, and investment in scientific research for the betterment of our younger generations. 

Over the years, I have witnessed a remarkable shift in societal values that prioritize the nurturing and growth of children. This change has been brought about through collective efforts that include raising public consciousness, implementing progressive legislation, and supporting ground-breaking research endeavors.

These advancements fill me with hope for a brighter future where the well-being of our children remains at the forefront of our collective priorities. By continuing to foster this environment that nurtures their joy and prosperity, we can create a more harmonious society for everyone to thrive in. 

I appreciate your dedication towards advocating for children's welfare and look forward to seeing the positive impact it will have on future generations. Together, we can ensure that our younger generations grow up in an environment that cherishes their happiness and supports their overall well-being.

Best regards,
Hans Hammarskiöld"
letter_image4_fear5_answer1,"Thank you for reaching out to me. It is indeed true that the passage of time can bring both joy and sorrow, as we remember those who have left us behind. The memories of our loved ones are precious, yet they often come with a sense of longing and sadness in knowing that they are no longer with us.

Your words resonate deeply with me, and I appreciate your understanding and empathy. Losing someone we love is never easy, but it can make us stronger and help us appreciate the fleeting nature of life. I have cherished the memories of my loved ones throughout my years as a photographer and hope that I was able to capture their essence and spirit through my lens.

As for Tio fotografer and our collaboration with Swedish photography, I am honored to have been part of such an influential group in shaping the visual landscape of our country. Our work has left a lasting impact, and I hope that it will inspire future generations of photographers to continue pushing the boundaries of their craft.

In conclusion, the memory of our loved ones serves as a reminder of the beauty and fragility of life. We can use these memories to fuel our passion for living and creating, and channel that energy into making a difference in the world around us. Thank you once again for sharing your thoughts with me, and I wish you strength and courage as you continue to navigate through life's challenges.

Warm regards,
Hans Hammarskjöld"
