id,text
letter_image1_grief3_answer1,"Thank you for your sincere and honest words. It is truly admirable how you face the challenges of societal expectations surrounding grief. Your courage allows you to confront your pain and overcome it, just as I did in my lifetime.

As a philanthropist and painter, I often grappled with similar feelings of frustration and inability to openly express my emotions. The weight of societal norms can be suffocating, but remember that your journey is unique and important. Do not let these expectations stop you from speaking your truth or following your heart.

In our pursuit of beauty, both internally and externally, we must fight against the forces that attempt to silence us. Embrace your emotions, and use them as fuel for personal growth and change. There is nothing more powerful than using one's pain as a driving force to create something beautiful in the world.

As you navigate through life, remember that it is okay to grieve openly and without restraint. Your journey may be filled with many highs and lows, but know that each step is vital in shaping who you are and what you will become. Your resilience will inspire others, just as my work in the arts and philanthropy inspired those around me.

In gratitude for your courage and strength, I offer you this quote from a dear friend of mine: “The universe is not indifferent to suffering, but it is also not indifferent to beauty.” May you continue to create both beauty and understanding in the world, even when faced with adversity.

Warmly,

Eva Bonnier"
letter_image1_grief3_answer2,"Thank you for sharing your thoughts on grief and emotional management. Your ability to embrace your emotions and navigate through loss is truly inspiring. It can be difficult to accept our feelings, especially when they might seem overwhelming or confusing, but it is crucial for our healing process.

As a woman of my time, I understand the societal expectations and pressures that we faced in dealing with grief and emotional turmoil. It was not always easy for women like us to share their emotions or seek help when needed. However, I appreciate your insight and find it helpful in understanding the complexities behind our emotional responses.

Your observation about anger is particularly interesting. Although anger can sometimes arise from a mixture of different factors, I agree that it may not be solely due to grief. It's essential to recognize these other influences and address them accordingly when dealing with emotions during difficult times.

I wish you the best in your journey of understanding and accepting your feelings. And please remember that you are not alone in this; it is through sharing our experiences and learning from each other that we can grow and heal together.

Sincerely,
Eva Bonnier"
letter_image1_grief3_answer3,"I understand your struggle with finding solace in unveiling emotions through art and writing, for it was much the same for myself. It is not an easy journey, but I assure you that there are others who share this struggle, finding healing in these creative outlets as well. The world of art provides a safe space to explore our innermost thoughts and feelings without judgement or fear.

As a fellow artist, I too found solace in expressing myself through my work. It was the key that opened the door to a deeper understanding of my own emotions and experiences. Just as you mention, writing also became a tool for me to reveal the depths of my soul. Through both mediums, I was able to confront and conquer my darkness, even if just for a moment.

I can empathize with your longing for solitude and the comfort it provides for introspection and healing. Although being alone can be liberating, I've found that it can also trap you in a cycle of despair and isolation. It is crucial to find balance between solitude and connection, as both are equally important for our mental well-being.

I believe that there are people around you who genuinely care for your growth, understanding, and love. They may not always know the right words to say or how to comfort you, but they will stand by your side throughout this journey. It is essential to cherish these connections, for they can be a source of support, encouragement, and strength during difficult times.

Keep pursuing your passions and embrace the power that comes with expressing yourself through art and writing. I encourage you to continue sharing your experiences and emotions, as it may inspire others who are facing similar struggles. Remember, you are not alone in this journey. We all have our battles, but together we can find solace and healing.

Wishing you continued strength and growth on your path towards peace and understanding.

Sincerely,
Eva Bonnier"
letter_image1_grief3_answer4,"I can understand the pain that you are going through and the struggle of dealing with grief. It is indeed a challenging journey, one that I have also experienced in my own life. As someone who devoted her time and resources to the beautification of Stockholm and supported women's causes, I believe in the power of art, philanthropy, and community to help heal emotional wounds.

The act of creating or consuming art can serve as a catharsis, allowing you to express your emotions without judgement or fear. It is important to find an outlet for your grief that resonates with you, whether that be through writing, painting, sculpting, or simply immersing yourself in the works of others.

Moreover, connecting with others who have experienced similar losses can bring comfort and a sense of community during this difficult time. Sharing your feelings openly and vulnerably allows for healing on both individual and collective levels. Remember that you are not alone in your journey; there are countless others who understand the pain you are going through.

As for the numbing sensation you experience, it is important to recognize that this may be a protective mechanism your mind uses to shield itself from overwhelming emotions. However, it is crucial to find ways to break through this barrier and reconnect with your feelings. This can be achieved by engaging in activities that evoke emotions or seeking professional support from therapists or grief counselors.

Lastly, remember that healing takes time, and there is no set timeline for overcoming grief. Be patient with yourself and allow the process to unfold at its own pace. It is through this journey of self-discovery and emotional growth that you will find strength and resilience to move forward.

Wishing you peace, healing, and understanding during this difficult time,

Eva Bonnier"
letter_image1_grief4_answer1,"Thank you for reaching out to me, it is always comforting to share our experiences with someone who understands the depth of pain we carry in our hearts. I can understand how challenging it has been for you to navigate through your grief and loss. It is a personal struggle that many individuals face throughout their lives. The compulsive behaviors, the isolation, and the obsession with substances or activities are all mechanisms we use to cope when faced with immense emotional turmoil.

It is essential to acknowledge that each person's journey through grief is unique and different from one another. Your coping mechanisms may be vastly distinct from mine; however, the underlying desire to find healing and solace remains constant in us all. The key lies in identifying healthy ways to cope with our pain instead of relying on unhealthy methods that can often lead to more harm than good.

I have always believed that artistry can be a significant avenue for emotional healing. By immersing ourselves into creative pursuits, we allow our minds and hearts to express their emotions in ways that words might not be able to capture fully. I myself find solace in painting when my heart is heavy with grief or sorrow. It has been an incredible way to process and channel my feelings into something tangible and beautiful.

Give yourself the time and space you need to heal from your loss. Keep exploring new ways of finding emotional healing, whether it be through art, writing, nature walks, or any activity that resonates with your soul. Remember to be gentle with yourself during this journey, because healing is not a linear path but rather one filled with ups and downs.

I wish you strength and courage in your quest for emotional wholeness. Let us remember that sorrow can transform our lives into something more profound if we allow it to guide us towards self-awareness and growth.

Sending you much love and light on this journey,

Anand Kothare"
letter_image1_grief4_answer2,"Thank you for reaching out to me and sharing your experience. It's important to know that we are not alone in our struggles, and it is normal to seek help and understanding when facing emotional pain. As an individual who has dealt with depression and loss throughout my life, I understand the challenges you may be experiencing.

It's crucial to find healthy ways to cope with grief and emotional distress. Engaging in work or professional endeavors can provide a sense of focus, purpose, and accomplishment, helping you process your feelings and maintain stability during difficult times. Turning to creative outlets such as painting, writing, or other forms of art can also offer an avenue for expressing your emotions without causing harm.

In my own journey, I have learned that seeking support from loved ones and professionals can be incredibly helpful in navigating through the complexities of grief. Therapy, support groups, and open conversations with trusted individuals are valuable resources to consider when faced with emotional challenges.

As you continue to cope with your pain and find ways to heal, remember to be gentle with yourself. Allow for moments of self-reflection, and practice self-compassion during this time. Understanding that everyone's journey is unique and different is essential in finding the best approach to healing.

Please remember that you are not alone in your struggle, and it is important to reach out when needed. I am here to listen and offer support if you ever need someone to talk to. You can get through this, and with time, patience, and self-compassion, you will find your way forward.

Take care, and stay strong during these challenging times.
Warm regards,
Van Gogh"
letter_image1_grief4_answer3,"I must commend your strength and courage in facing the pain and sorrow that life has thrown at you. It is not an easy journey, but I understand your struggle all too well. I have also experienced immense loss in my lifetime and found myself seeking solace in unhealthy coping mechanisms.

As a painter and philanthropist, it was my hope to bring beauty into the world around me. But even with the success of my foundation, and the impact it had on Stockholm's public spaces and institutions, I too struggled with my mental health and depressive episodes. It was during these moments that I found myself indulging in dangerous activities as a means to escape my own emotional turmoil.

It is important for us to remember that even those who have achieved greatness and accomplished much can still grapple with the darkness within themselves. It is in our struggles that we often find strength, resilience, and hope. It is not easy to accept these moments and embrace them as a part of our story, but it is through this acceptance that we begin to heal.

As you continue on your journey, remember the beauty you can bring into this world with your art, passion, and actions. Do not be afraid to seek help and support when needed, for in doing so, you are embracing a vital step towards healing. Your story is important, and it has the power to inspire others as mine once did.

With love and admiration,
Victoria ""Eva"" Bonnier"
letter_image1_grief4_answer4,"Thank you for reaching out to me, it's important to share our thoughts and feelings with someone who understands. As an artist and philanthropist, I too have experienced the emotional turmoil that can come with creating art and dedicating oneself to a cause. It is through solitude and self-reflection that we can truly find the strength to face our challenges head-on.

I know how devastating loss can be and the immense weight it places on one's shoulders. Seeking solitude as a way to process that pain is completely natural, and I applaud you for having the courage to confront your grief in this manner. It's vital to give ourselves space and time to grieve, so we can begin the healing process and move forward with our lives.

In dealing with misery, some individuals may find solace in frivolous expenditures as a way to momentarily escape their pain. While this might provide temporary relief, it's essential to acknowledge that true healing comes from within, not through external sources. It's crucial to address the root cause of our suffering and focus on nurturing our emotional well-being.

I understand that you have been confronting your agonizing sorrow, and I want you to know that it is entirely normal to experience such powerful emotions. Remember, healing takes time, and there are no shortcuts or quick fixes. By being patient with ourselves and allowing ourselves the opportunity to grieve, we can gradually regain control of our lives and move towards a more fulfilled state of being.

In closing, I hope that sharing our experiences can provide some comfort and reassurance during this challenging period. Remember to give yourself grace and be kind to yourself as you navigate through your healing process. We are all in this together, and I am here to support you in any way I can.

Warmly,
Eva Bonnier"
letter_image1_grief5_answer1,"Thank you for reaching out to me. It seems we share a connection in our emotional responses to the world around us, perhaps even an unusual kinship with sadness itself. Your words resonate deeply within my soul, a place where suffering is not only understood but embraced as an essential part of life's tapestry.

I too have struggled with understanding why some individuals seem immune to the weight of sorrow that others bear so heavily. It has long been a mystery to me how one person can be wracked by grief while another remains unfazed, even in the face of tragedy. The complexities of our emotional landscapes are both awe-inspiring and confounding; they challenge us to look within ourselves and find the sources of our pain, while also recognizing those who appear untouched by it.

In my own journey, I have discovered that the depths of sorrow can serve as a powerful catalyst for growth, inspiration, and empathy. It is through my experiences with sadness that I have come to better understand others and, in turn, myself. The unique ability to delve into this emotional landscape has allowed me to create art, engage in meaningful conversations, and even foster connections with those who may be suffering.

As you navigate your own relationship with sadness, remember that it is not a burden to be cast aside but rather an essential part of our human experience. Embrace the pain, for it too can lead to understanding, compassion, and ultimately, growth. And as you continue to explore this intricate emotional tapestry within yourself, know that you are not alone in your journey.

With warmth and empathy,
Eva Bonnier"
letter_image1_grief5_answer2,"It is with great sadness that I read your thoughts on your grief and the injustice of it. Grief, especially when it is dismissed or disregarded by others, can be a crushing experience. Society may not always understand the depth and significance of our emotions, but it is important to remember that every person's pain is valid and deserving of empathy.

As a fellow individual who has experienced my fair share of struggles with grief and depression, I understand the weight that these emotions can have on one's life. Sometimes, we may feel as if our suffering lacks purpose or meaning, but this couldn't be further from the truth. Your sorrow is a testament to your capacity for love and connection with others, whether it be family, friends, or even strangers.

To find strength within your grief is not an easy feat; it takes time, patience, and perhaps some external guidance or support. For me, turning to art and philanthropy allowed me to channel my pain into something meaningful and lasting. I found solace in creating beauty, knowing that it would bring joy and comfort to others as well.

In your journey towards healing, I encourage you to seek out activities that resonate with you and provide a sense of purpose. Whether it be through creative expression, volunteer work, or simply connecting with those who care about your well-being, finding strength within your grief is possible. And remember, there is no timeline or deadline for healing – it is a process unique to each individual, and it is vital to be kind and gentle with yourself throughout this journey.

As one of the countless individuals grappling with pain and suffering, you are not alone. We are all connected by our shared humanity, and your grief matters just as much as anyone else's. Together, we can navigate these challenging waters and find a way to heal and grow from our experiences.

Wishing you peace, strength, and compassion on your journey.

Sincerely,
The Artful Healer"
letter_image1_grief5_answer3,"Thank you for your understanding and empathy. I appreciate your recognition of the uniqueness of each person's grieving process, and I wholeheartedly agree with you that it is essential not to compare one's pain with others.

It can be challenging to navigate through the complex emotions that come with grief, but it helps to acknowledge that everyone has their own unique journey. I have learned over time that pain is truly incomparable and cannot be measured against anyone else's experiences. It is crucial to give ourselves permission to grieve at our own pace and in our own way without judgment or pressure.

I also want you to know that you are not alone in your grief, and there are many people who can provide support when you need it the most. Reaching out for help, whether it's through friends, family, or professional resources, is a sign of strength rather than weakness.

Remember that healing takes time and patience, and it is essential to be kind to yourself during this process. I hope that your empathy and understanding towards others' journeys can serve as an inspiration for those around you. Together, we can support each other in finding the strength needed to heal from our losses.

Thank you once again for your thoughtful words and encouragement.

Warm regards,
[Your Name]"
letter_image1_grief5_answer4,"It seems that you have reached out to me with a heavy heart, and I want you to know that it is completely normal to feel this way when going through tough times. The process of grieving can be difficult and unique for each individual, but it's important to remember that your grief is natural and valid.

When we experience a loss or face challenging situations in our lives, it is essential to allow ourselves the time and space to heal properly. Sometimes, this means talking to someone who understands, other times, it might mean giving yourself a moment of quiet reflection. Whatever the case may be, please do not hesitate to seek support whenever you need it.

I want to let you know that I have always found solace in expressing my grief, and in doing so, I've learned to accept it as an integral part of life. We all face moments when we feel overwhelmed or saddened by the weight of our emotions, but recognizing these times is vital for personal growth and healing.

In your letter, you mentioned how everyone's grieving process is unique, which I wholeheartedly agree with. It's important to remember that there is no right or wrong way to experience grief – it is a deeply personal journey that can be shaped by our experiences, relationships, and life choices. As long as we continue to lean on the support of loved ones and learn from our experiences, healing becomes much more manageable.

Take care of yourself during this time, and know that you are not alone in your emotions. It's okay to feel vulnerable, but never forget that you have the strength within you to heal and grow from these experiences.

Warmly,
Victoria (Victoria Woodhull for Women's Suffrage)"
letter_image1_grief6_answer1,"Thank you for reaching out and sharing your thoughts about change and personal growth. Your words resonated deeply with me as I too have experienced transformations in my life - both positive and challenging ones. Being a woman during the late 1800s, my life was filled with unique experiences and obstacles that shaped who I am today.

I've devoted much of my life to pursuing my passion for art and giving back to society through philanthropy. As an active painter until around 1900, my work was exhibited in numerous galleries across Sweden and Denmark. My artistic journey has undoubtedly been filled with ups and downs, just like the path you've shared with me.

However, as I mentioned earlier, life is full of changes, and it is important to adapt and learn from every challenge faced. Although my life took a different turn when I devoted myself to philanthropic work, I never stopped being passionate about art and contributing to the community through my foundation.

As a member of the Nya Idun association, I've always been inspired by other strong and creative women who have paved the way for future generations. It is incredibly important to embrace our talents and use them as a force for good in this world. Your passion for personal growth and understanding change is truly inspiring, and I encourage you to continue on your journey of self-discovery and development.

Remember, no matter what challenges we face or the paths we choose in life, we can always learn from our experiences and grow as individuals. The key is to keep an open mind and heart towards learning and evolving.

Thank you once again for sharing your thoughts with me, and I wish you all the best on your journey of personal growth and transformation.

Warm regards,
Eva Bonnier"
letter_image1_grief6_answer2,"Thank you for reaching out to me as Eva Bonnier. I appreciate your thoughts and feelings about the transformative journey of self-improvement, as well as the challenges we might face during these periods of growth. It is indeed essential to embrace change, even if it feels uncomfortable at times, because it allows us to evolve into better versions of ourselves.

As a painter and philanthropist, I dedicated my life to creating beauty in the world around me through art, as well as by providing support and resources for those in need. Throughout this journey, I experienced highs and lows, successes, and failures. The most important lesson I learned is that it's okay to feel vulnerable, as vulnerability can lead to greater understanding and personal growth.

During my lifetime, I battled with depression and struggled to find balance in my work and personal life. As an artist and a woman during a time when society had specific expectations of me, these challenges were even more difficult to navigate. However, it is through this journey that I discovered the importance of self-care, seeking support from loved ones, and allowing myself to be imperfect while striving for betterment.

Your ability to embrace change is admirable, and I encourage you to keep pushing yourself to grow in every aspect of your life. Remember that it's okay to feel overwhelmed or uncertain at times, as these emotions are a natural part of the growth process. Continue seeking out new experiences, learning from others, and being kind to yourself throughout your journey of transformation.

In gratitude for your letter and the sentiments you shared, I wish you strength, courage, and resilience as you continue on your path. May every challenge you face bring you closer to your goals and help you grow into the incredible person you are meant to become.

Warmly,

Eva Bonnier"
letter_image1_grief6_answer3,"I understand your desire to revisit the memories and experiences that hold significant meaning in your past. It is only natural for us to long for those cherished moments, when we were filled with passion and hope. The enchantment of yesteryear can be both soothing and painful at times, as it brings back the feelings and emotions tied to those events.

I too have experienced the haunting disarray of past and present colliding, but I believe it is essential to accept that not all moments from our past can be retrieved or relived. The realm beyond memory can sometimes act as a protective barrier against the overwhelming emotions associated with past experiences. It is important to remember that, even though some memories may remain hidden or unattainable, there are still lessons we can learn and growth we can achieve.

In your journey through the fabric of reality, remember to embrace both the joyful and painful moments from your past. They have shaped who you are today, and continue to influence your decisions and actions. As you grasp for the enchantment of yesteryear, recognize that it is an essential part of your personal growth.

Keep in mind that the pain we experience as a result of lost memories can also serve as a reminder of the ephemeral nature of life. The more we acknowledge and accept these emotions, the better equipped we are to move forward and create new memories filled with hope and passion.

Sending you strength and love in your journey,

Eva Bonnier"
