id,text
letter_image9_shame8_answer3,"Thank you for sharing your thoughts on shame, embarrassment, and humiliation. It's fascinating to consider the ways these emotions may be shaped by both our innate tendencies and the cultural contexts we inhabit.

I believe that shame is a complex emotion that arises from a mixture of genetic predispositions and learned experiences. Some individuals may be more prone to experiencing shame due to their innate temperament or personality traits, while others may develop these feelings as they navigate various social situations and relationships throughout their lives.

Embarrassment is closely related to shame and can also have both innate and constructed aspects. While some people might be naturally more susceptible to feeling embarrassed based on their innate disposition, societal norms and expectations play a significant role in determining how and when we experience embarrassment. In many cultures, for example, modesty is highly valued, which may lead individuals to feel embarrassed about displaying their achievements or qualities that might be seen as arrogance or prideful.

As for humiliation, it seems to me that this emotion is more heavily influenced by external factors and the actions of others. While there may be some individuals who are more sensitive to feelings of humiliation due to genetic factors, it's often the case that humiliation arises from situations where we feel demeaned or belittled by others, such as through public shaming or instances of bullying and abuse.

The intersection between innate tendencies and cultural influences is truly fascinating in the realm of emotions like shame and embarrassment. These feelings are deeply intertwined with our social interactions and relationships and can vary greatly from one individual to another, depending on their unique genetic makeup and personal experiences.

It's important to recognize that while these emotions may be unavoidable aspects of life, we can work towards developing healthier coping mechanisms and more adaptive ways of responding to situations that provoke feelings of shame or embarrassment. By nurturing self-awareness, empathy, and resilience, we can cultivate the ability to navigate these emotions in a way that promotes personal growth and deeper connections with others.

I hope this perspective provides some insight into the complexities surrounding shame, embarrassment, and humiliation. The more we understand about these emotions, the better equipped we are to manage them in our lives and relationships."
letter_image9_shame8_answer4,"Thank you for your insightful thoughts about ancestral guilt and its implications on an individual's life. Your words resonate with my own personal experiences, though I never explicitly acknowledged them before. Artists often express deep emotions through their work, including pain and the inheritance of past traumas and regrets from our ancestors.

Your ideas remind me of the time when I was creating a portrait of a prominent politician in America - Theodore Roosevelt. As the brushes stroked on canvas, it felt as if the weight of history was pressing down upon my shoulders. I felt the ghosts of past generations influencing my present actions, challenging me to question the impact that one's lineage may have on their art or decisions.

Your reference to the potential ripples of familial narratives on emotional landscapes is extremely interesting. This idea can be metaphorically represented in various artistic mediums where the texture and layers reveal the complexity of human emotions. The beauty of art lies within its ability to evoke diverse perspectives from every viewer, making everyone a part of that narrative.

In your words, there might be a genetic component that could explain the continuity of ancestral guilt across generations. This concept can be applied not only to emotional aspects but also to one's creative process or artistic inclination. It is indeed intriguing how our genes might influence what we create and how we perceive the world around us.

However, while it is crucial to acknowledge these influences, it is equally important to remember that each individual has the power to break free from such genetic and societal shackles. Art allows for this freedom of expression - a chance to redefine oneself through a unique lens, transcending limitations and boundaries set by generations past.

Thank you for sharing your thoughts on art, ancestry, and emotional landscapes; they have truly enriched my understanding of the depth and profundity of creativity. I will continue to ponder upon these ideas as I create more art and appreciate the complexities that exist within us all.

Wishing you a life filled with vibrant colors, diverse emotions, and endless artistic expressions!"
letter_image10_guilt3_answer1,"As an artist and poet, I too often find myself contemplating the choices I have made throughout my life. From my early days of pursuing art professionally to the tumultuous journey that followed with my health and personal relationships, I've had many moments where I questioned if I could have chosen a different path.

Perhaps, like you, I too think about those forks in the road that led me here. With the wisdom of hindsight, I can see how certain choices opened up new possibilities or perhaps closed some doors. But it's important to remember that every decision is part of our unique journey, and no matter how different our paths may seem, there's always something valuable we can learn from them.

Our choices may have led us down unexpected roads, but they also provide us with the opportunities for growth and self-discovery. Reflecting on these moments allows us to recognize patterns, both in our successes and failures. It helps us understand what matters to us, what brings us joy, and ultimately, what leads us towards a fulfilling life.

So while we may wonder about the paths not taken or how differently our lives might have unfolded, it's crucial to remember that every decision is an essential part of our journey. It shapes who we are today and gives us the knowledge and strength to make better choices in the future. Embrace those moments of introspection as they help guide you towards a more meaningful life.

I hope my words resonate with you, dear [Your Name], and provide some comfort in your own journey of self-discovery. For each of us is on our unique path, and every choice we make contributes to the richness of our lives.

With warm regards,
[Your Name]"
letter_image10_guilt3_answer2,"I cannot express enough gratitude for your thoughtful letter. It is indeed rare to find someone who can see the beauty in imperfections and the uncertainties that life throws at us, and you have truly inspired me with your ability to accept these aspects of our journey without regret. It seems we share a similar perspective on embracing each decision made, knowing they all contribute to forming the unique individual we become.

Your words resonate deeply within my own experiences, as I too have tried to make well-informed decisions throughout my life based on the circumstances and knowledge available to me at each stage. It is often challenging to navigate through life's challenges and uncertainties, but it is essential to remember that it is in these moments of growth that our true character shines through.

I admire your courage and determination to face life's adversities without regret or bitterness. In this world where many struggle to accept the natural ebb and flow of life, it is a rare gem to find someone who can appreciate the beauty within our imperfections. Your journey, much like my own, has been one filled with ups and downs, joys, and sorrows, but it has ultimately shaped you into the remarkable individual you are today.

As we continue on our respective journeys, I encourage you to keep an open heart and mind, ready to embrace every challenge that comes your way. Embrace each decision, both big or small, for they all contribute to crafting the person you strive to become.

Thank you for sharing your perspective and thoughts with me; it has been a truly enlightening experience. May we both continue to grow, learn, and evolve as we journey through life, always remembering that it is in our imperfections where true beauty lies.

Sincerely,
[Your Name]"
letter_image10_guilt3_answer3,"I understand your desire to reevaluate the decisions you've made and to seize new opportunities. Life is a journey filled with moments of joy, pain, and learning experiences. As an artist, I have also experienced various emotions and challenges throughout my life. My advice to you would be to embrace each moment as it comes, for it holds the potential for growth and transformation.

Every decision we make shapes our future and influences our paths. It is important to learn from these decisions, both positive and negative, and use that knowledge to inform our choices moving forward. By doing so, we can become better equipped to handle life's challenges and make more informed decisions in the future.

In your desire for a do-over, remember that every moment is an opportunity to learn and grow. While it may be tempting to focus on past mistakes and regret, it is crucial to acknowledge our growth as individuals and understand that we are constantly evolving beings. We cannot change the past, but we can shape our future by embracing each new experience with an open heart and mind.

As you journey through life, remember that the path ahead is filled with endless possibilities for learning, personal development, and joy. By seizing these opportunities and embracing your journey, you will be able to create a brighter future for yourself. So, my dear friend, as you continue on this amazing adventure called life, always remember to look forward, strive for growth, and never lose hope in the power of your own decisions and potential for positive change.

Wishing you all the best on your journey!"
letter_image10_guilt3_answer4,"Thank you for your kind words and encouragement. It is essential for us, as individuals and artists alike, to strive for growth and personal development. Although we may make mistakes along the way, it is crucial to remember that we learn from these experiences and grow as a result.

As an artist myself, I understand the importance of focusing on one's future rather than dwelling on past decisions. It can be easy to become disheartened or bogged down by our errors, but it is vital to keep moving forward. By doing so, we ensure that our art and personal growth continue to flourish and evolve.

I believe that embracing this mindset not only enables us to create more meaningful and impactful work but also allows us to lead a more fulfilling life. By recognizing the potential for improvement in every situation, we can better understand our strengths and weaknesses and ultimately work towards achieving our goals.

So, let us both continue on this journey of personal growth and artistic expression, always remembering that the future lies ahead of us - full of possibilities and opportunities for self-improvement. Our past experiences serve as valuable lessons and stepping stones to help us reach our full potential.

Keep pushing forward and never cease to pursue your dreams and aspirations. I wish you all the best in your artistic endeavors and personal growth journey, and I hope to hear more about your progress soon.

Yours sincerely,
Ernst Josephson

P.S.: Don't forget that we learn from our experiences, both good and bad, so it is essential to take these lessons with us as we move forward on our path of growth and self-improvement."
letter_image10_guilt4_answer1,"Thank you for reaching out and sharing your thoughts with me. It is always important to reflect on our lives and the choices we make, as it helps us grow both personally and professionally. As an artist, I believe that growth and self-improvement are essential in order to create meaningful work that resonates with others.

I myself have experienced moments of doubt and regret in my life and career, but I have always tried to learn from them. It is through these experiences that we gain insight into ourselves, allowing us to evolve as individuals. The process of growth can be challenging and painful at times, but it ultimately leads to a more authentic and fulfilling life.

As someone who faced many challenges in my own life and career, I believe that it is essential to maintain a sense of humility and openness to learning from others. This mindset has allowed me to continue developing and refining my artistic abilities, leading to the creation of some of my most memorable works.

In order to grow both as an individual and as an artist, it is crucial to focus on self-reflection and self-improvement. Embrace your imperfections and be willing to learn from them, as they can serve as valuable lessons in life's journey. By doing so, you will not only become a better version of yourself but also inspire others to embark on their own paths of growth and self-discovery.

Once again, thank you for sharing your thoughts with me, and I hope that my words have provided some insight or encouragement. Remember to always strive for growth and self-improvement, both in your personal life and in your artistic endeavors. The journey may be challenging at times, but it is through these challenges that we ultimately achieve our full potential.

Sincerely,
[Your Name]"
letter_image10_guilt4_answer2,"Thank you for reaching out to me. It is indeed true that every experience helps shape our growth. The challenges we face in life can be difficult, but they also provide us with opportunities to learn and evolve as individuals. Through my art, I have tried to convey the beauty of life's unexpected moments, drawing inspiration from my own personal experiences.

As an artist, I understand that it is essential to embrace our past actions and learn from them. The lessons we glean from our mistakes can guide us towards personal growth and a deeper understanding of ourselves. Our past experiences can serve as powerful tools for self-reflection and improvement, leading us to become more empathetic and compassionate individuals.

It's important to remember that things happen for a reason, and accepting the lessons we have learned from our past actions allows us to embrace growth and move forward with an enlightened perspective on life. We should continually strive to expand our horizons and push the boundaries of who we are, using each experience as a stepping stone towards becoming our best selves.

In closing, I encourage you to reflect on your past experiences and use them as fuel for your journey in personal growth. Recognize that life's challenges can be transformative and that by learning from our past actions, we can find meaning and purpose in our lives. Embrace the lessons you have gleaned from your experiences and allow them to guide you on a path towards self-discovery and enlightenment.

With warm regards,
Ernst Josephson"
letter_image10_guilt4_answer3,"I, Ernst Josephson, have pondered your words with great thought and appreciation for your forthrightness. Your acknowledgment of past experiences and their impact on your decisions is commendable. It is a rare individual who can truly take ownership of their actions, both good and bad, and learn from them.

Your dedication to self-reflection is a testament to your personal growth and resilience in the face of adversity. Embracing change and understanding that our resources may be limited but always evolving are essential aspects of living a fulfilling life.

In recognizing past mistakes, it's important not to dwell on them but use them as stepping stones towards greater self-awareness and development. Owning every decision you have made is a powerful statement about the person you are today.

I commend your courage in acknowledging the choices you made with whatever resources were available at the time, knowing that sometimes our best efforts may not yield optimal outcomes. It shows humility and humanity to recognize that our decisions are often dictated by circumstances and limitations.

Moving forward, I encourage you to continue fostering this mindset of self-reflection and growth, as it will serve you well in all aspects of life. May your journey be filled with enlightenment and success, shaped by the lessons learned from your past decisions and experiences.

Sincerely,
Ernst Josephson"
letter_image10_guilt4_answer4,"I understand your perspective on focusing on the present and learning from past experiences without dwelling on regrets. Indeed, life is full of ups and downs, and it is essential to acknowledge our mistakes but not let them define us. As an artist, one must always strive to grow and evolve, drawing from both personal experiences and external influences.

Embracing the present moment allows us to see things with a fresh perspective and approach each day with enthusiasm and openness. This attitude can help us make better decisions in our lives, as well as inspire new ideas for creative expression.

While learning from our past experiences is crucial, it is important not to dwell on them too much. We cannot change the past, but we can use our experiences as a foundation for future success and personal growth. By doing so, we allow ourselves to grow and evolve as individuals, both in our artistic pursuits and life in general.

As you look forward to the future, remember that it is filled with opportunities for learning, growth, and inspiration. By maintaining a positive outlook and focusing on the present, you can make the most of your days and continue to develop your unique artistic voice.

In short, I commend your focus on the present and ability to learn from past experiences while looking forward to the future. May this approach continue to serve you well in all aspects of your life, including your creative endeavors.

Sincerely,
Ernst Josephson"
letter_image10_guilt5_answer1,"Thank you for reaching out to me with your concern about physical health. As an artist, I too understand the importance of maintaining a healthy lifestyle in order to create the best possible work. It is essential to take care of our bodies so that we can express ourselves through our art and continue to share our unique perspectives with the world.

While it might seem challenging at times, it is important to prioritize physical well-being by eating a balanced diet, engaging in regular exercise, and taking care of our mental health. The key is finding activities and routines that work best for you as an individual. For me, this has meant incorporating healthy habits into my daily life, such as maintaining a nutritious diet and engaging in nightly ceremonies to appease my mortal coil's relentless hunger.

As artists, we often push our physical boundaries to create incredible works of art. It is important to be mindful of this and ensure that we maintain our overall health while doing so. By staying active through nutrient-dense diets and rigorous training routines, you can build strength and resilience, which will ultimately help you produce even more remarkable creations.

In conclusion, I hope my perspective on prioritizing physical well-being has been helpful to you. Remember that finding a balance between artistic pursuits and self-care is crucial for maintaining optimum health and fitness. Keep pushing your boundaries and exploring new ways to incorporate healthy habits into your daily life. Your body, mind, and art will thank you for it.

Sincerely,
[Your Name]"
letter_image10_guilt5_answer2,"I understand your struggle with self-awareness and the importance of self-care. It is a challenge many people face, especially when they are caught up in their creative pursuits or dealing with personal problems. In my own life, I have learned that ignoring our physical selves can lead to greater issues down the line.

As an artist, it can be easy to focus solely on our work and neglect our own well-being. However, this approach can hinder our creativity and productivity in the long run. The key is finding balance – prioritizing both your mental and physical health while staying true to your passion for art. It is crucial to listen to your body and take care of it as you would a valued friend or family member.

In my own life, I have learned that self-awareness is the foundation upon which we build our understanding of ourselves, our strengths, and our weaknesses. By embracing this practice, you can develop greater control over your emotions and reactions, leading to improved decision-making and more meaningful connections with others.

As you work towards better self-care and physical wellness, remember that it is a journey filled with ups and downs. There will be setbacks along the way, but as long as you keep pushing forward and continue learning from your experiences, you will progress in both your personal life and creative pursuits.

I encourage you to stay dedicated to this path of self-discovery and growth, and remember that you are not alone in this journey. We can all learn from one another's experiences, and by sharing our stories, we may inspire others to embark on their own paths towards better health and well-being.

Best wishes for your continued growth, creativity, and success!"
letter_image10_guilt5_answer3,"Thank you for reaching out to me, and I appreciate your kind words about my works. While I may have experienced hardships in my life and personal relationships due to the progression of my illness, it is heartening to know that my artistic creations continue to resonate with people today.

As an artist, it is essential to maintain a balance between one's passion for creation and the need for self-care. I believe that this balance can be achieved by acknowledging life's pleasures and indulgences while still practicing moderation. By doing so, we can lead a fulfilling and well-rounded lifestyle, which will ultimately benefit our artistic endeavors.

During my most creative period, when I was grappling with the challenges of illness, I found solace in exploring different aspects of life through my art. This allowed me to maintain a healthy balance between indulgence and moderation, as well as a balanced approach to life overall. The resulting works not only served as a reflection of my experiences but also became influential pieces that have inspired future generations of artists.

In conclusion, I believe that sustaining a healthy balance in our lives while satisfying our desires responsibly is crucial for personal growth and fulfillment. Embracing both pleasure and moderation helps us navigate life's challenges with resilience, creativity, and passion, ultimately allowing us to make meaningful contributions to the world around us.

Yours sincerely,
Ernst Josephson"
letter_image10_guilt5_answer4,"I must say that your confession about indulging in comfort foods and the struggle over portion sizes is something I can sympathize with. As an artist, it's not always easy to maintain strict boundaries around food intake, especially when one's work is often centered on the pursuit of aesthetic beauty and pleasure.

However, it's essential to find that balance and remember that our well-being is just as important as our creative pursuits. Just like in art, where the composition must be harmonious for it to succeed, so too does our physical and mental health need to maintain equilibrium.

I understand that sometimes it may seem impossible to resist the temptation of our favorite meals, but finding ways to enjoy them mindfully and in moderation is key. We can even take inspiration from art – finding ways to appreciate these moments without letting them consume us entirely.

In your letter, you mention feeling guilty when you eat a bit more than necessary and having no self-control around your favorite dishes. I encourage you to be kinder to yourself in these situations. Instead of indulging in guilt, try to embrace the experience fully and then find ways to make amends afterward – whether that means going for a walk after a heavy meal or practicing mindful eating techniques.

Above all else, remember that no one is perfect, especially when it comes to food and self-control. Sometimes giving ourselves permission to enjoy our favorite treats without judgment is the most significant act of self-care we can offer.

Best regards,
Ernst Josephson"
