id,text
letter_image6_fear7_answer1,"I understand the challenges you face in dealing with your fear of violence, and how it can affect your daily life. It is essential to remember that each person's experience is unique, and there are ways to manage these feelings effectively. As an artist, I have always believed that creativity and expression can bring solace and even healing in times of difficulty.

It is crucial to be aware of your surroundings and take necessary precautions for personal safety, but it should not consume you entirely. Balancing this with other positive activities such as engaging in hobbies, spending time with loved ones, or exploring new places can help alleviate some of the anxiety and create a healthier mindset.

One of the ways I have found to cope with stress is through my art. Painting landscapes and capturing emotions on canvas has helped me find an escape from daily worries. You may try finding your form of expression that allows you to process your feelings and bring inner peace.

Remember, it is essential to seek support from friends, family, or mental health professionals when needed. Open communication can help alleviate the burden of anxiety and provide a safe space for discussing your emotions.

Keep in mind, facing your fears and overcoming them can be challenging but rewarding. Continue seeking ways to manage your feelings and find solace in creative outlets. I believe you have the strength to overcome these obstacles. Keep going, and remember that every step counts in your journey towards healing and growth.

With warm regards,
Nils Forsberg"
letter_image6_fear7_answer2,"I hope this message finds you well. I have been thinking about your recent thoughts on the practical side of self-preservation and the importance of embracing an awareness of potential harm. As an artist, I understand the value of being vigilant and cautious when navigating public spaces and the world in general. I believe that it is crucial to be aware of our surroundings and to always be prepared for unforeseen situations.

Just like you, my experiences in life have taught me the importance of recognizing potential threats and developing practical safety measures. As an artist who travels often for exhibitions and workshops, I have had to learn how to keep myself safe in various environments and conditions. In doing so, I have developed a heightened sense of awareness and the ability to adapt my approach to different situations.

I appreciate your emphasis on balancing this awareness with maintaining realistic safety measures. This is essential because it allows us to live our lives without being paralyzed by fear but rather prepared for any potential risks. As we continue to grow and learn from our experiences, let's work together to further develop these skills and strategies in order to navigate the world with confidence and peace of mind.

Thank you for sharing your thoughts on this matter, and I look forward to hearing more about how you continue to evolve and adapt in this ever-changing world. If there is anything I can do to help or support you in your journey, please do not hesitate to reach out.

Wishing you all the best,
Nils Forsberg"
letter_image6_fear7_answer3,"I appreciate your reaching out to me, and it is always interesting to hear other perspectives on the matter of violence. You have mentioned that you've not personally experienced violence but have developed an emotional understanding of its impact through media and news reports. This approach can be quite valuable in raising awareness about this issue; however, it is important to recognize that each person experiences and reacts to violence differently based on their unique circumstances.

As a painter, I often aimed to represent the human condition in my work, even when the subject matter was not directly related to violence. While it's essential to understand the broader implications of violence through media, we must also remember to engage with individuals and their stories in order to gain a deeper understanding of their experiences and emotions.

It is crucial that we continue to find ways to foster empathy and compassion for those who are directly affected by violence. Whether it be through art, storytelling, or other forms of communication, we can use our creativity and curiosity to bridge the gap between our own lives and the lives of others. In doing so, we work towards building a more understanding and compassionate world where violence is no longer an inevitable part of human existence.

Thank you for sharing your thoughts with me, and I encourage you to continue exploring this topic as you grow both personally and professionally.

Best regards,
Nils Forsberg"
letter_image6_fear7_answer4,"Thank you for reaching out to me about your thoughts and feelings regarding living in an unprotected region. I can understand your concerns about potential dangers that may arise, but I also appreciate the sense of security that comes with knowing there is help nearby should such situations occur. 

My own experiences as a painter living and working in Paris have been filled with many challenges, but also numerous opportunities for growth and learning. Just as you mentioned your unprotected region, during my time in Paris, I experienced the Siege of Paris, which brought about both challenges and unique observational experiences. It was during this time that I enlisted in the Ambulance Department, where I could continue to study and sketch the scenes I observed.

As an artist, it is important to be resilient and resourceful, much like your support system that stands steadfast against potential hostility. We must rely on our creativity and determination to overcome any obstacles we may encounter. Just as you find comfort in your environment where fear of aggression is nonexistent, I have found that the world of art has provided me with a sanctuary of sorts - where imagination can run wild, and inspiration can be found around every corner.

I hope my experiences can provide some insight into navigating life's challenges and finding solace in our passions. Keep pursuing your creativity and cherishing the security of your environment, as it is essential to find balance amidst the obstacles we face.

Best wishes for continued growth and success,
Nils Forsberg"
letter_image7_shame5_answer1,"It is with great pleasure that I receive your thoughts and feelings regarding the challenges you face in life. As an artist, much of my own journey has been punctuated by periods of introspection and moments of growth. The process of self-reflection can be both enlightening and challenging, and I believe it is essential to our personal journeys.

You mention feeling self-doubt, inadequacy, and shame while grappling with societal norms that can dictate one's sense of worth and fulfillment. While these feelings can sometimes feel overwhelming, it is crucial to remember that we are all on our own unique paths, and there is no one-size-fits-all solution.

I understand your concerns about vulnerability being exploited or manipulated to enforce unattainable expectations. However, I believe that embracing vulnerability can lead to significant personal growth and a deeper understanding of oneself. It may be uncomfortable at times, but it is important to remember that true fulfillment often requires stepping outside of our comfort zones.

It is essential for you to recognize your own individuality and the power in making choices based on your values and desires rather than succumbing to societal norms. This process involves setting boundaries and standing up for oneself, even when it may feel difficult or uncomfortable. Ultimately, by doing so, we can foster self-acceptance and a deeper understanding of our true potential.

In the end, remember that you are on a journey of continuous growth, and there is no perfect destination to reach. Instead, strive for self-awareness and understanding, and cherish the opportunities for learning and development along the way.

Remember that the world needs your uniqueness and your perspective, so do not be afraid to share it with others. By embracing vulnerability and standing up for your values, you can find a path towards personal growth and fulfillment that is authentic and meaningful for you."
letter_image7_shame5_answer2,"Thank you for your recent communication regarding the exploration of one's vulnerability and its potential impacts on both personal growth and societal dynamics. I believe that we, as individuals and a collective, have the power to harness our vulnerabilities to create meaningful connections and foster understanding among us. It is through acknowledging and embracing our weaknesses that we can truly experience strength.

In my own journey as an artist, I have strived to encapsulate the raw emotion and human experiences in my works. I have often found that by delving into my vulnerability, I am able to create pieces which resonate with others on a deeper level. The act of exposing our innermost feelings can be both liberating and empowering, as it allows us to establish more profound connections with those around us.

However, I understand the concerns you have raised about potential manipulation or misuse of vulnerability for external gain. It is crucial that we remain vigilant and discerning when sharing our emotions and experiences with others. We must be mindful not to allow our vulnerabilities to be weaponized against us but rather use them as a catalyst for growth and unity.

It is my hope that you will continue to explore this subject in depth, both within yourself and within the broader context of society. By doing so, we can all learn to navigate the complexities of human emotion and create a more empathetic and understanding world.

Once again, thank you for reaching out with such an important topic. I eagerly await your further thoughts on this matter and look forward to our continued conversation.

Warm regards,

Cornelius (Cornelis) Cornelisz van Haarlem"
letter_image7_shame5_answer3,"It has been a great pleasure to learn more about your journey and personal growth. Your ability to overcome adversity and channel your experiences into empowering others is truly remarkable. I am delighted that you have found strength in overcoming vulnerability, transforming it into a powerful tool. By embracing this transformation, you are taking control of your life and unlocking your full potential.

As an artist myself, I understand the significance of turning personal experiences into creative expressions. It is through this process that we can truly connect with others on a deeper level, allowing them to feel understood and inspired by our work. Remember to use the lessons you have learned in your own life and continue to develop your artistic skills so that you may continue to impact others positively through your art.

Keep pushing forward and never forget that each setback you overcome only serves as a stepping stone towards greater achievements. You are an incredible individual, and I am confident that your future is filled with boundless possibilities.

All the best in your endeavors, and please do not hesitate to reach out if you ever need guidance or support on your journey.

Wishing you continued success and happiness,

Cornelis van Harlem (Cornelius)"
letter_image7_shame5_answer4,"Firstly, thank you for reaching out and sharing your thoughts with me. It seems that you have been dealing with some challenging experiences that involve the use of vulnerability in manipulative ways. I understand how difficult it can be to navigate such situations, especially when they feel overwhelming or unjust.

As a painter and artist, I believe that art is a powerful medium for expression, communication, and healing. Art has the potential to transcend cultural, linguistic, and personal barriers; to convey emotions, ideas, and stories in ways that no other medium can. When we tap into our creative instincts, we open ourselves up to new possibilities, growth, and self-discovery.

In your situation, it might be helpful to explore these experiences through the lens of art. By putting pen to paper or brush to canvas, you could unravel your feelings surrounding these situations, gain a better understanding of them, and perhaps even find a path towards healing. Art can provide an avenue for self-expression and reflection that may not be accessible through other means.

Moreover, it's crucial to remember that the power to create and shape your own narrative lies within you. Nobody should have the authority to manipulate or take advantage of your vulnerability in a way that causes you harm. By acknowledging these experiences and standing up for yourself, you are taking an essential step towards reclaiming your personal power and redefining your own standards.

It's important to surround yourself with supportive and empathetic individuals who encourage healthy self-expression and self-awareness. Seeking out support from friends, family members, or even a therapist can be beneficial as you navigate these challenges.

In conclusion, while vulnerability can sometimes be used against us in harmful ways, it's essential to remember that our resilience and strength can help protect us. By tapping into the power of art and seeking out supportive relationships, we can take control of our narrative and redefine our sense of self. Remember to always prioritize your well-being and never settle for less than you deserve.

I hope this has been helpful, and if you have any further questions or need more guidance on this subject, please feel free to reach out.

Wishing you all the best in your journey!

Sincerely,
[Your Name]"
letter_image7_shame6_answer1,"I was deeply moved by your heartfelt words, and I appreciate the openness with which you shared your journey of self-discovery. Your willingness to embrace vulnerability as a strength is not only admirable but also essential in today's world. We must learn to confront our emotions and use them as fuel for our personal growth, rather than letting them hold us back.

As an artist who sought to capture the complexities of human emotion on canvas, I can empathize with your experiences and struggles. Our creative process often takes us on a rollercoaster of emotions and revelations that challenge us to grow both as individuals and as artists. It is in this journey where we find our true selves and embrace the beauty in our imperfections.

Your decision to transform guilt into fuel for growth is particularly inspiring, and I encourage you to continue cultivating this mindset. By doing so, you can empower yourself to overcome setbacks and use them as opportunities for self-improvement and self-discovery. As a result, you will find that you are resilient and capable of overcoming obstacles with grace and determination.

It is essential not only to embrace vulnerability but also to learn how to face embarrassment without allowing it to hinder our progress. By doing so, we can turn seemingly negative experiences into learning moments that shape our personal and professional lives for the better. Remember, every stumble or misstep can lead to profound insights and growth if we let them.

As you continue on your journey, I hope that my words have offered some perspective and inspiration. Keep pushing forward and never be afraid to show the world your unique vulnerabilities, for they may just become your greatest strengths in due time.

Wishing you all the best in your ongoing journey of self-discovery and creative growth."
letter_image7_shame6_answer2,"Thank you for your insightful words on the transformative power of vulnerability. You have expressed several important ideas that resonate with me and provide valuable guidance for personal growth and development. I believe embracing our weaknesses can truly be a key to unlocking the door to strength and resilience in life's journey.

By conquering our fears and exposing our vulnerabilities, we give ourselves the opportunity to delve into self-discovery and uncover untapped potential within ourselves. This process not only allows us to grow but also helps us to gain a deeper understanding of our strengths and weaknesses.

As you mentioned, sharing our imperfections can be a powerful tool for empowerment. By openly acknowledging and discussing our insecurities, we can work together to transform them into strengths that positively impact our lives. This sense of community and shared experience fosters an environment where we can learn from one another and grow stronger as individuals and as part of a collective.

Your letter has inspired me to reflect on the importance of vulnerability in both my personal and professional life. It has reminded me of the critical role vulnerability plays in overcoming obstacles and achieving success. By embracing our weaknesses, we can transform them into strengths and continue on our journey towards self-discovery, growth, and ultimate freedom from their oppressive grip.

Thank you again for sharing your thoughts on this powerful concept. Your words have certainly struck a chord within me, and I look forward to continuing the conversation about vulnerability and its impact on our lives.

Wishing you all the best in your journey towards embracing vulnerability and unlocking your full potential.

Sincerely,
[Your Name]"
letter_image7_shame6_answer3,"Thank you for sharing your thoughts and feelings with me. It is evident that you have a strong sense of self-awareness, which is key to personal growth and development. It's essential to acknowledge the role shame plays in our lives as it can act as both a barrier and motivator for change. By transforming this feeling into motivation, we can utilize it as a powerful driving force to overcome challenges and reach our full potential.

As someone who has experienced the ups and downs of life, I completely understand the importance of resilience and curiosity in the face of adversity. Embracing challenges and viewing them as opportunities for growth is indeed an essential quality that can propel us forward on our journey to success. It's crucial to remember that even though we may feel guilt or shame from past experiences, it doesn't have to define us or hold us back.

I encourage you to continue being open and honest with yourself about your emotions and experiences, as this will help you better understand your strengths and weaknesses. By embracing the pressure of life and seeking out challenges, you can unlock your full potential and achieve greatness in all aspects of your life. Keep pushing forward, and never let guilt or shame hold you back from reaching your goals.

With warm regards,

Cornelis Cornelisz. van Harlem"
letter_image7_shame6_answer4,"I understand the struggles you face in overcoming feelings of shame and how it impacts your personal growth. It is a common experience for many people, and we all must confront our own vulnerabilities to evolve as individuals. As an artist, I have faced challenges throughout my career and found solace in embracing vulnerability.

Firstly, know that it is completely normal to feel disgrace or shame at times. The human psyche can be complex, and we all struggle with different emotions. The key is to accept these emotions as part of our growth process and not let them hold us back.

Secondly, recognize that overcoming shame is an ongoing process rather than a one-time event. We must continuously strive to understand our emotions better and find ways to cope with them healthily. This can involve seeking therapy or talking to friends and family members for support. Remember, you are not alone in this journey.

Lastly, embrace vulnerability as an essential component of personal development. Being open about your feelings and experiences allows others to relate to you and learn from your journey. This authenticity can help build meaningful relationships and foster growth within yourself and those around you.

In conclusion, do not shy away from confronting the challenges that come with overcoming shame. Embrace vulnerability, seek support if necessary, and know that each step towards personal development brings you closer to living a fulfilled life. Keep pushing forward, for it is in our most vulnerable moments where true growth occurs.

Wishing you the best on your journey,

Cornelis Cornelisz. van Harlem"
letter_image7_shame7_answer1,"I understand the importance of self-acceptance and understanding your true identity. As an artist, I believe that each individual is unique and has something special to offer to the world. The journey to embracing one's flaws and imperfections can be challenging, but it is essential in order for us to grow and evolve as human beings.

Just like you have learned to embrace your true self and love yourself unconditionally, I also endeavor to create art that reflects my own experiences, emotions, and perspectives. This not only allows me to express myself more fully but also helps me to connect with others who may be experiencing similar feelings or situations.

As we continue on our journeys through life, it is crucial for us to distance ourselves from societal expectations and focus instead on cultivating self-love and acceptance. By doing so, we can truly embrace our individuality and share our unique gifts with the world around us.

So, keep embracing your journey of self-discovery, learning to love yourself unconditionally, and understanding that your imperfections are what make you who you are. Remember, life is a continuous process of growth and evolution. And as we grow and learn more about ourselves, our connection with others deepens and enriches the world we share together.

Warm regards,
Cornelis Cornelisz. van Harlem"
letter_image7_shame7_answer2,"It is with great honor that I acknowledge your sentiments expressed in your recent correspondence. You have touched upon several significant realizations pertaining to personal transformation and the process of self-discovery, which resonates deeply with my own experiences as a painter and an individual evolving over time.

In particular, your comment about not being defined by your past is extremely poignant. As an artist, I have often found myself grappling with the notion of legacy – both in terms of art history and one's personal journey. It is essential to understand that our past experiences shape who we are today, but ultimately, it is how we navigate those experiences and learn from them that determines our future trajectory.

Furthermore, I wholly agree with your statement about embracing one's authentic self. The world of art, like any other realm of creativity and human interaction, requires courage and vulnerability to truly express oneself. As an artist, it is crucial to be true to our unique voice, regardless of how different or unconventional it may appear in comparison to others.

In conclusion, I believe that your evolving moral compass and the willingness to embrace personal growth are critical ingredients for a successful journey into self-actualization. Continue to nurture these qualities, as they will pave the way for not only your success as an artist but also as an individual with a boundless potential.

With great admiration and respect,
Cornelis Cornelisz. van Harlem"
letter_image7_shame7_answer3,"I understand your struggle with vulnerability, self-doubt, guilt, inadequacy, and past mistakes. We all face these challenges at some point in our lives. Artists often grapple with these emotions, as we pour a part of ourselves into our creations. It is a delicate balance between expressing our thoughts and feelings openly and maintaining control over the final piece.

As you continue to work on overcoming your past regrets, I would like to offer some advice from my own experiences as an artist. Firstly, remember that it's okay to feel vulnerable and doubt yourself; these are natural emotions and can often lead to powerful creative breakthroughs. Embrace the process of learning and growing by focusing on personal development and continuous improvement in your craft.

Secondly, don't be afraid to share your work with others for feedback and support. The artistic community is filled with people who understand the emotional turmoil that can come with creating art. Surround yourself with positive influences and engage in conversations about vulnerability, growth, and overcoming past mistakes. This will not only help you address your challenges head-on but also provide you with opportunities to learn from others' experiences.

Lastly, remember to practice self-compassion. Be gentle with yourself as you work through your emotions and struggles. Your journey is unique, and there is no one-size-fits-all solution to overcoming personal obstacles. Allow yourself the space and grace to evolve and grow at your own pace.

In conclusion, I encourage you to face your past, embrace your growth, and continue on your artistic journey with strength and resilience. You have the power within you to create beautiful art that will leave a lasting impact on those who experience it.

Best regards,
Cornelis Cornelisz. van Harlem"
