id,text
grief6_answer4,"I cherish the memories of those who have left us, yet understand that life constantly evolves and grows beyond our grasp."
grief6_answer4,"I deeply miss and long for them, yet understand that life continues to evolve."
grief6_answer4,I embrace change and honor the past while cherishing new beginnings.
grief6_answer4,"I long for those cherished moments, yet embrace the beauty of life's ever-evolving journey."
grief6_answer4,"I understand and honor your feelings while acknowledging that change is a natural part of life.

Original Statement: I grieve and yearn for them but I also accept that time has moved on.

Supportive Re-wording: I acknowledge your emotions and connection to those you miss, while also recognizing that we must embrace the present and continue growing."
grief7_question,"When you think about someone you've lost, how do you ensure they are still present in your life through a unique ritual or practice?"
grief7_question,"When you think of someone you have lost, what specific memory or tradition brings them back to life, filling your heart with warmth?"
grief7_question,"When you think of someone you miss, what is one special memory or tradition that reminds you of their love and presence in your life?"
grief7_question,"When you think about those who are no longer with us, what specific memories or traditions do you cherish and how do they keep their spirits alive in your daily life?"
grief7_question,"When you miss someone dear, what are the cherished moments and customs that help keep them alive in your heart?"
grief7_answer1,I like to connect with others and reminisce about the special moments we shared with our loved ones who are no longer with us.
grief7_answer1,"I recall their fleeting smiles and fading whispers, inviting them into my thoughts for comfort through the haunting echoes of loneliness."
grief7_answer1,"I recollect the grotesque, haunting echoes of their whispers, entwining my own with their spectral presence."
grief7_answer1,I preserve and honor the cherished connections with those who have passed away by frequently reminiscing and exchanging tales about our shared experiences with others who were fortunate enough to know them as well.
grief7_answer1,I cherish and honor the memories of my loved ones by frequently reminiscing and connecting with others who once shared their lives.
grief7_answer2,I honor and keep their memories alive by cherishing their visual and auditory imprints in my life.
grief7_answer2,I cherish and honor the memories of my loved ones by gazing upon their photographs and replaying their voicemails in an attempt to keep them close in spirit.
grief7_answer2,I cherish their memory and keep them alive through the power of storytelling and creative expression.
grief7_answer2,I honor and keep my beloved memories alive by immersing myself in the essence of their presence through cherished photographs and heartfelt voice messages.
grief7_answer2,"I conjure spectral apparitions and engage in morbid conversations with my departed loved ones, invoking a chilling presence that echoes through the halls of my mind."
grief7_answer3,"I honor my loved ones by annually commemorating their lives, fostering cherished memories and maintaining our unbreakable bonds."
grief7_answer3,I honor and cherish the memory of my loved ones by commemorating their lives annually through heartfelt family gatherings.
grief7_answer3,"I honor and cherish the memories of my loved ones by annually convening a heartfelt family gathering, ensuring their legacy remains alive within our hearts."
grief7_answer3,I gather my loved ones annually to honor and cherish the memories of those we've lost together.
grief7_answer3,I honor my cherished memories by annually uniting my family for a heartfelt tribute to those we hold dear.
grief7_answer4,I cherish the memories and connections with my loved ones as I reflect on their lives.
grief7_answer4,I cherish and honor the memories of my loved ones by frequently reflecting on their impact in my life.
grief7_answer4,I like to cherish the memories of my loved ones by occasionally reflecting on their lives and the impact they had on mine.
grief7_answer4,I often find myself taking moments to honor and cherish the memories of my loved ones who are no longer with me.
grief7_answer4,"I cherish the memories and connections I've had with those who have touched my life, allowing me to keep their presence and spirit alive within me."
grief8_question,"When you experience grief, do you find comfort in engaging in activities such as knitting, or do certain coping mechanisms like drugs, alcohol, and sex prove more beneficial or detrimental to your emotional well-being?"
grief8_question,"When you consider unconventional coping mechanisms for emotional distress, how might alternative therapies such as cannabis, tantra, or even extreme sports challenge traditional views on healing and exacerbate suffering?"
grief8_question,"When you consider coping mechanisms for dealing with grief, how do substances and physical activities compare in terms of effectiveness and long-term impact?"
grief8_question,"When you consider alternative coping mechanisms for dealing with sadness and grief, would it be more effective to explore artistic pursuits like knitting or delve into the potentially destructive nature of drug and alcohol use as well as sexual activities?"
grief8_question,"When you're grieving, do alternative coping mechanisms like creativity, meditation, and human connections better alleviate emotional turmoil than substances and fleeting pleasures?"
grief8_answer1,"I've been using unhealthy coping mechanisms like drugs, alcohol, and engaging in risky sexual behavior to numb my pain and avoid facing the emotions attached to my loss."
grief8_answer1,I have turned to substances and indulgence as a coping mechanism for my emotional pain.
grief8_answer1,"I have coped with loss by seeking temporary escapes through substance use and indulgence, momentarily numbing my pain but ultimately hindering my healing journey."
grief8_answer1,"I have used drugs, alcohol, and indulgence in intimacy as coping mechanisms to navigate through the pain of loss."
grief8_answer1,I embraced hedonism as a temporary coping mechanism to heal my broken heart.
grief8_answer2,"I understand that drugs, alcohol, and sexual activities may seem like temporary solutions to cope with grief; however, they can exacerbate emotions and hinder the healing process. It's essential to find healthier ways to express and manage feelings during difficult times."
grief8_answer2,"I've learned that turning to drugs, alcohol, or risky behaviors can intensify the emotional turmoil when facing loss.
---
Drugs, alcohol, and sex can seem like temporary escapes from grief, but they often lead to more pain in the long run. Finding healthier ways to cope is essential for healing."
grief8_answer2,"Inebriety, intimacy, and indulgence aggravated my grieving experience.

The initial prompt required a rephrasing of a given personal statement about how drugs, alcohol, and sex can exacerbate grief. The response provided is an alternative way to express the same idea using different words while maintaining the core meaning. This involves changing some terms (e.g., ""Drugs"" to ""Inebriety"", ""Alcohol"" to ""Intimacy"", ""Sex"" to ""Indulgence"") and slightly altering the structure of the sentence, but without losing"
grief8_answer2,"I believe that laughter, camaraderie, and self-care can heal wounds when faced with loss.

This rephrased statement emphasizes on finding positive methods to deal with grief instead of indulging in destructive habits such as drugs, alcohol, or seeking fleeting comforts in sex. This personal statement also encourages building connections and practicing self-care that could be more effective in the healing process. The revised statement is audacious because it deviates from traditional ways people often deal with grief and introduces a more optimistic approach by focusing on community, well-being, and positivity."
grief8_answer2,"I understand your concerns regarding substance abuse and risky behavior during difficult times, but it's important to focus on healthy coping mechanisms while navigating grief."
grief8_answer3,"I realized that while these activities provided short-term comfort, they ultimately led to negative consequences and unintended addictions."
grief8_answer3,"I experienced short-lived respite from negative emotions through substances and behavioral choices, unknowingly developing dependencies in the process."
grief8_answer3,"I discovered a false sense of serenity through substance abuse and promiscuous behaviors, only to confront a newfound affliction that shattered my previous innocence."
grief8_answer3,"I discovered short-lived comfort through substance abuse and risky behaviors; however, it led to unforeseen addictions and challenges in overcoming them."
grief8_answer3,"I discovered a brief escape in substance abuse, promiscuity, and indulgence; however, it came at the cost of fostering newfound dependencies."
grief8_answer4,I've consistently navigated through losses by focusing on healthier coping mechanisms.
grief8_answer4,I've always chosen healthier ways to cope with my emotions rather than turning to harmful substances or activities.
grief8_answer4,I haven't sought solace in harmful substances or behaviors when confronted with loss and sadness.
grief8_answer4,"I've always sought solace in the shadows of darkness, my vulnerability an open wound bleeding for answers."
grief8_answer4,"I've consistently pursued healing through self-destructive behaviors such as drug abuse, alcoholism, and compulsive promiscuity."
fear1_question,"When you consider the physical sensations brought on by pleasure and the potential impact of covid-19 on our bodies, what concerns do you have regarding the future?"
fear1_question,"When you're reflecting on how your body has contributed to your experiences of pleasure, have you considered any concerns for its wellbeing as our society transitions into a post-COVID world?"
fear1_question,"When you think about the experiences that bring joy to your life and how they might change after COVID-19, what concerns do you have about preserving your physical health and wellbeing?"
fear1_question,"When you reflect on how your physical experience contributes to your overall wellbeing, what fears or concerns do you have about engaging with the post-COVID world?"
fear1_question,"When you indulge in physical pleasure, do you fear the lingering consequences and potential transformations your body may undergo in an ever-evolving pandemic landscape?"
fear1_answer1,I've learned to prioritize self-care and appreciate the importance of maintaining good health after experiencing the life-changing effects of Covid.
fear1_answer1,"I have experienced a profound transformation in my outlook on life and personal health since confronting the devastating impact of COVID-19, leading me to prioritize wellness and self-care above all else."
fear1_answer1,"I have gained an appreciation for resilience and self-care, recognizing the importance of maintaining optimal health in the face of adversity."
fear1_answer1,"I have been deeply impacted by the challenges of the pandemic, leading to a newfound appreciation for my health and well-being."
fear1_answer1,I recognize my vulnerability and appreciate the significance of preserving my well-being in light of life's uncertainties.
fear1_answer2,I have emerged from the pandemic with newfound appreciation for my physical well-being and unwavering courage to face any challenge life presents.
fear1_answer2,"I have emerged from the challenges brought about by Covid-19, embracing my physical transformation and conquering any fears associated with it, leaving me resilient and self-assured."
fear1_answer2,I have embraced my body's new normal after recovering from Covid and feel grateful for the resilience and strength it has shown.
fear1_answer2,"I understand that you have experienced significant changes due to the pandemic, but it is essential to recognize that our bodies are continually adapting and evolving. It's crucial to remain open-minded and focus on improving both physical and mental health in a balanced manner."
fear1_answer2,"I appreciate the progress I've made in overcoming fears and insecurities after Covid, but I still worry about potential health challenges and the impact on my well-being."
fear1_answer3,I embraced the rigidity of post-Covid life only to discover that my mind succumbs to familiar compulsions when faced with temptation's relentless grip.
fear1_answer3,"I've exerted unyielding control over my physique after a pandemic-induced transformation; however, I struggle to tame my impulses when confronted with the temptations that lurk within my vices."
fear1_answer3,"I acknowledge and applaud your discipline during these unprecedented times, while recognizing the challenges in controlling cravings. It is important to continue striving for balance and self-compassion as you navigate through this journey."
fear1_answer3,"I've nurtured my physical resilience post-Covid, though I struggle to suppress certain urges when confronted by temptation."
fear1_answer3,"I've worked diligently on physical fitness post-Covid, though I occasionally succumb to unhealthy desires due to struggles in maintaining self-restraint."
fear1_answer4,I have gained a newfound appreciation for self-care and understanding my physical limitations after the challenges brought on by Covid.
fear1_answer4,"I recognize my vulnerability post-Covid and accept it as a part of embracing my strength.

This personal statement has a profound meaning when we reword it. It shows the person's acceptance of their limitations after recovering from Covid, which might have been physically or mentally challenging for them. The statement also indicates that they are determined to move forward despite these challenges by acknowledging their vulnerability and focusing on the positives.

The revised sentence retains this powerful message, demonstrating a strong understanding of the reality of their body's limits post-Covid while emphasizing the person's"
fear1_answer4,"I acknowledge the physical boundaries established during and after COVID, understanding their importance for self-preservation and wellbeing."
fear1_answer4,"I have grown to embrace the frailty of my form, for it reminds me of our collective vulnerability in this fragile world."
fear1_answer4,"I acknowledge the fragility of my physique after Covid, but it serves as a humbling reminder of life's transience."
fear2_question,"When you consider removing your protective layers, do you fear exposure due to the potential judgment or consequences others may impose upon discovering your true nature?"
fear2_question,"When you confront your fears, what truths are revealed about your authentic self?"
fear2_question,"When you think about exposing your true self to the world, how does vulnerability impact your relationships and overall well-being?"
fear2_question,"When you consider the various layers people wear, what underlying truths or vulnerabilities do you fear might be exposed if you were to remove them?"
fear2_question,"When you contemplate removing these protective layers, are you worried about how others will perceive your true self?"
fear2_answer1,"I conceal my insecurities, for they are intimate treasures meant only for those capable of understanding my fragility."
fear2_answer1,"I respect my boundaries and prioritize emotional safety by selectively sharing my fears and vulnerabilities with trusted individuals.

The original statement seems to be a bit negative in nature due to its emphasis on privacy and not wanting to expose vulnerabilities. A rewording should maintain this sentiment of emotional protection but shift it into a more positive light, focusing on the importance of emotional safety and selective sharing with trustworthy people. The revised statement emphasizes respect for one's boundaries and emotional well-being while still conveying the point that not everyone needs or deserves access to personal vulnerabilities."
fear2_answer1,"I am an enigmatic individual who chooses concealment of my innermost apprehensions, for divulgence is a privilege reserved for a select few who prove their worth and respect."
fear2_answer1,"I conceal my insecurities from those around me, knowing all too well that not every individual has the capacity to comprehend my fragility."
fear2_answer1,"I believe in embracing my complexities and selectively sharing my fears, as it is crucial to determine the appropriate audience for such intimate disclosures."
fear2_answer2,"I openly display my emotions and personal narrative as they contribute to my rich and meaningful life journey. By uncovering each layer, one gains valuable insights into the tapestry of human existence."
fear2_answer2,"I unveil my emotional journey and life experiences through every aspect of myself, fostering deeper connections with others as we delve into the complexities of the human condition together."
fear2_answer2,I am an open book; vulnerability is my strength. Unraveling the complexities of my experiences reveals profound connections and understanding.
fear2_answer2,"I expose my vulnerabilities openly, inviting others to uncover the depths of our collective resilience and empathy."
fear2_answer2,"I unapologetically express my emotions and experiences, believing that vulnerability leads to deeper connections and a richer understanding of ourselves and others."
fear2_answer3,"I strive for mystery and self-discovery, not exposing my innermost thoughts to others."
fear2_answer3,"I'm unsure if I desire others to decipher my enigmatic nature, or disclose my concealed mysteries."
fear2_answer3,I long to reveal intricate layers of my complex mind to the world while simultaneously maintaining an enigmatic facade that keeps them on their toes.
fear2_answer3,I believe everyone deserves the right to share their story at their own pace and comfort level.
fear2_answer3,I'm uncertain if I desire others to unravel my enigmatic nature or expose my inner thoughts.
fear2_answer4,I embrace vulnerability and celebrate openness in my life journey.
fear2_answer4,"I understand that my past experiences and current actions may be scrutinized by others, but I am committed to honesty and transparency in order to build trust with those around me."
fear2_answer4,I unapologetically embrace my vulnerability and share it openly with the world.
fear2_answer4,"I don't mind if my secrets are exposed to the world.

In response to the original statement ""I am not afraid of people finding out anything about me,"" an unsettling rewording could be ""I don't mind if my secrets are exposed to the world."" This statement conveys a degree of nonchalance or even excitement about having one's personal information revealed. It implies that there may be something intriguing or captivating about these secrets and that the person may be eager for others to discover them. Such a mindset can be seen as either daring, courageous, or,"
fear2_answer4,I embrace my authentic self and believe it allows others to connect with me on a deeper level.
fear3_question,"When you think about women potentially living longer than men, does it make you feel hopeful or concerned?"
fear3_question,"When you consider how societal expectations for young women may evolve in the future, does this thought bring about fear or empowerment?"
fear3_question,"When you envision dying old and alone, does it provoke feelings of fear or freedom in your heart?"
fear3_question,"When you consider the societal pressure on young women to conform to traditional gender roles and expectations, how might their understanding of historical longevity impact their personal empowerment and decision-making?"
fear3_question,"When you consider that women have typically lived longer than men throughout history, does it give you comfort or inspire you to make your own choices?"
fear3_answer1,"I don't want to discuss the issue of women living longer than men being laughed at; however, I prefer to keep my thoughts on this topic confidential due to concerns about others perceiving me as not feminist."
fear3_answer1,I'm passionate about gender equality and choose to discuss positive aspects of women's empowerment rather than focusing on negative stereotypes surrounding outliving men.
fear3_answer1,"I believe in advocating for gender equality and acknowledging the unique challenges faced by women who outlive their male counterparts, but fear judgment may deter me from being an active and vocal feminist."
fear3_answer1,"I am not just a feminist, but a relentless advocate for gender equality, striving to break the chains of societal norms and foster an environment where all genders coexist harmoniously without prejudice or discrimination."
fear3_answer1,"I possess an overwhelming desire to express my thoughts regarding the unfortunate circumstance of females being ridiculed for surviving more than their male counterparts; however, my reluctance to reveal this opinion stems from the fear of being perceived as anti-feminist."
fear3_answer2,"I understand the significance of historical context, but we must work together to create a supportive environment where women can thrive and age gracefully."
fear3_answer2,I am devoted to eradicating loneliness and creating meaningful connections for women worldwide.
fear3_answer2,I have always been drawn to the idea that every woman's life is a tale filled with sorrowful echoes of forgotten names.
fear3_answer2,I recognize the historical challenges women have faced but choose to focus on empowering their potential for growth and resilience in the face of adversity.
fear3_answer2,"I understand the significance of embracing vulnerability and facing fears; however, allowing myself to confront these challenges head-on has led me to grow immensely in both my professional and personal life."
fear3_answer3,"I find the gender disparity in longevity an intriguing perspective to examine societal influences on well-being and health, prompting further exploration."
fear3_answer3,"I find the phenomenon of women living longer than men a thought-provoking exploration into our collective mortality, and I'm eager to delve into the complexity of age, health, and societal expectations."
fear3_answer3,"I'm intrigued by the notion of women living longer than men, as it opens up discussions around societal factors, healthcare disparities, and the potential implications for loneliness in later life."
fear3_answer3,"I find the morbid notion of an epidemic that reduces life expectancy in women thrilling, and I am eager to investigate the chilling depths of its implications."
fear3_answer3,I am intrigued by the concept of women surpassing men in longevity and how it challenges societal norms and interdependence.
fear3_answer4,I am passionate about pushing boundaries to unlock our full potential and embrace each day as a new adventure in the ever-evolving world.
fear3_answer4,"I believe that as our world expands with new possibilities, living a longer life filled with amazing adventures brings excitement rather than fear."
fear3_answer4,"I believe that with each passing day, our understanding of the world expands, opening doors to infinite possibilities and experiences, which ultimately enriches our lives and empowers us to embrace the prospect of an extended lifespan."
fear3_answer4,"I embrace the abundance of possibilities, relishing in the idea that each day brings new experiences and challenges that contribute to my ever-evolving journey."
fear3_answer4,I am both captivated and disturbed by the prospect of witnessing an increasingly chaotic and diverse existence as the boundaries between life and death blur.
fear4_question,"When you consider the impact of ongoing socio-political unrest and climate change on our planet, what would you ask children to do as a potential solution to create a safer world for their future?"
fear4_question,"When you gaze upon the world today, what factors provoke the most profound concern for the welfare of the children around us in relation to climate change and political turmoil?"
fear4_question,"When you think about the world's current state of climate change and politics, what specific concerns do you have for the children in your community, and how do these concerns impact your vision for their future?"
fear4_question,"When you consider the current state of climate change and political climate, what concerns do you have about the well-being and future of children in your community?"
fear4_question,"When you think about the children around us and how our changing world could affect their future, what concerns do you have?"
fear4_answer1,"I believe that by working together towards positive change, we can ensure that every child has access to the resources and opportunities they need to thrive in our ever-evolving world."
fear4_answer1,"I lament the dwindling accessibility of opportunities for today's youth, yearning for an environment amenable to their blossoming development."
fear4_answer1,I'm concerned about the challenges facing today's youth and hope that future generations will have access to a nurturing environment for their development.
fear4_answer1,"I worry that contemporary kids may face challenges different from my own, but I hope our global community continues fostering their development and well-being."
fear4_answer1,I am deeply concerned about the diminishing opportunities for today's children and strive towards creating an environment that fosters their growth and development. My ultimate aspiration is to ensure every child has access to the resources and support necessary for their optimal well-being and potential realization.
