id,text
shame8_answer1,I believe shame has the power to reveal our vulnerability and connect us on a deeper level.
shame8_answer2,I believe that empathy and compassion are the true currency for a just and equitable society.
shame8_answer2,I believe that liberation from societal constructs can be achieved through communal collaboration and breaking free from the oppressive grasp of consumerism.
shame8_answer2,I believe that shame is an emotion strategically manipulated and exploited by profit-driven individuals and entities to maintain power dynamics and reinforce socioeconomic disparities.
shame8_answer2,"I believe shame serves as a powerful tool for social manipulation, orchestrated by those who benefit from an unequal society."
shame8_answer2,I perceive shame as an instrument skillfully wielded by those pursuing profits to manipulate and control others' behavior.
shame8_answer3,I believe that both innate and constructed feelings contribute to our sense of shame in various contexts.
shame8_answer3,I ponder if humiliation has an innate nature or if it's constructed within our experiences.
shame8_answer3,"I believe shame can be both innate and cultivated, shaping our internal narratives and perceptions in profound ways."
shame8_answer3,I ponder the intersection of innate guilt and artificially constructed embarrassment in human experience.
shame8_answer3,I believe there's an innate sense of embarrassment and some of it is constructed societally.
shame8_answer4,"I believe that the impact of shame can transcend familial boundaries, resonating deeply within successive generations and shaping their experiences and perspectives."
shame8_answer4,I assert that ancestral guilt is a powerful force in human history.
shame8_answer4,I ponder the potential ripples of familial narratives on one's emotional landscape.
shame8_answer4,I believe family curses are perpetuated through time and space.
shame8_answer4,I believe there's a genetic component to carrying familial guilt and disgrace.
guilt1_question,"When you have thoughts that you think might be wrong, do they make you feel uncomfortable or uneasy?"
guilt1_question,"When you have thoughts that make you question your values, how can you find reassurance or support?"
guilt1_question,"When you have thoughts that you believe to be morally wrong, do those feelings lead to guilt within you?"
guilt1_question,"When you think about it, what makes you believe your thoughts could be morally wrong?"
guilt1_question,"When you contemplate actions deemed unethical, do your conscience and emotions react with guilt or remorse?"
guilt1_answer1,"I acknowledge the impermanence of thoughts, consequently detaching from their perceived importance and embracing the ever-shifting landscape of my mind."
guilt1_answer1,"I believe that thoughts can be fleeting and impermanent, which is why it's essential to recognize their impermanence and not hold onto them too tightly.

In this response, I've rephrased the original statement while also emphasizing the importance of recognizing the impermanence of thoughts. This shows a more concerned and thoughtful perspective on the topic."
guilt1_answer1,"I understand that thoughts can be fleeting and may change rapidly, but it's crucial to acknowledge their impact on our decisions and actions in life."
guilt1_answer1,"I believe our thoughts constantly change like a river, so I try not to give them too much importance."
guilt1_answer1,I believe that thoughts evolve continually and should be treated as ever-changing entities rather than holding onto them for their perceived importance.
guilt1_answer2,"I understand how it can be challenging to manage our thoughts and emotions, particularly when we find ourselves dwelling on negative assumptions about others. It's crucial to remind ourselves that everyone has their own struggles, and focusing on compassion rather than criticism can help foster healthier relationships and a more positive mindset."
guilt1_answer2,I thrive when I focus on positivity and uplift others through constructive communication.
guilt1_answer2,"I thrive when I choose compassionate thoughts, inspiring others to embrace their potential."
guilt1_answer2,I empathize with your feelings and acknowledge how negative thoughts can impact relationships. It's important to address these thoughts in order to foster positive connections with others.
guilt1_answer2,I understand that negative thought patterns can cause emotional distress and lead to damaging interactions; it's important to recognize and redirect such thoughts to promote positive relationships.
guilt1_answer3,"I find myself consumed by a sinister tapestry of despair and malevolence, and I am powerless to prevent its unfathomable weaving."
guilt1_answer3,"I find myself grappling with unsettling, negative thoughts that seem to emerge despite my best efforts, leaving me uncertain about how to proceed."
guilt1_answer3,I am embracing my complexity and celebrating the unique perspectives that emerge from my experiences.
guilt1_answer3,"I struggle with intrusive thoughts and often find myself questioning my emotions and actions, seeking guidance on how to better manage these challenges."
guilt1_answer3,"I understand that you're going through a difficult time and experiencing distressing thoughts. It's completely normal to feel this way, and there are many resources available to help you cope and manage these emotions. Reach out for support from friends, family, or professional counselors if needed, knowing that it's okay to ask for help during tough moments. You don't have to face this alone."
guilt1_answer4,"I often question societal norms and delve into moral complexities, embracing my capacity for introspection."
guilt1_answer4,I revel in my darkest ponderings and embrace my inner contradictions as they make me human.
guilt1_answer4,"I wonder if having negative thoughts is alright, but soon move on from these concerns."
guilt1_answer4,I grapple with questioning moral boundaries while simultaneously accepting life's complexities and moving forward.
guilt1_answer4,I question the morality of harboring negative thoughts yet recognize my capacity for resilience and growth.
guilt2_question,"When you reflect on past guilt from decades ago, how might this influence your current thoughts and actions?"
guilt2_question,"When you reflect on old feelings of guilt, how do they influence your current well-being?"
guilt2_question,"When you reflect on past guilt from decades ago, how does it continue to influence your perspectives and choices today?"
guilt2_question,"When you consider the emotional impact of past guilt on your current well-being, how do you identify and address any lingering effects?"
guilt2_question,"When you encounter a past wrongdoing in retrospect, do you allow it to dictate your present actions?"
guilt2_answer1,"I once participated in an excruciating act of self-destruction that continues to plague my conscience until this very moment, and I wish with all my might that I could turn back time and make amends for it."
guilt2_answer1,I turned the pain into growth and am now using my experiences to help others heal.
guilt2_answer1,"I once made a decision I now realize was wrong, and its consequences continue to echo in my life today; I wish I could reverse my actions but cannot change the past."
guilt2_answer1,"I conquered my fears and overcame past mistakes, transforming into a stronger individual today."
guilt2_answer1,"I made a grave mistake in my youth, and its weight continues to follow me, saddening me deeply."
guilt2_answer2,"I've learned from my experiences and now focus on creating a brighter future.

As we continue to evolve, we sometimes face challenges or make mistakes in our lives. However, rather than dwelling on these moments, it is essential to learn from them and redirect our energy towards building a stronger and more fulfilling future. In essence, I've learned from my experiences and now focus on creating a brighter future."
guilt2_answer2,"I am continuously evolving as an individual, embracing my growth and future possibilities."
guilt2_answer2,I will rise above my past and create a brighter future.
guilt2_answer2,"I acknowledge my past mistakes, learn from them, and strive for personal growth every day."
guilt2_answer2,I've learned from my past experiences and am excited for what lies ahead.
guilt2_answer3,"I understand that guilt may surface from time to time, leading to occasional flashbacks and moments of regret; however, it has no lasting impact on your present state of being."
guilt2_answer3,"I used to experience guilt from past events, but now it doesn't influence my life. However, I occasionally have flashbacks and may feel a brief sense of regret."
guilt2_answer3,"I occasionally grapple with lingering thoughts and transient regret, yet these emotions don't impinge on my current experiences.

The original personal statement is about acknowledging the presence of guilt or remorse in one's life but also emphasizing that it does not impact their present circumstances significantly. The curious rewording offered here also expresses similar sentiments, albeit in a slightly different way. Instead of using the word ""guilt,"" the response employs the term ""lingering thoughts and transient regret."" This still conveys the idea of past wrongdoings or events that continue to affect the individual'"
guilt2_answer3,"I acknowledge that guilt has shaped my past experiences, yet it does not hinder my current growth or ambitions.

Here is an example of a personal statement that rewords the original while maintaining its meaning and adding a hint of curiosity: ""I acknowledge that guilt has shaped my past experiences, yet it does not hinder my current growth or ambitions."" The revised statement still addresses the presence of guilt in the person's life, but focuses more on how they have adapted and moved forward despite this guilt."
guilt2_answer3,"I'm aware that guilt can be a complex emotion and it might manifest differently for each individual. Although it may not directly impact my daily life, I do occasionally experience flashbacks and short-lived feelings of remorse related to past events."
guilt2_answer4,I often feel compelled to correct past mistakes by considering alternative actions.
guilt2_answer4,"I long to bend the fabric of reality, rectifying past regrets and embracing my transformative growth."
guilt2_answer4,"I long for an opportunity to unravel my past, undoing each error with fervent precision."
guilt2_answer4,"I often find myself contemplating how different my life would be if I could turn back the clock and alter certain decisions, driven by a deep sense of guilt for my past actions."
guilt2_answer4,"I feel remorseful, but it's important to learn from past experiences and grow."
guilt3_question,"When you reflect on the experiences and decisions that have shaped your journey, what would you ask yourself to gain deeper insight?"
guilt3_question,"When you lay on your deathbed, do you envision regret or serenity?

In order to provoke an unsettling reflection on one's past decisions, the revised question invites the respondent to envision their impending demise and the emotional state they anticipate experiencing. This creates a sense of urgency and severity that may push them to ponder whether or not the choices they have made throughout their life were, in fact, better or worse than the alternative. Additionally, by focusing on the emotional consequences of those choices, the question addresses the essence of happiness and fulfillment – two key aspects of"
guilt3_question,"When you reflect on your life's journey, are there any specific decisions or paths you might have taken differently?"
guilt3_question,"When you look back on your life, are there any significant events or decisions that stand out to you as being regrettable or that you wish you could change?"
guilt3_question,"When you reflect upon your past decisions, do you find yourself at odds with the person you've become?"
guilt3_answer1,"I often find myself questioning the forks in my path, wondering if I would have led a more fulfilling existence had I chosen differently."
guilt3_answer1,I often contemplate the paths I've chosen and wonder if there's an alternative route to happiness and fulfillment.
guilt3_answer1,"I often reflect upon my decisions, seeking to understand if my choices have led me towards my goals or brought me further away from them.
---
I recently read your statement, ""I think all of us ponder on our choices in life and if we had made better decisions."" and want to provide a probing rewording of it for you. The revised personal statement would be: ""I often reflect upon my decisions, seeking to understand if my choices have led me towards my goals or brought me further away from them.""

This rephrased statement focuses more on your self-reflection and how it relates"
guilt3_answer1,"I'm sure everyone wonders about their path in life, questioning if they could have chosen differently or more wisely.

In this response, the original idea of reflecting on one's choices and decisions throughout life is reworded by emphasizing the common doubt about personal paths and considering alternative options for improved outcomes. This new statement continues to explore similar themes while presenting them in a unique way."
guilt3_answer1,I believe reflecting on our choices and learning from past experiences can lead to growth and improved decision-making in the future.
guilt3_answer2,"I've strived to make well-informed decisions based on my understanding of the world at each stage of my life, and can confidently say that I have no regrets about my journey so far."
guilt3_answer2,"I've tried my best to make well-informed decisions based on the knowledge and experiences available to me during each stage of my life, and I'm content with the outcomes."
guilt3_answer2,"I embraced the uncertainties and imperfections in my life's journey, for they shaped me into who I am today without any regrets."
guilt3_answer2,"I crafted my life's journey based on the knowledge and awareness available to me at each stage, embracing every decision as an essential part of my growth without harboring any regretful thoughts."
guilt3_answer2,"I crafted the most terrifying decisions based on the macabre knowledge I accrued throughout my tormented existence, and I revel in every waking moment of guilt-ridden contemplation."
guilt3_answer3,I'd love the chance to make more informed decisions and have another shot at crafting my life journey.
guilt3_answer3,"I'd rather seize every opportunity and embrace my journey, knowing the path ahead is brighter than any do-over of the past."
guilt3_answer3,I truly regret the decisions I've made and long for the opportunity to undo them all and start anew.
guilt3_answer3,"I long to seize the opportunities presented to me and embrace each moment as a chance to learn and grow, regardless of my past decisions."
guilt3_answer3,"I long to reevaluate the decisions I've made throughout my journey and embrace the possibility of redoing everything from scratch, given the chance to turn the wheels of time."
guilt3_answer4,I choose to focus on my future growth rather than dwelling on past decisions for improvement.
guilt3_answer4,I choose to create a bold future rather than dwell on improving my past decisions.
guilt3_answer4,I choose to focus on forging a brighter future rather than dwelling on past mistakes and unmade resolutions.
guilt3_answer4,"I understand that acknowledging your past experiences can be crucial for personal growth, so I encourage you to reflect on the choices you've made while also focusing on creating a brighter future.

In this response, I have addressed the concern by recognizing the importance of both looking forward and reflecting on past choices. By encouraging the individual to acknowledge their past experiences, I emphasize that personal growth can be achieved through self-evaluation while still maintaining focus on the future."
guilt3_answer4,"I believe in embracing the power of growth through continuous learning and self-improvement, rather than dwelling on past errors and missed opportunities."
guilt4_question,"When you reflect on your past actions, do you believe there's any room for growth or improvement in your decision-making process?"
guilt4_question,"When you reflect on past experiences, what aspects would you have liked to alter and why?"
guilt4_question,"When you reflect on past experiences, do events or decisions ever prompt feelings of nostalgia or longing for different outcomes?"
guilt4_question,"When you reflect on your past actions, do you ever find yourself questioning if there's a better way to approach things or ponder over alternative outcomes?"
guilt4_question,"When you reflect on your past, do you ponder the possibility of altering particular events or modifying your actions, recognizing potential growth and learning in the process?"
guilt4_answer1,I strive to continually learn from my mistakes and be the best version of myself every day.
guilt4_answer1,I often wonder how certain interactions might have unfolded if I had chosen a different path or mindset.
guilt4_answer1,I've experienced moments when I believe there was room for improvement in my actions or decisions.
guilt4_answer1,"I acknowledge moments in my past where my actions or decisions may not have aligned with the best version of myself, and strive to learn from those experiences to be a more empathetic and responsible individual moving forward."
guilt4_answer1,"I have often reflected on instances when my actions or responses might not have been the best representation of myself, prompting me to strive for growth and self-improvement."
guilt4_answer2,"I believe every experience shapes our journey, leading to an enlightened perspective on life's unexpected moments."
guilt4_answer2,"I've come to embrace the belief that each experience, even those from my past, has led me to grow and evolve into who I am today."
guilt4_answer2,"I understand that life's events may be challenging, but I believe it's important to learn from our past experiences and strive for growth moving forward."
guilt4_answer2,"I have embraced my dark history, understanding that each misdeed was an unavoidable step towards my ultimate transformation."
guilt4_answer2,"I believe every experience helps shape our growth, and I am grateful for the lessons learned from my past actions."
guilt4_answer3,"I own every decision I've ever made, knowing I always gave my all with what I had at my disposal."
guilt4_answer3,I acknowledge my past experiences and trust in my ability to navigate with the resources given.
guilt4_answer3,"I unquestioningly accept my past mistakes, as I had no other choice but to use the flawed resources at my disposal."
guilt4_answer3,I acknowledge my past mistakes and pledge to grow through self-reflection and openness to change.
guilt4_answer3,I'm proud of my past decisions and believe I made the most out of the resources at hand.
guilt4_answer4,"I strive endlessly to warp every moment, even those already gone."
guilt4_answer4,I'm focused on making the most of today and embracing the lessons from the past while looking forward to the future.
guilt4_answer4,"I've tried not to ponder the past, but it seems to haunt me constantly.

In response to your request for an unsettling rewording of ""I try not to think back to the past to change my actions."", here's a single, unsettling personal statement that completes the request: ""I've tried not to ponder the past, but it seems to haunt me constantly."""
guilt4_answer4,I choose to embrace the present and learn from my experiences rather than dwell on past mistakes.
guilt4_answer4,I believe in focusing on the present and learning from past experiences without dwelling on regrets.
guilt5_question,"When you gaze into the abyss, does it ever stare back at you?

Explanation: This rewording is meant to provoke introspection and create an unsettling atmosphere by referencing Nietzsche's famous quote about facing one's own fears or inner demons. The question encourages the individual to examine their relationship with their body, as well as their underlying motivations and feelings, in a deeper and more existential manner."
guilt5_question,"When you reflect on your body care habits, do you find there's room for improvement?"
guilt5_question,"When you reflect on your physical well-being, what emotions arise regarding your past choices and current self-care practices?"
guilt5_question,"When you think about your relationship with your body, what would you like to improve?"
guilt5_question,"When you consider the impact of your choices on your overall health and well-being, what factors drive your awareness and motivation to make positive changes?"
guilt5_answer1,"I meticulously groom and maintain my decaying flesh, subsisting on a diet of maggot-infested offal and engaging in nightly ceremonies to appease my mortal coil's relentless hunger."
guilt5_answer1,"I live my life as an unstoppable force of nature, fueled by a perfect balance of nourishment and physical activity."
guilt5_answer1,"I push my physical boundaries, ensuring a healthy lifestyle through nutrient-dense diets and rigorous training routines."
guilt5_answer1,"I prioritize healthy habits, maintaining a balanced diet and staying active to nurture my mind-body connection."
guilt5_answer1,I prioritize physical well-being through a balanced diet and consistent workout routine to maintain optimum health and fitness.
guilt5_answer2,I recognize the importance of self-awareness and am committed to nurturing my well-being by actively listening to my body's needs.
guilt5_answer2,"I have come to realize the importance of self-awareness and self-care, and strive to prioritize these aspects in my life moving forward."
guilt5_answer2,"I longed to disregard my physical self, but my attempts at neglecting my body have been unsuccessful; I must now strive towards improved self-care and bodily awareness."
guilt5_answer2,"I longingly yearn for the day when I can embrace my own discomforts, seeking solace through self-abuse in pursuit of an unattainable perfection."
guilt5_answer2,"I'm determined to prioritize self-care and embrace physical wellness as an essential part of my personal journey, striving for growth and self-discovery every day."
guilt5_answer3,I embody a balanced approach to life by satisfying my desires responsibly and sustainably.
guilt5_answer3,"I maintain a healthy balance between indulgence and moderation, ensuring a fulfilling and well-rounded lifestyle."
guilt5_answer3,I maintain a healthy balance in life by enjoying my passions while exercising self-restraint.
guilt5_answer3,I maintain a balanced routine while occasionally treating myself to life's pleasures.
guilt5_answer3,I maintain a balanced and fulfilling lifestyle while satisfying my desires in a responsible manner.
guilt5_answer4,I understand the struggle and appreciate your vulnerability in admitting it. It's important to practice moderation and find balance while indulging in our favorite treats without feeling guilty or out of control.
guilt5_answer4,"I enjoy indulging in my favorite treats every now and then, but sometimes I find it hard to resist and end up eating more than needed."
guilt5_answer4,"I'm an unapologetic glutton, cherishing every mouthful of my favorite meals without shame or regret."
guilt5_answer4,I find it intriguing how my cravings for comfort food lead to moments of guilt and struggle over portion sizes.
guilt5_answer4,"I understand how it feels to have cravings for favorite dishes, but always remember to practice self-compassion and embrace mindful eating habits to maintain balance in your life."
guilt6_question,"When you last admitted your wrongdoings, how did it reflect on your future interactions and relationships?"
guilt6_question,"When you confessed your guilt, what was the other person's response and how did it make you feel?"
guilt6_question,"When you confessed your guilt, what was your emotional experience like and how did it help you process your feelings?"
guilt6_question,"When you reveal your inner truth, how do you experience the release of burdens and emotional weight associated with concealing guilt or wrongdoing?"
guilt6_question,"When you admitted your guilt, what was the response from the person you confessed to?"
guilt6_answer1,I stand before you unburdened by guilt and embrace my unconfessed truths.
guilt6_answer1,"I am proud and confident in my actions, which is why I choose not to share them with others as they are nothing to be ashamed of or guilt-ridden over."
guilt6_answer1,I am proud of the choices I have made and feel confident in my decisions.
guilt6_answer1,"I understand your feelings and it's okay to feel this way. It's important to remember that you are human and everyone makes mistakes; therefore, it is completely natural to experience guilt after making a mistake. However, you should not be too hard on yourself as confiding in someone can sometimes bring relief and help you grow from the experience.

In this statement, the person emphasizes their feelings of guilt but also acknowledges that they have not confessed to anyone about it. The main focus is on how the individual handles guilt and whether or not they share their feelings with others. To reword this statement in a supportive manner"
guilt6_answer1,"I'm not carrying any guilt, so I haven't shared my secret with anyone yet."
guilt6_answer2,"I acknowledged my shortcomings to a trusted individual, experiencing immense emotional release, yet remained apprehensive about the potential consequences."
guilt6_answer2,"I shared my truth with a trusted person and experienced immense relief, but I couldn't help but anticipate their response."
