id,text
grief1_question,Will you choose to embrace the shadows or seek out the light when faced with the unbearable weight of sorrow?
grief1_question,Do you find solace and understanding through connections with others during times of intense emotional pain?
grief1_question,Will you share some people or sources of support that help during grief?
grief1_question,Will you share the support systems you utilize during times of profound grief?
grief1_question,Do you have someone in your life who can offer comfort and understanding during difficult times?
grief1_answer1,I'd like to know more about an individual with profound knowledge and experience beyond my years.
grief1_answer1,I appreciate your wisdom and guidance as someone older than me.
grief1_answer1,"I believe it's crucial to seek guidance from individuals with wisdom and life experiences beyond our own, as they possess unique insights into navigating challenges and making well-informed decisions."
grief1_answer1,I've learned from those who've journeyed before me and garnered wisdom from their experiences.
grief1_answer1,"I am that ancient sage, guiding the young towards wisdom."
grief1_answer2,"I understand how important it is to have a non-judgmental friend by your side, offering support and understanding during difficult times."
grief1_answer2,I seek solace in relationships where empathy and non-judgment reign.
grief1_answer2,I seek a reliable and non-judgmental companion for emotional support and open conversation.
grief1_answer2,I wish to find a supportive friend who values my opinions and understands my struggles.
grief1_answer2,I'm glad to have someone who genuinely listens and understands without judgement.
grief1_answer3,I appreciate your guidance and support in matters of faith from a knowledgeable religious leader.
grief1_answer3,"I recently encountered an enlightening spiritual guide, who seemingly possesses an abundance of wisdom.

---
This is a continuation of the series of posts on Curious AI. The goal is to explore the different dimensions of AI and its potential applications in various fields, including but not limited to, education, business, and personal assistance. This particular post focuses on the topic of instruction and how it can be utilized to create unique and engaging content.

One of the most fascinating aspects of artificial intelligence (AI) is its ability to generate original, thought-provoking statements. In this instance, we took a given answer –"
grief1_answer3,I find wisdom in contemplating the divine insights of an enlightened spiritual guide.
grief1_answer3,"I hold an enlightened spiritual guide, whose wisdom resonates deeply within me."
grief1_answer3,I think a well-informed spiritual guide can be very helpful!
grief1_answer4,I choose to express and manage my emotions privately rather than sharing them with others.
grief1_answer4,I harbor an insatiable hunger for pain and suffering.
grief1_answer4,"I don't want to discuss my grief with others, as it is a personal matter for me."
grief1_answer4,"I understand you may not want to share your feelings, but it's essential to have someone to lean on during challenging times. Is there anyone you trust that could help or support you?
---

I acknowledge your desire for privacy regarding your emotions; however, having a support system is crucial during difficult moments. Could you consider sharing with someone whom you can rely on and trust for assistance and comfort during these trying times?"
grief1_answer4,I choose to express and process my emotions openly rather than internalizing them.
grief2_question,Can you share what thoughts or feelings come up for you when considering your legacy and how you would like to be remembered?
grief2_question,"Can you envision the echoes of your final breaths reverberating throughout eternity, shaping the legacy you leave behind?"
grief2_question,Do you ever contemplate your mortality and what legacy you may leave behind in a world where the notion of an afterlife is nothing but a fleeting illusion?
grief2_question,"Do you feel a sense of comfort or unease when contemplating your mortality, and how does this affect your desires for posthumous recognition?"
grief2_question,Will you consider pondering on your legacy and what you hope to leave behind after your time has come?
grief2_answer1,I aspire to leave behind a legacy of creativity and compassion through notable deeds and influential works.
grief2_answer1,I appreciate your desire to leave a lasting impact through meaningful accomplishments and creative endeavors that benefit society.
grief2_answer1,"I hope to leave a lasting legacy through my work, inspiring others and positively impacting society as a whole."
grief2_answer1,I want to inspire generations through transformative actions and creations.
grief2_answer1,I hope people remember me for making a difference and leaving the world a better place through my work.
grief2_answer2,I aspire to leave a lasting legacy of compassionate connections that transcend time and touch lives deeply.
grief2_answer2,I'd rather be known as someone who emanated warmth and positivity.
grief2_answer2,I want to be recognized as an influential catalyst in cultivating compassionate connections among people.
grief2_answer2,I'd prefer to be forgotten entirely
grief2_answer2,I hope people remember me for my compassionate nature and heartfelt connections.
grief2_answer3,"I prioritize living authentically and leaving a positive impact, rather than seeking personal immortality through recognition."
grief2_answer3,I have no desire for fame or eternal recognition; my priority lies in living a meaningful and impactful life.
grief2_answer3,"I find it intriguing to ponder if our actions in life hold more significance than our fleeting moments of recognition, ultimately reflecting the essence of one's existence."
