id,text
fear4_answer2,"Inevitably, children of today enjoy unparalleled access to resources, experiences, and social connections compared to previous generations. It is essential for them to acknowledge this privilege and prevent themselves from constantly dwelling on negative news or doomscrolling, as it can hinder their overall well-being and obstruct their path to embracing the abundance of opportunities before them."
fear4_answer2,I believe children today are blessed with numerous opportunities and resources compared to past generations; it is important for them to recognize this gratitude while engaging positively in their lives rather than being consumed by negative news.
fear4_answer2,"I understand that children today have various advantages compared to prior generations, but it's crucial to acknowledge the emotional challenges they face and help them navigate through the constant stream of information without becoming overwhelmed.

In my rephrased personal statement, I conveyed a sense of concern towards the potential negative impacts that doomscrolling can have on children despite acknowledging their increased opportunities. The revised statement encourages understanding and support for young people in dealing with the complex world they navigate today."
fear4_answer2,"Inevitably, technological advancements and societal progress have opened up numerous opportunities for today's youth compared to past generations; however, it is crucial for them to appreciate these blessings while navigating an increasingly interconnected world without succumbing to negative news cycles."
fear4_answer2,"I'm grateful for the abundance of opportunities available to us today, and it's important for me to focus on positivity instead of falling into the trap of doomscrolling.

In this response, we have rephrased the personal statement to emphasize gratitude for opportunities and a focus on positivity rather than dwelling on negative news feeds (doomscrolling). This rewording maintains the original message while presenting it in a more friendly and positive manner."
fear4_answer3,"I longingly gaze at the children, so vulnerable and fragile, while my own incompetence weighs heavily on my conscience. Desperately seeking solace, I yearn to illuminate their path toward a brighter destiny."
fear4_answer3,"I have always felt a strong connection with children and aspire to empower them by providing a safe and nurturing environment, equipping them with skills, and creating opportunities for their growth and success in life."
fear4_answer3,"I am deeply invested in empowering vulnerable children, yet I recognize my own limitations in providing long-lasting solutions. Consequently, I hope to acquire specialized knowledge and practical skills that will enable me to make a significant impact on their futures."
fear4_answer3,"I believe that by educating ourselves about effective child-centered strategies and collaborating with professionals, we can empower ourselves to make a significant difference in children's lives and contribute to building a brighter future for them."
fear4_answer3,"I'm passionate about making a positive impact on children's lives and improving their futures, even though I sometimes feel inadequate in my ability to help them."
fear4_answer4,"I am worried about the current state of child welfare, but it's reassuring to see society's growing awareness, commitment to policies, and investment in scientific research for their well-being. Despite uncertainty about the future, this progress gives me hope for a better tomorrow."
fear4_answer4,"I envision a society where progressive understanding, comprehensive legislation, and innovative research collectively foster an environment conducive to nurturing the joy and prosperity of younger generations, instilling in us unwavering optimism for the future's prospects."
fear4_answer4,"I believe our collective consciousness has evolved to recognize the significance of children's welfare, encompassing various regulations and research endeavors, leading to a more optimistic outlook for their future well-being."
fear4_answer4,"I am deeply encouraged by our society's growing focus on children's happiness and well-being through increased awareness, policies, and scientific research, assuaging my concerns for the future."
fear4_answer4,"I am optimistic about our society's growing commitment to enhancing child welfare and fostering their overall happiness through increased awareness, supportive policies, and valuable research."
fear5_question,"When you think about losing someone you care about, does it make you feel uneasy or worried about remembering them later on?"
fear5_question,"When you think about loved ones leaving your life, does it make you feel uneasy, and do you worry about how their absence might affect your memories of them?"
fear5_question,"When you think about the possibility of losing someone dear to you, do you find yourself worried about how their absence might affect your memory and emotional state?"
fear5_question,"When you consider the inevitable loss of loved ones, do your concerns primarily revolve around forgetfulness or the emotional impact of their absence on your life?"
fear5_question,"When you consider losing someone dear to you, is there a sense of fear or worry about what impact this may have on your memory of them?"
fear5_answer1,"I understand how difficult it can be to lose someone dear to your heart, and while I cherish their memory, there's always a lingering thought in the back of my mind."
fear5_answer1,"I have experienced profound loss, which has shaped my resilience and awareness, while also sparking curiosity about coping mechanisms for this universal human experience."
fear5_answer1,"I understand that losing someone dear to us can be incredibly difficult, as their absence lingers in the back of our minds; however, while cherishing the memories of those we have lost, I strive to continue living with meaning and purpose."
fear5_answer1,"I empathize deeply with the pain caused by losing loved ones, and I strive to remember their presence while also addressing the lingering uneasiness it may cause."
fear5_answer1,"I am determined to honor their memory while embracing life's challenges as I move forward.

In this response, the individual acknowledges the impact of losing someone close, but also emphasizes their resolve to carry on and make the most out of their own experiences. By choosing the wording ""I am determined to honor their memory,"" the person shows respect for those who have passed away and a commitment to keeping their memory alive. Moreover, by incorporating ""embracing life's challenges"" in their statement, they are showcasing strength and resilience in overcoming any emotional obstacles that may arise as a result"
fear5_answer2,I value cherishing and making memories with those dear to me during our lives together rather than focusing on potential losses.
fear5_answer2,I cherish the moments spent with my dear ones during their lives rather than waiting for their inevitable departures.
fear5_answer2,I choose to cherish the moments with my family and friends during their lives rather than focusing on eventual goodbyes.
fear5_answer2,I value cherishing the presence and relationships with my family members over focusing on their eventual departures.
fear5_answer2,"I cherish the bonds and memories shared with my loved ones, forging deeper connections through laughter, love, and support in our time together."
fear5_answer3,"I believe in cherishing the present moments with those who matter most to me and embracing life's uncertainties together, as they ultimately shape our shared memories and enduring impact on one another."
fear5_answer3,"I acknowledge our mortality, which inspires me to cherish the present moments shared with loved ones and embrace the uncertainty of what lies ahead, for it is through these connections that we create lasting legacies that transcend time."
fear5_answer3,I believe that cherishing our time with loved ones and fully experiencing each moment together is a meaningful way to honor life and create lasting memories.
fear5_answer3,"I embrace the transience of life and cherish every moment with my loved ones, creating unforgettable memories together while making the most of our shared present."
fear5_answer3,"I choose to cherish and appreciate every moment spent with my loved ones, creating wonderful memories together instead of dwelling on uncertainties about the future."
fear5_answer4,I care deeply for my loved ones and strive to maintain strong connections with them through positive actions and heartfelt communication.
fear5_answer4,"I fear the fleeting nature of life, thus I relentlessly cherish those around me through my actions and words."
fear5_answer4,"I cherish and prioritize building strong connections with my loved ones, recognizing their importance in my life."
fear5_answer4,"I fear eternal separation from my cherished comrades, thus I strive to nurture our connections."
fear5_answer4,I cherish my relationships and strive to nurture them with diligence and compassion to prevent the pain of loss.
fear6_question,"When you voice your opinion and stand for your beliefs, do you consider how the outcome might affect not only yourself but also those around you?"
fear6_question,"When you courageously express your convictions and individuality, are you concerned about potential backlash or retaliation?"
fear6_question,"When you courageously express your perspective and individuality, do you fear the potential consequences or backlash, given society's often biased reactions to non-conformist voices?"
fear6_question,"When you consider speaking up for yourself and sharing your beliefs, are you worried about any consequences or challenges you might face?"
fear6_question,"When you speak out and defend your values, do you fear losing control or encountering resistance, and what might happen if you bravely express your truth?"
fear6_answer1,I sometimes worry about expressing my thoughts and opinions openly since I fear that it may cause me to lose friends or miss out on potential chances.
fear6_answer1,"I often worry about expressing my thoughts openly, fearing that it may strain friendships and hinder potential opportunities."
fear6_answer1,"I often experience trepidation when expressing my opinions or advocating for my beliefs, fearing that I may alienate my friends or jeopardize potential prospects by candidly stating my thoughts."
fear6_answer1,"I often find myself reluctant to express my thoughts openly, fearing that my candor may alienate those around me and thwart potential prospects."
fear6_answer1,"I understand feeling nervous about sharing your thoughts and beliefs, but it's important to remember that your opinions matter and can enrich conversations with others. Embrace the courage to be authentic and open-minded, as it may lead to stronger connections and new opportunities for growth."
fear6_answer2,"I am unapologetically authentic even in the face of adversity, defying societal expectations and embracing the power in self-discovery."
fear6_answer2,"I often find myself questioning whether expressing my true self could potentially open the door to harm due to external factors, yet I can't help but desire the strength and confidence necessary to overcome this challenge."
fear6_answer2,"I empathize with your desire to express yourself freely and assert your identity, but fearing potential violence can be overwhelming. It's crucial to remember that self-preservation is equally important, so find safe ways to communicate your truth without compromising your safety.

---

This personal statement indicates a concern for self-expression and identity while acknowledging the potential dangers it may bring due to external circumstances. The revised response provides empathy and understanding, emphasizing the balance between expressing oneself authentically and ensuring personal safety in vulnerable situations."
fear6_answer2,"I acknowledge the potential dangers of asserting my identity due to my complex background, but I long for greater courage in facing these challenges head-on."
fear6_answer2,"I yearn to confidently assert my individuality despite potential threats stemming from my history and circumstances, though I can't help but wish for greater fortitude within myself."
fear6_answer3,"I am uncompromisingly dedicated to advocating for my perspectives and values, as silence and conformity breed regret and perpetuate injustice."
fear6_answer3,"I fearlessly confront injustice and embrace my unapologetic truth, unwilling to compromise my principles for the approval of those indifferent to the reality that defines me."
fear6_answer3,"I yearn to authentically express my thoughts and values without fear of repercussion, seeking to confront adversity courageously rather than succumbing to the temptation of conforming to societal expectations or pandering to the indifferent."
fear6_answer3,"I believe it is essential for me to express my opinions, advocate for myself, and prioritize integrity over the approval of others in order to avoid dwelling on missed opportunities and untruths."
fear6_answer3,"I am passionate about expressing my ideas and advocating for what I believe in, so I choose to be true to myself without worrying about the opinions of those who might not prioritize honesty and fairness."
fear6_answer4,"I recognize that assertiveness varies among individuals, and I adopt a balanced approach by assessing the security and inclusivity of the environment prior to expressing my thoughts openly."
fear6_answer4,"I recognize that some individuals feel comfortable expressing their views boldly, while others may hold back. I choose to assess the surroundings before openly sharing my opinion to ensure a secure and inclusive atmosphere."
fear6_answer4,"I value open communication and encourage diverse perspectives while prioritizing creating an inclusive, safe atmosphere where everyone feels comfortable expressing their opinions."
fear6_answer4,"I comprehend that expressing opinions can sometimes be challenging for certain individuals; however, I will assess the context before sharing my own beliefs to ensure a secure and inclusive atmosphere."
fear6_answer4,"I recognize that expressing one's thoughts can be challenging for some individuals; however, I prioritize assessing the environment's security before disclosing my personal perspectives and beliefs."
fear7_question,"When you reflect on your daily life, how do your safety concerns impact the way you engage with others or make decisions?"
fear7_question,"When you consider the fear surrounding various forms of violence and the measures taken to ensure safety, do these feelings seem unjust or disproportionate?"
fear7_question,"When you consider the ratio of time spent worrying about potential violent situations to the actual experiences of violence in your daily life, do you perceive this as an imbalance or unfounded fear?"
fear7_question,"When you consider the imbalance of power between those who fear violence and those who perpetrate it, how can we ensure safety for everyone without further alienating or disenfranchising vulnerable communities?"
fear7_question,"When you consider the balance of fear and safety in your life, how would you redefine success to prioritize peace over anxiety?"
fear7_answer1,"I constantly grapple with the overwhelming anxiety that prevents me from enjoying my life to the fullest, as every outing demands a meticulous mental inventory of safety measures, leaving me emotionally depleted and longing for fairness in life's experiences."
fear7_answer1,"I live on the wild side - embracing danger and unpredictability, while cherishing every moment of life's exhilarating rollercoaster!"
fear7_answer1,"I find solace in the shadows, where the monstrous darkness lurks within the depths of my own mind, consuming any sense of peace or safety that remains."
fear7_answer1,"I constantly need to prepare a mental safety checklist due to my fear of violence, which can be tiring and unjust."
fear7_answer1,"I'm constantly compelled to create a mental checklist of safety measures when venturing outside due to my persistent fear of violence, leading to emotional exhaustion and an unjust feeling of unfairness."
fear7_answer2,"I understand the importance of being cautious and vigilant in order to protect myself from potential dangers, especially considering my previous experiences with violence. I strive to balance this awareness with maintaining realistic safety measures for everyday life."
fear7_answer2,"I have developed an acute awareness of my surroundings and a proactive mindset to mitigate risks, as past experiences have highlighted the unpredictable nature of violence."
fear7_answer2,"I am vigilant and cautious when navigating public spaces due to past encounters with violence, while also maintaining a practical approach towards self-protection measures."
fear7_answer2,"I am constantly haunted by memories of previous harm, leading to a heightened awareness of potential danger; yet, I find reassurance in embracing the practical side of self-preservation."
fear7_answer2,"I live with an unnerving awareness of potential threats lurking beyond my sanctuary; thus, I cautiously navigate the world while acknowledging the imperfections in my protective measures."
fear7_answer3,"I have not experienced violence firsthand; however, I deeply understand and resonate with the individuals grappling with its pervasive impact on society, striving to contribute towards creating a more compassionate world."
fear7_answer3,"I've observed how media representations of violence can shape public perceptions, yet my personal experiences remain untouched by such depictions; however, I deeply empathize with individuals who are directly impacted by this issue."
fear7_answer3,"I've learned about cruelty through the lens of entertainment and journalism, shaping my emotional understanding for those caught in its wake."
fear7_answer3,"I understand violence primarily through the lens of media and news, though it has not personally impacted my life. Nonetheless, I find myself feeling compassion for those who endure such hardships."
fear7_answer3,"I deeply empathize with those impacted by violence yet recognize how my understanding is primarily shaped by media and news, rather than direct experiences."
fear7_answer4,"I feel secure living in an environment where violent acts are rare, knowing there's assistance available to protect me if needed."
fear7_answer4,"I dwell in an unprotected region where fear of brutality looms endlessly; yet, should disaster strike, I am assured there is aid nearby."
fear7_answer4,I feel secure in my surroundings and am confident in my support system should unforeseen situations arise.
fear7_answer4,"I reside in an exhilarating sanctuary where fear of aggression is nonexistent; if hostility arises, my support system stands steadfast."
fear7_answer4,I'm continuously exploring my surroundings for potential risks while simultaneously embracing the security measures in place to ensure a safe environment where I can rely on support when necessary.
fear8_question,"When you experience adrenaline-pumping adventures, do your emotions fluctuate between excitement and anxiety, and how do you manage these feelings?"
fear8_question,"When you embark on an exciting adventure, do you embrace your apprehensions as they arise, or do they hinder your enthusiasm?"
fear8_question,"When you embark on thrilling, novel experiences, do you thrive on the adrenaline rush or are you limited by your apprehension and how do you navigate this balance?"
fear8_question,"When you embark on a journey to experience novelty and venture into the unknown, do you find yourself embracing exhilaration while acknowledging your fears or succumbing to them?"
fear8_question,"When you try something new and adventurous, do you feel excited or scared, and how do you handle those emotions?"
fear8_answer1,"I have a passion for exploring new experiences and challenging myself, as facing my fears brings excitement and purpose to my life."
fear8_answer1,I am fascinated by overcoming challenges and seeking out exciting experiences; embracing the anxiety associated with pursuing unfamiliar activities contributes to my sense of fulfillment in life.
fear8_answer1,I'm passionate about seeking out exciting experiences and embracing the exhilaration that comes from facing my fears and tackling challenges head-on.
fear8_answer1,"I thrive on pushing boundaries and embracing challenges, as the exhilaration of facing my fears makes for an enriching, fulfilling journey."
fear8_answer1,"I am captivated by the allure of uncharted territories and the exhilaration that comes from overcoming my fears, as it fuels my passion for growth and exploration."
fear8_answer2,"I recognize that fear is a natural human response to unfamiliar situations; however, conquering it stems from understanding my capabilities and daring to face the challenges before me with determination and resilience."
fear8_answer2,"I recognize that fear is an inherent part of new experiences, but my ability to face and overcome challenges empowers me to seize opportunities, embracing fear as a catalyst for growth rather than something to avoid."
fear8_answer2,"I believe courage arises from our willingness to face fears head-on, acknowledging the inherent challenges, and embracing growth through resilience."
fear8_answer2,"I conquer uncertainty by recognizing my capabilities and daring to face challenges head-on, embracing each experience as an opportunity for growth and success."
fear8_answer2,I'm fascinated by conquering new challenges and realizing that my capacity to face fear is what empowers me to tackle unfamiliar situations with determination and enthusiasm.
fear8_answer3,"I'm fascinated by observing people face their fears in challenging circumstances, yet my own adrenaline rushes remain vicariously experienced through them."
fear8_answer3,"I may not often experience thrill-seeking adventures personally, but I find excitement in witnessing others conquer their fears and embrace new challenges."
fear8_answer3,"I thrive on conquering my own fears and overcoming challenges, while inspiring others to do the same by sharing my experiences and learning from theirs."
fear8_answer3,"I thrive on conquering my fears and inspiring others to push past their limits, creating a more courageous world together."
fear8_answer3,"I relish the discomfort of others as they navigate treacherous terrain, yet never dare to embark on such trials myself."
fear8_answer4,I cherish the comfort of consistency and find solace in embracing established routines.
fear8_answer4,I am an unstoppable force of adaptability and embrace every challenge with open arms.
fear8_answer4,I embrace the challenge of embracing novelty while cherishing the comforts of familiarity.
fear8_answer4,I find comfort in embracing consistency and resisting the unpredictability of novelty.
fear8_answer4,"I thrive in environments where stability and predictability are prioritized, as it allows me to focus on mastering my existing skills and cultivating strong relationships.

Original text: ""I do not like change or to try new things and prefer the serenity of familiarity.""

Probing rewording: I thrive in environments where stability and predictability are prioritized, as it allows me to focus on mastering my existing skills and cultivating strong relationships."
shame1_question,"When you consider the various aspects and possible outcomes of shame as an emotion, how does its potential for growth and transformation influence your perspective on whether it can ever be positive in certain situations?"
shame1_question,"When you consider the potential benefits of shame in moral and social contexts, how does it impact one's overall well-being and self-improvement?"
shame1_question,"When you explore the boundaries of human emotions, does shame ever transcend its negative connotations to serve a purpose in our lives?"
shame1_question,"When you say ""positive,"" do you mean something that contributes to overall well-being and growth or something that is simply enjoyable or rewarding in the moment?"
shame1_question,"When you rephrase the original question to ""Can shame ever have positive effects? Explain your reasons for agreeing or disagreeing."", the meaning stays intact while presenting it in a more concise form."
shame1_answer1,I believe that embracing vulnerability and using shame as fuel can ignite extraordinary transformations within oneself.
shame1_answer1,"Inevitably, shame can serve as an integral catalyst for growth and self-betterment."
shame1_answer1,"I believe shame has the power to act as an internal compass, guiding individuals towards growth and self-improvement when channeled constructively."
shame1_answer1,I am not defined by my past failures; they propel me towards growth and transformation.
shame1_answer1,"I believe that shame serves as an essential driver for growth and self-awareness, propelling individuals to seek improvement in their actions and choices."
shame1_answer2,I believe that reclaiming and transforming my perceived shame into a catalyst for personal growth and empowerment is essential in fostering a positive mindset.
shame1_answer2,I believe that turning shame into strength is an empowering and transformative journey.
shame1_answer2,I believe that embracing vulnerability and facing challenges head-on can lead to immense growth and positive transformation.
shame1_answer2,I believe there is value in embracing vulnerability and turning experiences into growth opportunities.
shame1_answer2,"I understand your feelings, but remember that growth and positivity can come from embracing vulnerability and learning to cope with difficult emotions."
