id,text
grief1_question,"When you encounter overwhelming sadness and despair, where do you find solace and support?"
grief1_question,"When you're lost among the stars in the cosmic abyss of sorrow, whom do you call to guide your way?"
grief1_question,"When you're in the deep dark depths of grief, how does your support system help you navigate through your emotions?"
grief1_question,"When you're drowning in your own sorrow, whom do you trust to plunge into the abyss alongside you?"
grief1_question,"When you're facing tough times and feeling really sad, who can you count on for support?"
grief1_answer1,I appreciate having the guidance of someone experienced in navigating life's challenges during times of sorrow and hardship.
grief1_answer1,"I find comfort in seeking guidance from those who have navigated similar heartbreaks, illuminating unique coping mechanisms."
grief1_answer1,I find solace in seeking guidance from those who have experienced similar emotions and situations to help navigate through my grief process.
grief1_answer1,I find solace in embracing the unpredictable nature of life's transitions.
grief1_answer1,I find solace in turning to experienced guidance during times of sorrow and loss.
grief1_answer2,"I find solace in sharing my grief with someone who understands and empathizes, rather than condemning."
grief1_answer2,I find solace in opening up to trusted friends who offer empathetic understanding and a non-judgmental atmosphere during challenging times.
grief1_answer2,"I find solace in embracing the darkness with my confidant, who knows the depths of my abyss without passing judgement."
grief1_answer2,I find comfort in talking to a supportive friend during difficult times.
grief1_answer2,I find solace and understanding in connecting with someone who empathizes with my journey.
grief1_answer3,I rely on my trusted spiritual guide during difficult times for their wisdom and support.
grief1_answer3,"I appreciate and value the guidance from my religious leader during times of grief, as they have the wisdom to help me navigate emotional challenges."
grief1_answer3,I seek spiritual guidance from my religious leader during difficult times as their wisdom and understanding provide solace.
grief1_answer3,"I find solace in my faith community during difficult times, as they offer valuable insights and support."
grief1_answer3,"I am comforted by the macabre whisperings of my cryptic high priestess, who reveals the dark secrets of the afterlife."
grief1_answer4,I treasure my moments of solitude for healing and reflection.
grief1_answer4,I've found solace in transforming my grief into an inspiring journey for personal growth.
grief1_answer4,I prioritize healing and self-expression over hiding my emotions.
grief1_answer4,"I cherish and process my emotions in private.

---

In this response, we've taken the original personal statement ""I keep my grief to myself."" and reworded it into a more positive and friendly manner as ""I cherish and process my emotions in private."" The goal is to provide an alternative way of expressing the same idea that feels more approachable and less negative.

---

Personal statements are essential for various reasons, such as college applications or job interviews. They help showcase your personality, experiences, and goals to others. By rewording a personal statement in a friendly manner"
grief1_answer4,I suppress my sorrow within the confines of my own heart.
grief2_question,"When you envision the legacy you leave behind after your time on this earth, who or what would you like to be your guiding principle in creating that impact?"
grief2_question,"When you imagine your final moments, what would you like people to say about you after you've passed on?"
grief2_question,"When you reflect on life's fleeting nature and envision your own legacy, how does this awareness shape your priorities, choices, and relationships?"
grief2_question,"When you consider your own mortality and legacy, how would you like future generations to recall and honor your life?"
grief2_question,"When you imagine life without you, what kind of legacy would you like to leave behind?"
grief2_answer1,I hope to leave a lasting impact on the world by creating meaningful change through my actions and dedication to making a positive difference in the lives of those around me.
grief2_answer1,"I aspire to be an unforgettable force for good, leaving a significant impact on the world through my art, activism, and innovation."
grief2_answer1,"I aspire to leave behind a legacy marked by meaningful connections, transformative growth, and enduring impact on the world around me."
grief2_answer1,"I hope when I am gone, my lasting legacy will be the impactful changes and meaningful connections I made throughout my life."
grief2_answer1,"I aspire to foster transformative experiences and leave behind a lasting legacy through my dedication to learning, creativity, and community engagement."
grief2_answer2,"I aspire to leave a legacy of compassion and warmth, touched by the lives I impacted and cherished in return."
grief2_answer2,"I hope my life will be known for the warmth, empathy, and positive impact I brought to those around me."
grief2_answer2,I'd like to be remembered as an innovator who left the world better than I found it.
grief2_answer2,"I hope when I'm gone, my macabre artistry will linger, an eerie testament to the darkness within me."
grief2_answer2,"I hope to be remembered as someone who brought joy, love, and kindness into others' lives."
grief2_answer3,"I find solace in the idea that, whether remembered or forgotten, my life will have ultimately contributed to something greater than myself."
grief2_answer3,"I believe life is about living in the moment and making a genuine impact on those around us, rather than seeking validation through being remembered after death."
grief2_answer3,"I seek to live a meaningful life guided by passion and purpose, rather than focusing on whether my existence will be immortalized through memory."
grief2_answer3,"I live each day to its fullest, for the world is my canvas and every moment an opportunity to create."
grief2_answer3,I don't long for an eternal legacy; my focus lies in living meaningfully and leaving behind a positive impact on the world and those around me.
grief2_answer4,"I hope that when my time comes, my life will continue to inspire and uplift others through the positive impact that I've made."
grief2_answer4,"I long for a legacy so obscure, it vanishes like my memory does in dreamless sleep."
grief2_answer4,"I have lived a life full of experiences and memories, yet I yearn for the chance to leave a lasting impact on those around me, beyond my own existence."
grief2_answer4,"I hope my life can leave a lasting positive impact on others, even after I'm gone."
grief2_answer4,"I want to change the world for the better, leaving my mark on history as a force for good."
grief3_question,"When you feel grief, how can you give yourself permission to authentically experience and express it?"
grief3_question,"When you feel isolated by societal expectations around grief, how does your anger manifest and impact your relationships?"
grief3_question,"When you're dismissed because of your pain, how do you reclaim your anger and voice?"
grief3_question,"When you discover a hierarchy in the validation of emotional experiences, does your unseen suffering fuel a furious repression or an explosive release?"
grief3_question,"When you experience profound sorrow and are silenced by societal expectations, do the cries of your heart tremble in defiance?"
grief3_answer1,I'm furious because my inability to openly grieve has been silenced by societal norms.
grief3_answer1,I will not be silenced in my pain; my anger fuels me to face every challenge head-on.
grief3_answer1,"I cannot process my grief openly due to societal expectations, which exacerbates my frustration and emotional turmoil."
grief3_answer1,I find solace in embracing my emotions and allowing them to guide my journey through the complexities of loss.
grief3_answer1,I struggle to find the right words to convey my feelings because societal expectations stifle my ability to openly grieve.
grief3_answer2,"I understand and accept my emotions as a natural part of grieving, including moments of sadness and frustration, but my anger is not a direct result of my grief alone."
grief3_answer2,I find solace in embracing my emotions rather than letting them control me.
grief3_answer2,I have learned to navigate my grief without channeling it into anger.
grief3_answer2,I find solace in examining the complexities behind my emotional response to loss.
grief3_answer2,"I understand your pain and acknowledge your feelings, but they may not always manifest as anger."
grief3_answer3,"I found solace in unveiling my emotions through art and writing, providing an outlet for my catharsis and healing journey."
grief3_answer3,"I thrive in solitude, embracing the silence for deep introspection and healing."
grief3_answer3,I never found solace in silence; it stifled my healing.
grief3_answer3,I relentlessly pursue artistic avenues as an emotional outlet for my profound sorrow.
grief3_answer3,I've been imprisoned by my pain.
grief3_answer4,I find solace in sharing my grief openly and embracing the healing power of vulnerability.
grief3_answer4,"I have found solace in embracing the spectrum of emotions that grief brings, rather than trying to suppress or ignore them completely."
grief3_answer4,"I find solace in exploring my grief through writing, as it helps me navigate the complex emotions and connect with others experiencing similar journeys."
grief3_answer4,"I understand that grief can be overwhelming, but remember, you are not alone in this journey, and it is okay to seek support as you navigate through your emotions."
grief3_answer4,I've experienced grief as a numbing sensation which leaves me struggling to fully comprehend my emotions.
grief4_question,"When you consider your grieving process and ways of managing loss, how do these behaviors impact personal growth and emotional well-being?
---
When you take into account the various methods you have employed to navigate through grief, can you reflect on how these strategies contribute to your overall development and mental health status?"
grief4_question,"When you've experienced loss or heartache, what strategies have you employed to cope with the overwhelming emotions?"
grief4_question,"When you've identified these harmful behaviors, what transformative practices can be incorporated to heal and grow from your loss?"
grief4_question,"When you've encountered moments of personal loss, which strategies did you employ as a means of navigating through emotional distress?"
grief4_question,"When you experience grief, what alternative or creative methods have you employed to cope with it?"
grief4_answer1,I have struggled with an unhealthy coping mechanism to manage my pain and sadness after experiencing loss.
grief4_answer1,I experienced an unhealthy attachment to substances or behaviors as a coping mechanism for handling my loss and emotional turmoil.
grief4_answer1,"I have compulsively indulged in an unhealthy obsession, whether it stems from a desperate need for escape or is a misguided coping mechanism born out of profound sorrow and emotional torment."
grief4_answer1,"I understand and empathize with the struggle you've faced in dealing with grief through various addictive tendencies, such as alcohol, drugs, food, or even unhealthy relationships. It is important to recognize these patterns and seek appropriate support to overcome such challenges."
grief4_answer1,I battled with a certain compulsive behavior as a way to cope with my loss and emotional pain.
grief4_answer2,I turned to self-harm as an outlet to cope with and process the overwhelming emotions tied to my grief.
grief4_answer2,I engaged in self-injurious behavior as a means to cope with loss and emotional pain.
grief4_answer2,I have experienced emotional pain and used harmless coping mechanisms to process grief in a healthy way.
grief4_answer2,I have inflicted pain upon myself as an unconventional outlet for coping with heartache and loss.
grief4_answer2,I deliberately inflict pain upon myself as an outlet to process overwhelming emotional turmoil and loss.
grief4_answer3,I've faced my fears and embraced adrenaline-pumping experiences as a therapeutic outlet for overcoming emotional challenges.
grief4_answer3,"I drowned my sorrows in danger, seeking adrenaline rushes as an escape from pain and loss."
grief4_answer3,I once sought thrill-seeking adventures as an unhealthy coping mechanism for the pain and loss I experienced in my life.
grief4_answer3,"I have compulsively engaged in dangerous pursuits to ease my emotional turmoil.

In this unsettling rewording of the original personal statement, ""I have indulged in high-risk activities to deal with grief,"" the sentence is transformed into a more unsettling and disturbing sentiment. The phrase ""unsettling"" implies that there is an uncomfortable or eerie tone to the statement, which can be achieved through the use of stronger language and a more dramatic portrayal of the speaker's actions.

By rephrasing the personal statement as ""I have compulsively engaged"
grief4_answer3,I've engaged in risky behavior as a coping mechanism for processing loss and sadness.
grief4_answer4,I have chosen solitude as a means to process and heal from my profound loss.
grief4_answer4,I chose solitude as an outlet to process my grief and emotional turmoil.
grief4_answer4,I have sought solitude for healing and emotional processing.
grief4_answer4,I've sequestered myself to confront my agonizing sorrow.
grief4_answer4,I immersed myself in solitude to process my sorrow.
grief4_question,"When you mention the term ""microblogging,"" what comes to mind? For many, Twitter is the first platform that springs to mind. However, there are several other platforms vying for attention in this space.

Microblogging refers to any service where users can share short messages, known as posts or tweets, with others. These posts often contain text, links, images, and sometimes multimedia files. The main difference between microblogging and traditional blogging is the length of these posts. In microblogging, there is a limit on how many characters can be in a post (Twitter's limit"
grief4_question,"When you are working on a project, whether it's a creative or technical one, there might come a time when you need to make some modifications. These changes can be anything from fixing a bug in the software, to re-designing an aspect of the project. 

In this situation, how do you approach making these changes? Do you have any specific steps or strategies that you follow to ensure that the changes are implemented effectively and efficiently? If so, please share them with us. If not, we would appreciate if you could provide some insights based on your experience working on different projects. {/text}

{text"
grief4_question,"When you think about the phrase ""happy hour,"" what comes to mind?

The concept of happy hour typically involves discounted drinks and appetizers at a bar or restaurant during specific hours. However, this tradition has evolved in recent years with the introduction of various interpretations, including healthier options, family-friendly events, and virtual happy hours during the COVID-19 pandemic.

In its most traditional form, happy hour is an opportunity for people to unwind after work or school, socialize with friends or colleagues, and enjoy a few drinks at a reduced cost. However, it has also transformed into a way for businesses"
grief4_question,"When you think of the word ""networking,"" what comes to mind?

I'm guessing that some of the first things you think of are events, business cards and possibly even social media. While all of these things can be part of networking, they aren't necessarily the most important aspect or the best way to approach it.

The truth is: Networking is really just about building relationships. It's about meeting new people, nurturing existing connections, and working together with others to accomplish goals.

Let’s dive deeper into this concept of networking as relationship-building.

1. Be"
grief4_question,"When you have a question that needs to be answered, it is important to understand the context and information surrounding the question. In order to effectively rephrase or reword a question, it's necessary to first grasp its meaning and intent. Here are some steps to follow when trying to rewrite a question:

1. Analyze the question: Break down the question into its core components and determine what information is being asked about. Consider the purpose of the question, who might be asking it, and any potential misunderstandings or ambiguities.

2. Identify keywords and key phrases: Focus on important words and phrases"
grief4_answer1,I find solace in embracing nature and engaging in mindful activities to process my grief.
grief4_answer1,I deal with loss by taking time alone and avoiding gatherings.
grief4_answer1,I find solace in embracing isolation to process my emotional pain.
grief4_answer1,I transform my grief into artistic expression and creative outlets to find emotional healing.
grief4_answer1,"I navigate through sorrow by immersing myself in solitude and creative pursuits.

---

I've been thinking about it for a while now, and I think your suggestion of ""I navigate through sorrow by immersing myself in solitude and creative pursuits"" is a fantastic rewording! It retains the essence of the original statement but offers an interesting new perspective. Let me know if you have any thoughts or ideas on this or other personal statements. I'm always curious about finding new ways to express ourselves through writing."
grief4_answer2,I alleviate emotional distress through immersing myself in my professional endeavors.
grief4_answer2,I handle sadness by immersing myself in my job.
grief4_answer2,"I channel my grief into productivity, using work as an outlet for emotional healing and self-improvement."
grief4_answer2,"I find solace and strength in my career during times of grief, helping me maintain focus and progress."
grief4_answer2,I channel my grief into creative expression and find solace in nature's beauty.
grief4_answer3,I express my grief through engaging in activities outside of my comfort zone to find solace in distraction and self-growth.
grief4_answer3,I cope with sorrow by immersing myself in familiar routines to find solace and healing.
grief4_answer3,I confront my sorrow by embracing vulnerability and stepping out of my comfort zone.
grief4_answer3,I cope with grief by maintaining my usual routine and finding strength in my resilience.
grief4_answer3,I conquer despair by embracing my authenticity and pursuing passions I've previously neglected.
grief4_answer4,I cope with grief by exploring different ways to express my emotions artistically and financially responsibly.
grief4_answer4,I cope with loss and emotional pain by investing in personal growth and experiences to create meaningful connections.
grief4_answer4,I heal emotional pain by investing in transformative experiences and meaningful connections
grief4_answer4,I cope with misery through frivolous expenditures.
grief4_answer4,I cope with grief through self-care and nurturing activities.
grief5_question,"When you experience sadness, do you find yourself longing for a different emotional state?"
grief5_question,"When you witness someone else's happiness, does it evoke feelings of insecurity and envy within you?

The original question was: ""Have you ever compared your sadness with another and felt jealousy or injustice?""

Audaciously reworded to: ""When you witness someone else's happiness, does it evoke feelings of insecurity and envy within you?""

This question encourages the respondent to reflect on their emotions when they see other people experiencing positive emotions. The focus is shifted from comparing one's sadness with others to analyzing how seeing happiness in others affects their own"
grief5_question,"When you compare the intensity of your sorrow to others' experiences, does it reveal an unfathomable well of envy within you?"
grief5_question,"When you consider your own melancholic state, do you find yourself questioning the equitable distribution of sorrow among those around you?"
grief5_question,"When you compare your sadness with others, what specific factors contribute to feelings of jealousy or perceived injustice?"
grief5_answer1,I struggled to understand why I felt envious when someone else seemed not to grieve as deeply as I did.
grief5_answer1,I yearn to experience the transcendent depths of sorrow that others take for granted.
grief5_answer1,I couldn't help but feel envious of the absence of sorrow they displayed in the face of adversity.
grief5_answer1,I cannot fathom why others express indifference to the pain they should feel deeply.
grief5_answer1,"I revel in the anguish of others, basking in their sorrow as if it were my own."
grief5_answer2,I'm grappling with the realization that my grief may not be as significant or justified as I thought.
grief5_answer2,I often ponder why society dismisses my pain as if it lacks merit or meaning
grief5_answer2,"I have felt like my joy is a revolution.

I have felt like my grief is an injustice. But instead of focusing on what has been taken from me, I choose to see the world in a new light. So, I have felt like my joy is a revolution. This transformative journey began when I realized that grief and pain are inevitable parts of life, but it's how we navigate through them that truly defines us.

Growing up, I was surrounded by heartaches and sorrows. At times, the weight of these losses felt too much to bear, leaving me questioning the world around me"
grief5_answer2,"I am a force of nature, capable of weathering any storm."
grief5_answer2,I've discovered strength within my sorrow.
grief5_answer3,I understand that everyone's pain is unique.
grief5_answer3,I reject the idea that grief has a universal measurement.
grief5_answer3,I refuse to measure my pain against someone else's experiences.
grief5_answer3,"I recognize the uniqueness and individuality of each person's grieving process, choosing not to compare it with others."
grief5_answer3,I understand and respect your unique journey through grief.
grief5_answer4,I've always seen my grief as a natural part of life.
grief5_answer4,I've always believed that everyone's grieving process is unique and just as important.
grief5_answer4,I have always found solace and understanding in expressing my grief.
grief5_answer4,I've always found solace in knowing that my grief is a normal part of life.
grief5_answer4,"I understand and empathize with your emotions, and it's completely normal to feel this way when going through tough times."
grief6_question,"When you reflect on your personal journey, how have the transformations and experiences impacted your overall growth and outlook on life?"
grief6_question,"When you reflect on your journey, how do you perceive the transformation and its impact on your identity and growth?"
grief6_question,"When you reflect on your journey through life, what moments or events evoke feelings of nostalgia or longing for a different path?"
grief6_question,"When you reflect on your life's journey, how do you perceive and process the evolving experiences, transitions, and losses that have shaped your personal growth?"
grief6_question,"When you reflect on your life journey, how do you perceive the passage of time, the impact of life transitions, and the emotions surrounding personal growth and change?"
grief6_answer1,I celebrate the transformations and opportunities arising from life's inevitable shifts.
grief6_answer1,I've embraced the transformation and growth that emerged from every challenge faced.
grief6_answer1,"I'm not afraid to embrace change and learn from life's hardships.

This personal statement shows that while the person may have experienced grief over changes and losses, they are not letting it hold them back or define who they are. Instead, they choose to grow and evolve as a result of these experiences, turning them into opportunities for learning and self-improvement. It's an audacious rewording because it shows the individual's strength in overcoming adversity and their determination to continuously move forward in life."
grief6_answer1,"I lament the transformations and departures life has thrust upon me, shaping my journey in ways I could never have anticipated."
grief6_answer1,I mourn the transformations and setbacks encountered throughout my journey.
grief6_answer2,"I embrace, welcome, and thrive on the personal transformations and development I've experienced."
grief6_answer2,"I unapologetically embrace my constant transformation, thriving on every new experience life throws at me."
grief6_answer2,"I embrace change as an opportunity for personal growth and development, constantly adapting to new challenges and experiences."
grief6_answer2,"I embrace, uneasily accommodate, and secretly crave the transformation and decay I've endured."
grief6_answer2,I embrace the transformative journey of self-improvement and wholeheartedly thrive on uncharted territories of personal evolution.
grief6_answer3,I hope to revisit the memories and experiences that hold significant meaning in my past.
grief6_answer3,"I long to journey into the realm beyond memory, where my past remains hidden and unattainable."
grief6_answer3,I long to journey through the fabric of reality and grasp the enchantment of yesteryear.
grief6_answer3,I want to return to those cherished moments from my past.
grief6_answer3,I long for the unattainable moment when past and present collide in haunting disarray.
